bib_id,title,note_num,note_text,note_type,record_total_notes,record_typed_notes,w_count,o_count,a_count,aw_count,ow_count,source
13868930,880-02 Dalāʼil al-khayrāt wa-shawāriq al-anwār fī dhikr al-ṣalāh ʻalá al-Nabī al-mukhtār : manuscript / Muḥammad ibn Sulaymān al-Jazūlī.,3,"Incipit: ""Bismillāh al-Raḥmān al-Raḥīm. al-Ḥamdu lillāh alladhī hadānā lil-īmān wa-al-Islām, wa-al-ṣalāh wa-al-salām ʻalá Nabīyihi alladhī istanqadhanā bi-hi min ʻibādat al-awthān wa-al-aṣnām, wa-ʻalá ālihi wa-aṣḥābihi al-nujabāʼ al-bararah al-kirām. Hādhā, fa-al-gharaḍ fī hādhā al-kitāb dhikr al-ṣalāh ʻalá al-Nabī, ṣallá Allāh ʻalayhi wa-sallam, wa-faḍāʼilihā, nadhkuruhā, maḥdhūfat al-asānīd, li-yashula ḥifẓuhā ʻalá al-qāriʼ, wa-hiya min ahamm al-muhimmāt li-man yurīdu al-qurb min Rabb al-Arbāb, bi-Kitāb Dalāʼil al-khayrāt wa-shawāriq al-anwār fī dhikr al-ṣalāh ʻalá al-Nabī, ṣallá Allāh ʻalayhi wa-sallam, ibtighāʼan li-marḍāt Allāh taʻālá wa-maḥabbat Rasūlih al-karīm Muḥammad, ṣallá Allāh ʻalayhi wa-sallam ...""",w,10,7,1,4,2,0,0,zoe
13971037,880-01 Taʻlīqāt ʻalá Sharḥ Faḍāʼil Ramaḍān : manuscript.,3,"Incipit: ""Bismillāh al-Raḥmān al-Raḥīm. Wa-ṣallá Allāh ʻalá Sayyidinā Muḥammad, wa-ʻalá ālihi wa-ṣaḥbihi wa-sallam. 'Yā ayyuhā alladhīn āmanū kutiba ʻalaykum al-ṣiyām'. Atá bi-Yāʼ al-nidāʼ al-mawḍūʻah li-nidāʼ al-baʻīd, wa-in kāna al-munādá qarīban, idh qad tustaʻmalu fīhi li-tanzīlihi manzilat al-baʻīd lil-iʻtināʼ bi-al-madʻw la-hu wa-ziyādat al-ḥathth ʻalayhi. Wa-qāla al-Bayḍāwī ʻinda qawlihi: 'Yā ayyuhā al-nās uʻbudū rabbakum', mā naṣṣuhu: Wa-yā ḥarf wuḍiʻa li-nidāʼ al-baʻīd, wa-qad yunādá bi-hi al-qarīb tanzīlan la-hu manzilat al-baʻīd'. 'Immā' li-ʻaẓamatihi, ka-qawl al-dāʻī 'Yā Rabb wa-Yā Allāh', wa-Huwa aqrab ilayhi min ḥabl al-warīd, wa-lighaflatihi wa-sūʼ fahmih, aw lil-iʻtināʼ bi-al-madʻw la-hu wa-ziyādat al-ḥathth ʻalayhi. Intahá ...""",w,14,7,1,4,2,0,0,zoe
13971040,880-02 Munyat al-muṣallī wa-ghunyat al-mubtadiʼ : manuscript / Sadīd al-Dīn al-Kāshgharī.,3,"Incipit: ""Bismillāh al-Raḥmān al-Raḥīm. al-Ḥamdu lillāh Rabb al-ʻĀlamīn. Wa-al-ṣalāh ʻalá Rasūlihi Muḥammad, khātim al-nabīyīn. Wa-al-ṣalāh wa-al-salām ʻalá jamīʻ al-anbiyāʼ wa-al-mursalīn. Iʻlamū waffaqakum Allāh wa-īyānā inna anwāʻ al-ʻulūm kathīrah, wa-ahamm al-anwāʻ bi-al-taḥṣīl masāʼil al-ṣalāh. Fa-lammā raʼytu raghbat al-muqtabisīn fī taḥṣīlihā, iltaqaṭtu mā kathura wuqūʻuhu, wa-mimmā lā budda lahum minhu min muṣannafāt al-mutaqaddimīn wa-min mukhtārāt al-mutʼakhkhirīn, naḥwa al-Hidāyah, wa-al-Muḥīṭ, wa-Sharḥ al-Asbījābī [?], wa-al-Ghunyah, wa-al-Multaqaṭ, wa-al-Dhakhīrah, wa-Fatāwá Qāḍī Khān, wa-Jāmiʻayhi. Wa-sammaytuhu 'Munyat al-muṣallī wa-ghunyat al-mubtadī'. Asʼalu Allāh taʻālá an yajʻala mā iʻtamadtuhu khāliṣan li-wajh Allāh wa-mukaffiran li-dhunūbī bi-faḍlihi wa-raḥmatih ...""",w,10,7,1,4,2,0,0,zoe
13971049,880-02 Ghāyat al-maqṣūd li-man yataʻāṭá al-ʻuqūd : manuscript / Abū al-ʻAbbās Aḥmad ibn ʻUmar al-Dayrabī al-Shāfiʻī.,3,"Incipit: ""Bismillāh al-Raḥmān al-Raḥīm, wa-bi-hi thiqatī. al-Ḥamdu lillāh alladhī ḥarrama al-sifāḥ wa-aḥalla al-nikāḥ lil-khāṣṣ wa-al-ʻāmm, wa-bayyana al-ḥalāl wa-al-ḥarām min al-nisāʼ, ʻalá lisān man arsalahu raḥmatan lil-anām. Aḥmaduhu, subḥānuhu wa-taʻālá, ʻalá mā manaḥanā min al-anʻām, wa-ashhadu an lā ilāha illā Allāh waḥdahu, lā sharīka lah, al-Malik al-ʻallām. Wa-ashhadu anna Sayyidanā Muḥammadan ʻabdahu wa-rasūlah ashraf al-anām, ṣallá Allāh ʻalayhi wa-sallam, wa-ʻalá ālihi wa-aṣḥābih, ṣalātan wa-salāman dāʼimayn bilā infiṣām. Ammā baʻd, fa-yaqūlu al-ʻabd al-faqīr al-muʻtarif bi-al-ʻajz wa-al-taqṣīr, Aḥmad al-Dayrabī al-Shāfiʻī al-Ghunaymī: Qad saʼalanī wālidī wa-baʻḍ al-ikhwān min al-anām, aḥsana Allāh lī wa-lahum ka-al-mabdaʼ al-khitām an aktuba shayʼan min al-masāʼil al-sharīʻah [al-sharʻīyah] al-mutaʻalliqah bi-al-nikāḥ ʻalá madhhab al-Shāfiʻī wa-Abī Ḥanīfah, fa-ajabtuhum ilá dhālik ...""",w,18,7,1,4,2,0,0,zoe
13971075,880-02 Mukhtaṣar Munyat al-muṣallī wa-ghunyat al-mubtadī : manuscript / Ibrāhīm ibn Muḥammad ibn Ibrāhīm al-Ḥalabī.,3,"Incipit: ""Bismillāh al-Raḥmān al-Raḥīm. al-Ḥamdu lillāh alladhī jaʻala al-ʻibādah maftaḥ al-saʻādah wa-maṭmaḥ al-siyādah wa-malmaḥ al-ḥusná wa-al-ziyādah, wa-jaʻala al-ṣalāh ʻamūd qiyāmihā wa-zarwat [wa-dharwat] sanāmihā wa-ʻumdat aḥkāmihā. Wa-al-ṣalāh wa-al-salām ʻalá afḍal khalqihi, Sayyidinā Muḥammad alladhī juʻilat fī al-ṣalāh qurrat ʻaynihi, wa-ʻalá ālihi wa-aṣḥābihi alladhīna fāzū min maʻdin al-dīn bi-lujaynihi wa-ʻaynih. Wa-baʻd, fa-yaqūlu al-muftaqir ilá Rabbihi al-ghanī, Ibrāhīm ibn Muḥammad ibn Ibrāhīm al-Ḥalabī: Qad kuntu sharaḥtu kitāb Munyat al-muṣallī sharḥan, wa-sammaytuhu bi-Ghunyat al-mutamallī, lākin raʼaytu fīhi baʻḍ al-iṭālah allatī awjabat lil-mubtadiʼīn wa-al-qāṣirīn al-malālah, fa-ajibu [fa-aḥbabtu] an akhtaṣira min farāʼid dalāʼilihi, wa-azīda fī fawāʼid masāʼilihi, tasʹhīlan lil-ṭālibīn, wa-tanwīlan lil-rāghibīn. Wa-Allāh subḥānuhu wa-taʻālá huwa al-mustaʻān ʻalá kull murād. Minhu al-mabdaʼ wa-ilayhi al-maʻād. Wa-huwa ḥasbī wa-niʻma al-wakīl.""",w,13,7,1,4,2,0,0,zoe
13971079,880-02 Itmām al-dirāyah li-qurrāʼ al-Nuqāyah : manuscript / Jalāl al-Dīn ʻAbd al-Raḥmān ibn Abī Bakr al-Suyūṭī.,3,"Incipit: ""Bismillāh al-Raḥmān al-Raḥīm. Wa-ṣallá Allāh ʻalá Sayyidinā Muḥammad wa-ālihi wa-ṣaḥbihi wa-sallam. al-Ḥamdu lillāh ʻalá niʻamihi al-sābighah al-shāmilah, wa-ashhadu an lā ilāha illā Allāh waḥdah, lā sharīka lah, shahādatan bi-al-najāh min al-aḥwāl kāfilah. Wa-ashhadu anna Muḥammadan ʻabduhu wa-rasūluh, dhū al-awṣāf al-jamīlah al-kāmilah, ṣallá Allāh ʻalayhi wa-ʻalá ālihi wa-ṣaḥbihi wa-man nāṣarahu wa-khālalah. Wa-baʻd, falammā ẓahar lī taṣwīb al-muliḥḥīn ʻalayya fī waḍʻ sharḥ ʻalá al-kurrāsah allatī sammaytuhā bi-al-Nuqāyah, wa-ḍammantuhā arbaʻata ʻashara ʻilman, wa-rāʻaytu fīhā ghāyat al-ījāz wa-al-ikhtiṣār, wa-awdaʻtu fī ṭayy alfāẓihā mā nasharahu al-nās fī al-kutub al-kibār, bi-ḥaythu lā yaḥtāju al-ṭālib ilá ghayrihā, wa-lā yuḥramu al-faṭin al-mutasāʼil li-daqāʼiqihā min khayrihā, bādartu ilá dhālika li-ʻumūm al-ʻāʼidah, wa-tamām al-fāʼidah, wa-ibrāzan li-mā anā bi-istikhrājihi aḥrá, idh ṣāḥib al-bayt adrá bi-mā fīhi. Wa-sammaytuhu 'Itmām al-dirāyah li-qurrāʼ al-Nuqāyah'. Wa-Allāh asʼalu al-tawfīq wa-al-hidāyah wa-al-riʻāyah ...""",w,14,7,1,4,2,0,0,zoe
13971086,880-02 Taqrīb al-fawāʼid wa-tasʹhīl al-maqāṣid : manuscript / ʻAlī ibn ʻAṭīyah al-Ḥamawī.,3,"Incipit: ""Bismillāh al-Raḥmān al-Raḥīm, wa-bi-hi nastaʻīn. Rabbi ishraḥ lī ṣadrī, wa-yassir lī amrī, wa-iḥlil ʻuqdatan min lisānī yafqahū qawlī. Rabbanā ātinā min ladunika raḥmatan, wa-hayyiʼ lanā min amrinā rashadan. Rabbi zidnī ʻilaman. al-Ḥamdu lillāh Rabb al-ʻĀlamīn, muqarrib al-baʻīd wa-musahhil al-shadīd, wa-al-ṣalāh wa-al-salām ʻalá Sayyidinā Muḥammad, Khātim al-Rusul, wa-sayyid al-ʻabīd, wa-ʻalá ālihi wa-ṣaḥbihi, wa-jamīʻ ʻibād Allāh min kull barrin rashīd, ṣalātan tūjibu li-qāʼilihā ladhdhat al-naẓar ilá wajh Allāh al-karīm yawm al-waʻīd. Ammā baʻd, faqad iltamasa minnī baʻḍ aṣdiqāʼī an akhtaṣira kitābanā 'Miṣbāḥ al-hidāyah wa-miftāḥ al-wilāyah', fa-raʼaytu anna fī dhālika khayran, in shāʼa Allāh, fa-ajabtuhu. Wa-min Allāh astamiddu al-tawfīq, wa-iyyāhu asʼalu al-hidāyah ilá sawāʼ al-ṭarīq, wa-aljaʼu ilayhi an yanfaʻafnī bi-hi wa-al-Muslimīn fī al-dārayn, wa-an yajʻalanā wa-sāʼir al-aḥibbah min khayr al-farīqayn ...""",w,14,7,1,4,2,0,0,zoe
13971090,880-02 al-Tathbīt ʻinda al-tabyīt : manuscript / Jalāl al-Dīn ʻAbd al-Raḥmān ibn Abī Bakr al-Suyūṭī.,3,"Incipit: ""Bismillāh al-Raḥmān al-Raḥīm. Wa-ṣallá Allāh ʻalá Sayyidinā Muḥammad wa-sallam. al-Ḥamdu lillāhi ʻalá al-Islāmi // wa-al-shukru lillāhi ʻalá al-inʻāmi. Wa-afḍalu al-ṣalāti wa-al-thanāʼi // ʻalá al-Nabīyi Khātim al-Anbiyāʼi. Wa-ālihi ahli al-nuhá wa-ṣaḥbi-hi // wa-jundihi ahli al-tuqá wa-ḥizbihi ...""",w,13,7,1,4,2,0,0,zoe
13971096,880-02 al-Ādāb al-sanīyah wa-al-afʻāl al-sharīfah al-marḍīyah al-qudsīyah li-man yurīdu sulūk ṭarīq al-Sādah al-khalwatīyah : manuscript / Muḥammad ibn Ḥasan al-Munayyir al-Samannūdī.,3,"Incipit: ""Bismillāh al-Raḥmān al-Raḥīm. Ḥamdan li-man jaʻala al-dhikr afḍal al-ʻibādāt, wa-jaʻala dhākirahu min afḍal al-barīyāt wa-al-makhlūqāt, wa-waʻadahum al-Jannah, wa-rafaʻa lahum fīhā aʻlá al-darajāt, wa-al-ṣalāh wa-al-salām ʻalá Sayyid al-Sādāt wa-ashraf al-mawjūdāt min ahl al-arḍ wa-al-samāwāt, alladhī man iqtafá atharahu wa-ʻamila bi-sunnatihi wa-salaka ṭarīqahu waṣala ilá Rabbihi wa-ṣāra min ahl qurbihi ... Wa-baʻd, fa-yaqūlu ḥammāl al-dhunūb wa-kathīr al-kurūb wa-al-lughūb ... Muḥammad ibn Ḥasan al-Shāfiʻī al-Khalwatī al-Munayyir al-shahīr bi-al-Samānūdī ... qad saʼalanī baʻḍ al-ikhwān ... an aḍaʻa sharḥan laṭīfan ʻalá manẓūmah naẓamtuhā tataʻallaqu bi-shayʼ min shurūṭ al-dhikr wa-al-ṭarīq wa-mā ʻalayhi ahl al-maʻrifah wa-al-ʻulūm wa-al-taḥqīq ... wa-sammaytuhu 'al-Ādāb al-sanīyah wa-al-afʻāl al-sharīfah al-marḍīyah al-qudsīyah li-man yurīdu ṭarīq al-Sādah al-khalwatīyah' ...""",w,12,7,1,4,2,0,0,zoe
14009435,880-02 Ḥall al-rumūz wa-mafātīḥ al-kunūz : manuscript / ʻIzz al-Dīn ʻAbd al-Salām ibn Aḥmad ibn Ghānim al-Maqdisī.,3,"Incipit: ""Bismillāh al-Raḥmān al-Raḥīm. Rabbi yassir. Qāla al-Shaykh al-Imām al-ʻālim al-ʻāmil al-ʻallāmah, jāmiʻ al-faḍāʼil wa-mūḍiḥ al-dalāʼil, baqīyat al-salaf al-ṣāliḥīn, quṭb al-ʻārifīn, ʻIzz al-Dīn ʻAbd al-Salām ibn al-Shaykh al-Imām al-zāhid, al-wariʻ al-ʻābid al-taqī, shaykh al-mashāyikh Aḥmad ibn al-Shaykh Ghānim al-Maqdisī, nafaʻa Allāh al-Islām bi-barakātih, wa-aʻāda ʻalayhim min ṣāliḥ daʻawātih wa-khalawātih; Innahu ʻalá mā yashāʼu qadīr wa-bi-al-ijābah jadīr: al-Ḥamdu lillāh alladhī fataḥa bi-mafātīḥ al-ghuyūb aqfāl al-qulūb, wa-rafaʻa ḥujub al-sarāyir, wa-jalā abṣār al-baṣāʼir, fa-ẓahara mā huwa maḥjūb, wa-jalā ʻarāʼis al-wujūd fī mirʼāt al-shuhūd, fa-man fahim al-maqṣūd balagha al-maṭlūb ...""",w,12,7,1,4,2,0,0,zoe
14009436,880-02 al-Risālah al-qudsīyah fī asrār al-nuqṭah al-ḥissīyah al-mushīrāt ilá asrār al-huwīyah al-ghaybīyah : manuscript / ʻAlī ibn Muḥammad al-Hamadhānī.,3,"Incipit: ""Bismillāh al-Raḥmān al-Raḥīm. al-Ḥamdu lillāh alladhī ẓahar bimā shāʼ li-man shāʼ, bi-mashīʼatihi al-Ilāhīyah [ṣuḥḥiḥat ilá ""al-azalīyah""], wa-istatara ʻamman shāʼ bi-astār ʻizzatihi al-sarmadīyah, wa-jaʻala khaṣāʼiṣ al-nuqṭah bi-qudratihi āyah dāllah ʻalá ḥaqāʼiq aḥadīyatihi al-ghaybīyah, wa-aṭlaʻa ṭawāliʻ ḥaqāʼiqihā fī ʻālam al-raqm ʻukūsan li-shuʼūn tajalliyātihi al-dhātīyah wa-tanazzulāt āyatihi al-qudsīyah, wa-ṣayyarahā bi-ḥikmatihi huyūlá li-ṣuwar al-ḥurūf al-khaṭṭīyah wa-aʻyān al-kalimāt al-raqmīyah, thumma satarahā bi-mā aẓhara mā bi-hā minhā li-tabyīn al-dalālāt ʻalá al-umūr al-Ilāhīyah ...""",w,11,7,1,4,2,0,0,zoe
14009444,880-02 Ḥall al-rumūz wa-mafātīḥ al-kunūz : manuscript / ʻIzz al-Dīn ʻAbd al-Salām ibn Aḥmad ibn Ghānim al-Maqdisī.,3,"Incipit: ""Bismillāh al-Raḥmān al-Raḥīm. Wa-ṣallá Allāh ʻalá Sayyidinā Muḥammad wa-ʻalá ālihi wa-ṣaḥbihi wa-sallam. Qāla al-Shaykh al-Imām al-ʻālim al-ʻāmil al-muḥaqqiq, al-mūṣil ilá ḥaḍrat al-takwīn wa-al-tamkīn, al-muḥaqqaq bi-maqāmāt al-kirām, Sayyidī al-Shaykh ʻIzz al-Dīn ibn ʻAbd al-Salām ibn al-ʻabd al-faqīr ilá Allāh taʻālá Aḥmad ibn al-Shaykh Ghānim al-Maqdisī, qaddasa Allāh rūḥahu: al-Ḥamdu lillāh alladhī fataḥa bi-mafātīḥ al-ghuyūb aqfāl al-qulūb, wa-rafaʻa ḥujub al-sarāyir, wa-nawwara abṣār al-baṣāʼir, fa-ẓahara mā kāna maḥjūban, wa-jalā ʻan al-wujūd fī mirʼāt al-shuhūd li-man fahim al-maqṣūd wa-balagha al-maṭlūb, waffaqa man shāʼa min ʻibādihi fa-jāhada fī Allāh ḥaqqa jihādih ...""",w,12,7,1,4,2,0,0,zoe
14009456,880-02 al-Sabʻīyāt fī mawāʻiẓ al-barīyāt : manuscript / Muḥammad ibn ʻAbd al-Raḥmān ʻAyn al-Quḍāh al-Hamadhānī.,3,"Incipit: ""Bismillāh al-Raḥmān al-Raḥīm. Wa-ṣallá Allāh ʻalá Sayyidinā Muḥammad, wa-ʻalá ālihi wa-ṣaḥbihi wa-sallam. al-Ḥamdu lillāh al-Malik al-jabbār, al-ʻazīz al-ghaffār, al-muhayymin al-sattār, wa-al-ṣalāh wa-al-salām ʻalá Sayyidinā Muḥammad, al-Nabī al-Mukhtār, sayyid al-abrār, wa-ʻalá ālihi wa-ṣaḥbihi wa-sallama taslīman. Qāla al-Shaykh al-Imām, al-ʻālim al-ʻallāmah, Abū al-Naṣr Muḥammad ibn ʻAbd al-Raḥmān al-Hamdānī [al-Hamadhānī], raḥimahu Allāh taʻālá, qāl: Iʻlam anna al-Khāliq al-Bārī, jallat qudratuhu, wa-ʻalat kalimatuhu, wa-tawālat niʻamuhu, wa-tatābaʻat ālāʼuhu, zayyana al-ashyāʼ al-sabʻah, thumma zayyana al-sabʻah bi-sabʻah ukhrá, li-yaʻlama al-ʻālimūn anna al-aʻdād sabʻah [lil-aʻdād al-sabʻah] ʻinda Mālik al-ḍarr wa-al-nafʻ khaṭaran ʻaẓīman wa-maḥallan jasīman ...""",w,11,7,1,4,2,0,0,zoe
14009578,880-02 Risālah fī ʻilm al-sulūk : manuscript / Abū al-Jannāb Najm al-Dīn Aḥmad ibn ʻUmar al-Kubarā.,3,"Incipit: ""Bismillāh al-Raḥmān al-Raḥīm. al-Ḥamdu lillāh alladhī yaʻlamu makāyīl al-biḥār wa-mathāqīl al-jibāl, mursil al-saḥāb al-thiqāl, wa-mudabbir al-umūr, wa-muqallib al-aḥwāl, muqaddir al-arzāq wa-al-ājāl, dhī al-faḍl wa-al-ikrām wa-al-jalāl, al-munazzah ʻan al-ḥulūl wa-al-intiqāl, wa-al-ittiṣāl wa-al-infiṣāl, al-muttaṣif bi-ṣifāt al-kamāl, al-muqaddas ʻan al-nuqṣān wa-al-zawāl, al-mubarr [al-mubarraʼ] min maqālat al-kufr wa-al-ḍalāl, huwa al-ḥayy, lā ilāha illā hū, al-kabīr al-mutaʻāl, laysa la-hu sharīk wa-lā mithāl ...""",w,10,7,1,4,2,0,0,zoe
14009612,880-02 Ghayth al-mawāhib al-ʻalīyah bi-Sharḥ al-Ḥikam al-ʻAṭāʼīyah : manuscript / Muḥammad ibn Ibrāhīm ibn ʻAbbād al-Nafazī al-Rundī.,3,"Incipit: ""Bismillāh al-Raḥmān al-Raḥīm. Rabbi yassir. Qāla al-ʻabd al-faqīr ilá Allāh taʻālá, al-muʻtamid fī ghufrān dhunūbihi ʻalá Allāh taʻālá, Muḥammad ibn Ibrāhīm ibn ʻAbbād al-Nafazī al-ʻArsawī [?], laṭafa Allāh taʻālá bi-hi wa-raḥimahu wa-ghafara la-hu. Āmīn: al-Ḥamdu lillāh al-munfarid bi-al-ʻaẓamah wa-al-jalāl, al-mutawaḥḥid bi-istiḥqāq nuʻūt al-kamāl, al-munazzah ʻan al-shurakāʼ wa-al-nuẓarāʼ wa-al-amthāl, al-mutaqaddis ʻan simāh [simāt] al-ḥadath min al-taghyīr wa-al-intiqāl wa-al-ittiṣāl wa-al-infiṣāl, ʻālim al-ghayb wa-al-shahādah, al-kabīr al-mutaʻāl, wa-al-ṣalāh wa-al-salām ʻalá Sayyidinā Muḥammad al-hādī min al-ḍalāl ...""",w,16,7,1,4,2,0,0,zoe
14010003,880-02 al-Sabʻīyāt fī mawāʻiẓ al-barīyāt : manuscript / Muḥammad ibn ʻAbd al-Raḥmān ʻAyn al-Quḍāh al-Hamadhānī.,3,"Incipit: ""Bismillāh al-Raḥmān al-Raḥīm. al-Ḥamdu lillāh al-Malik al-jabbār, al-ʻazīz al-muhayymin al-sattār, wa-al-ṣalāh wa-al-salām ʻala al-Nabī al-Mukhtār, Sayyidinā Muḥammad khayr al-abrār, wa-ʻalá ālihi wa-ṣaḥbihi al-amājid al-akhyār, ṣalātan wa-salāman dāʼimayn mutalāzimayn mā taʻāqaba al-layl wa-al-nahār. Wa-baʻd, fa-hādhā Kitāb al-Sabʻīyāt fī mawāʻiẓ Rabb al-Barīyāt. Fa-qāla al-Shaykh al-ʻālim al-ʻallāmah al-mufrad Abū al-Naṣr Muḥammad ibn ʻAbd al-Raḥmān al-Hamdānī [al-Hamadhānī], raḍiya Allāh taʻālá ʻanh: Iʻlam anna al-Khāliq al-Bārī, jallat qudratuhu, wa-ʻalat kalimatuhu, wa-tawālat ilāhīyatuh, wa-tazāyadat naʻmāʼuhu, zayyana al-ashyāʼ al-sabʻah bi-al-ashbāh al-sabʻah, thumma zayyana tilka al-sabʻah bi-sabʻah ukhrá, li-yaʻlama al-ʻālimūn anna al-aʻdād [lil-aʻdād] ʻinda Mālik al-ḍarr wa-al-nafʻ khaṭaran ʻaẓīman wa-maḥallan jasīman ...""",w,10,7,1,4,2,0,0,zoe
14010027,880-02 al-Ḥikam al-ʻAṭāʼīyah : manuscript / Aḥmad ibn Muḥammad ibn ʻAṭāʼ Allāh al-Sakandarī.,3,"Incipit: ""Bismillāh al-Raḥmān al-Raḥīm wa-bi-hi nastaʻīn. al-Ḥamdu lillāh Rabb al-ʻĀlamīn, wa-al-ṣalāh wa-al-salām ʻalá Sayyidinā Muḥammad, Khātim al-Nabīyīn, wa-ʻalá ālihi wa-ṣaḥbihi ajmaʻīn. Wa-baʻd, fa-hādhihi ḥikam asrāruhā jalīyah wa-anwāruhā qaṣīyah, li-quṭb al-ʻārifīn wa-imām al-muḥaqqiqīn, Tāj al-Dīn, Abū al-ʻAbbās, Aḥmad ibn Muḥammad ibn ʻAbd al-Karīm ibn ʻAṭāʼ Allāh al-Sakandarī, raḍiya Allāh ʻanhu wa-jaʻala al-Jannah munqalabahu wa-mathwāh. Qāla, raḍiya Allāh ʻanhu: Min ʻalāmāt al-iʻtimād ʻalá al-ʻamal nuqṣān al-rajāʼ ʻinda wujūd al-zalal. Irādatuka al-tajrīd maʻa iqāmat Allāh īyāka fī al-asbāb min al-shahwah al-khafīyah, wa-irādatuka al-asbāb maʻa iqāmat Allāh īyāk fī al-tajrīd inḥiṭāṭ ʻan al-himmah al-ʻalīyah ...""",w,12,7,1,4,2,0,0,zoe
14010037,880-02 Fī bayān al-sayr ilá Allāh : manuscript / Aḥmad ibn Muḥammad al-Dardīr.,3,"Incipit: ""Bismillāh al-Raḥmān al-Raḥīm. Qāla Sayyidunā wa-Mawlānā wa-Shaykhunā al-Shaykh al-Imām al-ʻālim al-ʻallāmah al-humām, al-ruḥalah al-awḥad al-amjad, murabbī al-ṭālibīn, maljaʼ al-qāṣidīn, ṣāḥib al-taḥqīqāt al-nafīsah, wa-muẓhir al-tadqīqāt al-gharībah, Shihāb al-Dīn Abū al-Barakāt Aḥmad ibn Muḥammad al-Dardīr al-ʻAdwī al-Mālikī: al-Ḥamdu lillāh alladhī ṭahhara qulūb aḥbābihi min ẓulm al-ghiyār, wa-nawwara baṣāʼirahum bi-luṭf al-maʻārif wa-lawāmiʻ al-asrār, wa-al-ṣalāh wa-al-salām ʻalá Sayyidinā Muḥammad afḍal al-akhyār, wa-ʻalá ālihi wa-aṣḥābihi al-sādah al-abrār. Wa-baʻd, fa-hādhihi nubdhah laṭīfah Fī bayān al-sayr ilá Allāh al-wāḥid al-qahhār, jaʻaltuhā tabṣirah li-ikhwānī wa-tadhkirah li-khullānī ...""",w,12,7,1,4,2,0,0,zoe
14010042,880-02 al-Sharḥ al-ṣaghīr ʻalá Aqrab al-masālik ilá madhhab al-Imām Mālik : manuscript / Aḥmad ibn Muḥammad al-Dardīr.,3,"Incipit: ""Bismillāh al-Raḥmān al-Raḥīm, wa-bi-hi thiqatī. Wa-ṣallá Allāh ʻalá Sayyidinā Muḥammad, wa-ʻalá ālihi wa-ṣaḥbihi wa-sallam. al-Ḥamdu lillāh ʻalá afḍālih, wa-al-ṣalāh wa-al-salām ʻalá Sayyidinā Muḥammad wa-ṣaḥbihi wa-ālih. Ammā baʻd, fa-hādhā sharḥ laṭīf ʻalá kitābinā al-musammá bi-'Aqrab al-masālik li-madhhab al-Imām Mālik', iqtaṣartu fīhi ʻalá bayān maʻānī alfāẓih li-yashula fahmuhu ʻalá al-mubtadiʼīn wa-sharḥuhu wa-qirāʼatuhu li-man shāʼa bi-mashīʼat Rabb al-ʻĀlamīn, fa-aqūlu, wa-bi-hi astaʻīn: Yaqūlu al-ʻabd al-faqīr al-munkasir al-fuʼād min al-taqṣīr Aḥmad ibn Muḥammad al-Dardīr ...""",w,11,7,1,4,2,0,0,zoe
14010045,880-02 Bidāyat al-hidāyah : manuscript / Abū Ḥāmid Muḥammad ibn Muḥammad al-Ghazzālī.,3,"Incipit: ""Bismillāh al-Raḥmān al-Raḥīm. Wa-ṣallá Allāh ʻalá Sayyidinā Muḥammad wa-ālihi wa-ṣaḥbihi wa-sallam. Qāla al-Shaykh al-jalīl, al-Imām, al-ʻālim al-ʻallāmah, Muḥammad ibn Muḥammad ibn Muḥammad ibn Muḥammad al-Ghazzālī, raḥmat Allāh ʻalayh: Ammā baʻd, fa-iʻlam ayyuhā al-ḥarīṣ ʻalá iqtibās al-ʻilm, al-muẓhir min nafsihi ṣidq al-raghbah wa-farṭ al-taʻaṭṭush ilayh, innaka in kunta taqṣidu ṭalaba al-ʻilm lil-munāfasah wa-al-mubāhāt [wa-al-mubāhāh] wa-al-taqaddum ʻalá al-aqrān wa-al-istimālah [wa-istimālat] wujūh al-nās wa-jamʻ ḥuṭām al-dunyā, fa-anta sāʻin fī hadm dīnik wa-halāk nafsik wa-bayʻ ākhiratika bi-dunyāk, fa-ṣafqatuka khāsirah, wa-tijāratuka bāʼirah, wa-muʻallimuka muʻīn ʻalá ʻiṣyānika, wa-sharīkun laka fī khusrānika ...""",w,11,7,1,4,2,0,0,zoe
14010051,880-02 al-Tibr al-masbūk fī naṣīḥat al-mulūk : manuscript / Abū Ḥāmid Muḥammad ibn Muḥammad al-Ghazzālī.,3,"Incipit: ""Bismillāh al-Raḥmān al-Raḥīm. al-Ḥamdu lillāh ʻalá inʻāmih wa-ifḍālih, wa-al-ṣalāh wa-al-salām ʻalá Sayyidinā Muḥammad wa-aṣḥābihi wa-ālih. Wa-baʻd, fa-innahu saʼalanī baʻḍ al-mutaqaddimīn min al-kubarāʼ an anqula hādhā al-kitāb, wa-huwa 'Kitāb Naṣīḥat al-mulūk' min al-lughah al-Fārisīyah ilá al-alfāẓ al-ʻArabīyah, fa-imtathaltu dhālik, wa-naqaltuhu ʻalá tartībihi wa-ṣūratih, wa-lam ughayyir shayʼan min waḍʻ al-kitāb wa-ṣifatih, wa-ijtahadtu fī tashīl ʻibārātih wa-īḍāḥ ishārātih ...""",w,12,7,1,4,2,0,0,zoe
14034355,880-02 al-Ḥikam al-ʻirfānīyah wa-al-ishārāt al-Qurʼānīyah : manuscript / ʻAlī ibn ʻAbd al-Malik al-Muttaqī al-Hindī.,3,"Incipit: ""Bismillāh al-Raḥmān al-Raḥīm, wa-bi-hi nastaʻīn. al-Ḥamdu lillāh Rabb al-ʻĀlamīn, wa-al-ṣalāh wa-al-salām ʻalá Sayyidinā Muḥammad, Khātim al-Anbiyāʼ wa-al-Mursalīn, wa-ālihi wa-ṣaḥbihi ajmaʻīn. Ammā baʻd, fa-hādhihi 'Ḥikam ʻirfānīyah fī maʻānin irshādīyah wa-ishārāt Qurʼānīyah'. Kull ḥikmah minhā muʼayyadah bi-āyah aw baʻḍihā; bayna al-āyah wa-al-ḥikamah munāsabah lā yakhfá [lā takhfá] ʻalá al-mutaʼammil, lākin lā yudriku ladhdhat dhālik ʻalá wajh al-kamāl illā ḥāfiẓ al-āyāt wa-man la-hu ilmām bi-tafsīrihā, wa-ḥaẓẓ min ʻulūm al-ishārāt; fa-innī adhkuru baʻḍ al-āyah wa-atruku mā baʻdahā, iʻtimādan ʻalá ḥifẓ al-ṭālib ...""",w,11,7,1,4,2,0,0,zoe
14034359,880-02 Bulghat al-murīd wa-mushtahá al-saʻīd fīmā yajibu fī al-ṭarīq ʻalá al-murīd : manuscript / Muṣṭafá ibn Kamāl al-Dīn al-Bakrī al-Ṣiddīqī.,3,"Incipit: ""Bismillāh al-Raḥmān al-Raḥīm. al-Ḥamdu lillāh ʻalá al-tawfīqi // mā sāra sārin manhaja al-taḥqīqi. Wa-al-shukru lillāhi ʻalá al-inʻāmi // mā adhhaba al-nahāru lil-ẓalāmi ...""",w,12,7,1,4,2,0,0,zoe
14034361,880-02 Mashāriq al-anwār al-Qudsīyah fī bayān al-ʻuhūd al-Muḥammadīyah : manuscript / ʻAbd al-Wahhāb ibn Aḥmad al-Shaʻrānī.,3,"Incipit: ""Bismillāh al-Raḥmān al-Raḥīm. al-Ḥamdu lillāh Rabb al-ʻĀlamīn, wa-ashhadu an lā ilāha illā [Allāh], al-Malik al-Ḥaqq al-Mubīn, wa-ashhadu anna Sayyidanā Muḥammadan ʻabduhu wa-rasūluh, sayyid al-awwalīn wa-al-ākharīn. Allāhumma, fa-ṣalli wa-sallim ʻalayhi wa-ʻalá sāyir al-anbiyāʼ wa-al-mursalīn, wa-ʻalá ālihim wa-ṣaḥbihim ajmaʻīn, ṣalātan wa-salāman dāʼimayn, abada al-ābidīn. Āmīn. Āmīn. Āmīn. Wa-baʻd, fa-hādhā kitāb nafīs lam yasbiqnī aḥad ilá waḍʻ mithālih, wa-lā aẓunnu aḥadan nasaja ʻalá minwālih, ḍammantuhu jamīʻ al-ʻuhūd allatī balaghatnā ʻan Rasūl Allāh, ṣallá Allāh ʻalayhi wa-sallam, min fiʻl al-maʼmūrāt wa-tark al-manhīyāt. Wa-sammaytuhu 'Mashāriq al-anwār al-Qudsīyah fī bayān al-ʻuhūd al-Muḥammadīyah'. Wa-kāna al-bāʻith lī ʻalá taʼlīfih mā raʼaytuhu min kathrat taftīsh al-ikhwān ʻalá mā naquṣa min dunyāhum, wa-lam ara aḥadan minhum yufattishu ʻalá mā naquṣa min umūr dīnih, fa-waḍaʻtu lahum hādhā al-kitāb ...""",w,12,7,1,4,2,0,0,zoe
14034368,880-02 al-Anwār al-sanīyah ʻalá al-Waẓīfah al-Zarrūqīyah : manuscript / ʻAbd al-Raḥmān ibn Muḥammad al-ʻAyyāshī.,3,"Incipit: ""Bismillāh al-Raḥmān al-Raḥīm. Ṣallá Allāh ʻalá Sayyidinā Muḥammad wa-ʻalá ālihi wa-ṣaḥbih. al-Ḥamdu lillāh alladhī arshadanā li-iqāmat waẓāʼif al-Islām, wa-ḥaḍḍanā ʻalá takthīr dhikrihi fī al-ghudw wa-al-āṣāl ʻalá al-dawām, wa-al-ṣalāh wa-al-salām ʻalá Sayyidinā Muḥammad al-badr al-tamām, wa-ʻalá ālihi wa-ṣaḥbihi al-sādāt al-aʻlām. Wa-baʻd, fa-yaqūlu al-ʻabd al-faqīr ilá Allāh subḥānuh, al-mutaʻalliq bi-adhyāl awliyāʼih, ʻAbd al-Raḥmān Muḥammad ibn ʻAbd al-Raḥmān ibn Muḥammad ibn Abī Bakr al-ʻAyyāshī, nawwara Allāh qalbahu, wa-satara ʻaybahu, wa-khatama bi-kalimatay al-shahādah qawlahu, wa-faʻala bi-ummat Muḥammad, ṣallá Allāh ʻalayhi wa-sallam, mithlahu, qāl: Ṭāla mā khālaja qalbī an aḍaʻa taqyīdan yakūnu ka-al-sharḥ ʻalá 'al-Waẓīfah al-Zarrūqīyah', al-jāmiʻah li-khayray al-dunuā wa-al-ākhirah, allatī sārat masīrat al-Shams fī al-bilād, wa-intafaʻa bi-hā fī jamīʻ al-aqṭār al-ʻibād, munṭawiyan ʻalá tafsīr gharāʼibihā, wa-muḥtawiyan ʻalá faḍīlat adhkārihā ... wa-sammaytuhu 'al-Anwār al-sanīyah ʻalá al-Waẓīfah al-Zarrūqīyah' ...""",w,15,7,1,4,2,0,0,zoe
