bib_id,title,note_num,note_text,note_type,record_total_notes,record_typed_notes,w_count,o_count,a_count,aw_count,ow_count,source
14526311,880-03 Kashf al-lithām ʻan asʼilat al-anām : manuscript / Ḥusayn ibn Muḥammad al-Maḥallī.,3,"Incipit: ""Bismillāh al-Raḥmān al-Raḥīm, wa-bi-hi thiqatī. Ḥamdan li-man faqqaha fī al-dīn man irtaḍāhu min ʻibādih, fa-salakū minhāj al-rashād ʻalá wafq murādih, wa-ṣalātan wa-salāman ʻalá Sayyid al-Mursalīn, al-qāʼil 'Man yarid Allāh bi-hi khayran yufaqqihhu fī al-dīn', wa-ʻalá ālihi wa-aṣḥābihi wa-al-tābiʻīn wa-tābiʻīhim bi-iḥsān ilá Yawm al-Dīn. Wa-baʻd, fa-yaqūlu rājī ʻafwa Rabbihi wa-iḥsānah, wa-muʼammil min Allāh faḍla jūdihi wa-imtinānah, Ḥusayn ibn Muḥammad al-Maḥallī al-Shāfiʻī: Lammā kathura al-suʼāl ʻan waqāʼiʻ al-aḥwāl, wa-zāda al-ishtighāl fī al-ḥall wa-al-irtiḥāl, wa-qalla man yujību al-sāʼil bi-al-manqūl, wa-iʻtamad al-muftīyūn [al-muftūn] ʻalá jawāhir al-ʻuqūl, wa-rubbamā ajābū fī al-wāqiʻāt bi-ghayr mā qarrarahu al-aʼimmah min al-manqūlāt, aradtu an ajmaʻa mā yartāḥu bi-hi al-labīb wa-yakshufu al-karb ʻan kull muhimm gharīb ...""",w,15,8,3,2,2,0,1,martin
14526311,880-03 Kashf al-lithām ʻan asʼilat al-anām : manuscript / Ḥusayn ibn Muḥammad al-Maḥallī.,4,Secundo folio: al-sukhūnah wa-al-burūdah wa-māʼ diyār Thamūd.,w,15,8,3,2,2,0,1,martin
14526311,880-03 Kashf al-lithām ʻan asʼilat al-anām : manuscript / Ḥusayn ibn Muḥammad al-Maḥallī.,8,"At the head of folio 1a: An endowment statement: ""Awqafa hādhā al-kitāb Aḥmad Muḥammad al-Najjārī.""",w,15,8,3,2,2,0,1,martin
14526480,880-02 Taʻlīm al-mutaʻallim ṭarīq al-taʻallum : manuscript / Burhān al-Dīn al-Zarnūjī.,3,"Incipit of the excerpt from ""Majālis al-abrār wa-masālik al-akhyār"": ""Aʻūdhu billāh min al-Shayṭān al-rajīm. Bismillāh al-Raḥmān al-Raḥīm. al-Majlis al-ḥādī wa-al-thalāthūn: Fī bayān ṣadaqat al-fiṭr wa-aḥkām al-ʻīdayn wa-bayān al-bidaʻ fīhi [fīhimā]. Faraḍ Rasūl Allāh, ṣallá Allāh taʻālá ʻalayhi wa-sallam, zakāt al-Fiṭr ṭuhratan lil-ṣiyām min al-lahw wa-al-laghw wa-al-rifth wa-ṭuʻmatan lil-masākīn. Wa-hādhā al-Ḥadīth min ḥisān al-Maṣābīḥ, rawāhu Ibn ʻAbbās, wa-huwa yadullu ʻalá wujūb ṣadaqat al-Fiṭr, li-anna al-farḍ fī al-lughah bi-maʻná al-taqdīr, wa-fī al-sharʻ bi-maʻná al-ījāb. Wa-lafẓ al-Shāriʻ dāra bayna al-maʻná al-sharʻī wa-maʻná [wa-al-maʻná] al-lughawī, yataʻayyanu ḥamluhu ʻalá al-maʻná al-sharʻī mā amkana, li-anna al-ghālib min ḥāl al-Nabī, ʻalayhi al-salām, taʻrīf al-aḥkām dūn al-lughāt, fa-ʻalá hādhā yakūnu al-maʻná anna wujūb ṣadaqat al-Fiṭr ʻalá al-insān li-fāʼidatan ...""",w,17,16,11,1,0,1,1,martin
14526480,880-02 Taʻlīm al-mutaʻallim ṭarīq al-taʻallum : manuscript / Burhān al-Dīn al-Zarnūjī.,4,"Secundo folio of the excerpt from ""Majālis al-abrār wa-masālik al-akhyār"": bi-al-mubāsharah wa-baʻḍuhum bi-al-mushāhadah.",w,17,16,11,1,0,1,1,martin
14526480,880-02 Taʻlīm al-mutaʻallim ṭarīq al-taʻallum : manuscript / Burhān al-Dīn al-Zarnūjī.,5,"Incipit of ""Taʻlīm al-mutaʻallim ṭarīq al-taʻallum"": ""Bismillāh al-Raḥmān al-Raḥīm. al-Ḥamdu lillāh alladhī faḍḍala banī Ādam bi-al-ʻilm wa-al-ʻamal ʻalá jamīʻ al-ʻālam, wa-al-ṣalāh ʻalá Muḥammad Sayyid al-ʻArab wa-al-ʻAjam, wa-ʻalá ālihi wa-aṣḥābih yanābīʻ al-ʻulūm wa-al-ḥikam. Wa-baʻd, fa-lammā raʼaytu kathīran min ṭullāb al-ʻilm fī zamāninā yajiddūna ilá al-ʻilm wa-lā yaṣilūn, wa-min manāfiʻihi wa-thamarātihi, wa-hiya al-ʻamal bi-hi wa-al-nashr yuḥramūn, limā annahum akhṭaʼū ṭarāʼiqahu wa-tarakū sharāʼiṭ [sharāʼiṭahu] <annī>, wa-kull man akhṭaʼa al-ṭarīq ḍalla, wa-lā yanālu al-maqṣūd qalla aw jalla, aradtu wa-aḥbabtu an ubayyina lahum ṭarīq al-taʻallum ʻalá mā raʼaytu fī al-Kitāb wa-samiʻtu min asātīdhī ulī al-ʻilm wa-al-ḥikam rajāʼ al-duʻāʼ lī min al-rāghibīn fīhi al-mukhliṣīn bi-al-fawz wa-al-khalāṣ fī Yawm al-Dīn mā istakhartu lillāh taʻālá fīhi, wa-sammaytuhu 'Taʻlīm al-mutaʻallim ṭarīq al-taʻallum', wa-jaʻaltuhu fuṣūlan ...""",w,17,16,11,1,0,1,1,martin
14526480,880-02 Taʻlīm al-mutaʻallim ṭarīq al-taʻallum : manuscript / Burhān al-Dīn al-Zarnūjī.,6,"Secundo folio of ""Taʻlīm al-mutaʻallim ṭarīq al-taʻallum"": fī taʻẓīm al-ʻilm wa-ahlih.",w,17,16,11,1,0,1,1,martin
14526480,880-02 Taʻlīm al-mutaʻallim ṭarīq al-taʻallum : manuscript / Burhān al-Dīn al-Zarnūjī.,9,"""Taʻlīm al-mutaʻallim ṭarīq al-taʻallum"" is written in good naskh script, in black ink, on white paper; headings and markings in red; some notes on the margins; catchwords. The excerpt from ""Majālis al-abrār wa-masālik al-akhyār"" is written in fair naskh/ruqʻah script.",w,17,16,11,1,0,1,1,martin
14526480,880-02 Taʻlīm al-mutaʻallim ṭarīq al-taʻallum : manuscript / Burhān al-Dīn al-Zarnūjī.,10,"On folio 1a: ""Kitāb bi-hi Taʻallum al-mutaʻallim.""",w,17,16,11,1,0,1,1,martin
14526480,880-02 Taʻlīm al-mutaʻallim ṭarīq al-taʻallum : manuscript / Burhān al-Dīn al-Zarnūjī.,13,"Folios 3b-9a are blank; text of ""Taʻlī al-mutaʻallim ṭarīq al-taʻallum"" (folios 9b-30a).",w,17,16,11,1,0,1,1,martin
14526480,880-02 Taʻlīm al-mutaʻallim ṭarīq al-taʻallum : manuscript / Burhān al-Dīn al-Zarnūjī.,14,"On folio 9b: ""Munājāt [Munājāh]. Lā ilāha illā Allāh, Muḥammad Rasūl Allāh. Lā ilāha illā Allāh, Muḥammad Rasūl Allāh. Hādhā kitāb Taʻlīm mutaʻallim.""",w,17,16,11,1,0,1,1,martin
14526480,880-02 Taʻlīm al-mutaʻallim ṭarīq al-taʻallum : manuscript / Burhān al-Dīn al-Zarnūjī.,15,"Colophon of the excerpt from ""Majālis al-abrār wa-masālik al-akhyār"": No colophon. Text ends abruptly with: ""... Naʻam. Inna hādhihi al-ayyām ayām faraḥ wa-surūr, lākin yanbaghī an yakūna iẓhār al-faraḥ wa-al-surūr fīhā bi-mā kāna mubāḥan aw mustaḥabban, ka-al-ightisāl wa-al-taṭayyub wa-lays [wa-libs] aḥsan al-sayyiʼāt [al-thiyāb?] al-mubāḥah allatī takūn jadīdah aw ghasīlah ʻalá mā sayajīʼ, lā bi-mā kāna ḥarām [ḥarāman], ka-libs al-ḥarīr wa-al-khawḍ fī al-bāṭil, li-anna al-ʻīd innamā summiya ʻīdan li-annahu taʻālá yaʻūdu fīhi ʻalá al-muʼmin bi-al-maghfirah wa-al-iḥsān, fa-yajibu ʻalayhim an yajtanibū al-maʻṣiyah wa-al-ṭughyān ḥattá yakūnū min ahl al-saʻādah wa-al-ruḍwān, lā min ahl al-shaqāwah wa-al-khidhlān. Wa-qad ḥukiya ʻan baʻḍ al-ʻārifīn annahu [marra] yawm al-ʻīd bi-qawm yalʻabūn wa-yaḍḥakūn, fa-qāl: In kāna tuqubilla min hāʼulāʼ lazimahum an yashkurū wa-laysa hādhā fiʻl al-shākirīn, wa-in kāna lam tuqubilla [yutaqabbal] minhum lazimahum an yakhāfū wa-laysa hādhā fiʻl al-khāʼifīn. Thumma yanbaghī an yuʻlam anna baʻḍ al-nās qad zaʻamū anna ...""",w,17,16,11,1,0,1,1,martin
14526480,880-02 Taʻlīm al-mutaʻallim ṭarīq al-taʻallum : manuscript / Burhān al-Dīn al-Zarnūjī.,16,"Colophon of ""Taʻlīm al-mutaʻallim ṭarīq al-taʻallum"": ""Wa-al-ḥamdu lillāh awwalan wa-ākhiran. Wa-al-ḥamdu lillāh ʻalá al-tamām. Wa-al-ṣalāh ʻalá Sayyidinā Muḥammad khayr al-anām, wa-ʻalá ālihi wa-aṣḥābihi ajmaʻīn. 18 Dhī al-Ḥijjah, sanat 1191.""",w,17,16,11,1,0,1,1,martin
14526480,880-02 Taʻlīm al-mutaʻallim ṭarīq al-taʻallum : manuscript / Burhān al-Dīn al-Zarnūjī.,17,"Translation of the colophon of ""Taʻlīm al-mutaʻallim ṭarīq al-taʻallum"": ""Praise be to God at the beginning and at the end. Praise be to God for the completion. May prayer be upon our Master Muḥammad, the best of mankind, and upon his family and all his companions. 18 Dhū al-Ḥijjah, the year 1191 [of the Hijrah = 17 January, 1778].""",w,17,16,11,1,0,1,1,martin
13195070,880-02 Rashf al-zulāl min al-siḥr al-ḥalāl : manuscript / Jalāl al-Dīn al-Suyūṭī.,3,"Incipit: ""Bismillāh al-Raḥmān al-Raḥīm. Hādhā Rashf al-zulāl min al-siḥr al-ḥalāl fī aḥad wa-ʻishrīn ʻāliman lammā tazawwaja kull wāḥid minhum waṣafa laylatahu mūriyan bi-alfāẓ fannihi min maqāmāt al-Shaykh al-ʻālim al-ʻallāmah al-ḥāfiẓ al-Shaykh Jalāl al-Dīn al-Suyūṭī nafaʻanā Allāh bi-hi wa-al-Muslimīn. Āmīn.""",w,10,7,1,4,2,0,0,zoe
13195313,880-02 al-Fatʹḥ al-mubīn bi-sharḥ al-Arbaʻīn : manuscript / Shihāb al-Dīn Aḥmad ibn Muḥammad ibn Ḥajar al-Haythamī.,3,"Incipit: ""Bismillāh al-Raḥmān al-Raḥīm wa-huwa ḥasbī. al-Ḥamdu lillāh alladhī waffaqa ṭāʼifatan min ʻulamāʼ kull ʻaṣr lil-qiyām bi-aʻbāʼ al-Aḥādīth wa-al-sunan wa-mayyazahum ʻalá siwāhum bi-sulūkihim awḍaḥ al-maḥajjah wa-aqwam al-sunan ...""",w,14,7,1,4,2,0,0,zoe
13195320,880-02 al-Īḍāḥ fī al-nikāḥ wa-al-bāh : manuscript / Jalāl al-Dīn al-Suyūṭī.,3,"Incipit: ""Bismillāh al-Raḥmān al-Raḥīm. al-Ḥamdu lillāh Rabb al-ʻĀlamīn wa-ṣallá Allāh ʻalá Sayyidinā Muḥammad wa-ʻalá ālihi wa-ṣaḥbihi ajmaʻīn. Wa-baʻd, fa-hādhā kitāb al-waṣīyah al-mashhūr al-musammá fī ʻilm al-nayk wa-yusammá al-Īḍāḥ fī al-nikāḥ wa-al-bāh fī al-rujūʻ [rujūʻ] al-shaykh ilá al-ṣibāh [ṣibāh] lil-Shaykh al-ajall Jalāl al-Dīn al-Suyūṭī, raḥimahu Allāh taʻālá, wa-dhālika mashhūr lammā fasiqū ahl miṣr allafa lahum hādhā al-kitāb ḥattá rajiʻū ʻan al-liwāṭ bi-barakat al-Shaykh, raḥimahu Allāh taʻālá ...""",w,14,7,1,4,2,0,0,zoe
13195481,880-02 ʻAlam al-malāḥah fī ʻilm al-filāḥah : manuscript / ʻAbd al-Ghanī al-Nābulusī.,3,"Incipit: ""Bismillāh al-Raḥmān al-Raḥīm, wa-Allāh bi-kull shayʼ ʻalīm. al-Ḥamdu lillāh alladhī anzala min al-samāʼ māʼan fa-aḥyā bi-hi al-arḍ, wa-akhraja thamarāt kull shayʼ bi-qudratih kamā yukhriju al-khalāʼiq yawm al-ʻarḍ, wa-al-ṣalāh wa-al-salām ʻalá Sayyidinā Muḥammad alladhī bayyana la-nā al-mashrūʻ wa-ghayr al-mashrūʻ, wa-kammal bi-al-sunnah wa-alzama bi-al-farḍ ... Ammā baʻd, fa-yaqūlu al-ʻabd ... al-madʻū bi-ʻAbd al-Ghanī ... lammā wajadtu kitāb al-filāḥah al-musammá bi-Jāmiʻ fawāʼid al-malāḥah lil-Shaykh ... Raḍī al-Dīn Abī al-Faḍl Muḥammad ibn Muḥammad ibn Aḥmad al-Ghazzī al-ʻĀmirī al-Shāfiʻī ... kitāb jalīl al-miqdār ʻaẓīm al-nafʻ li-man yuʻānī zirāʻat al-arāḍī wa-tarbiyat al-ashjār wa-lākinnahu mimmā yaḥsunu fīhi al-ikhtiṣār fa-jamaʻtu al-himmah wa-lakhkhaṣtu ghālib mā fīhi min al-masāʼil al-muhimmah ... wa-sammaytuhu 'ʻAlam al-malāḥah fī ʻilm al-filāḥah' ...""",w,14,7,1,4,2,0,0,zoe
13195482,880-02 Taqyīdāt ʻalá Sharḥ al-ʻAllāmah al-Saʻd ʻalá matn al-ʻAqāʼid al-Nasafīyah : manuscript / Muḥammad ibn Aḥmad ibn ʻArafah al-Dasūqī al-Mālikī.,3,"Incipit: ""Bismillāh al-Raḥmān al-Raḥīm. al-Ḥamdu lillāh Rabb al-ʻĀlamīn wa-al-ṣalāh wa-al-salām ʻalá Sayyidinā Muḥammad wa-ʻalá ālihi wa-ṣaḥbihi wa-sallam ajmaʻīn. Qawluhu 'al-mutawaḥḥid' min al-tawaḥḥud, wa-min al-maʻlūm anna al-tawaḥḥud ʻalá wazn al-tafaʻʻul wa-ṣīghat al-tafaʻʻul taʼtī li-maʻān ...""",w,10,7,1,4,2,0,0,zoe
13195483,880-02 Mukhtaṣar Qawāʻid al-Zarkashī : manuscript / ʻAbd al-Wahhāb ibn Aḥmad al-Shaʻrānī.,3,"Incipit: ""Bismillāh al-Raḥmān al-Raḥīm. Min mumidd al-kawn astamiddu al-ʻawn. al-Ḥamdu lillāh Rabb al-ʻĀlamīn wa-ashhadu an lā ilāh illā Allāh al-malik al-ḥaqq al-mubīn, wa-ashhadu anna Muḥammadan ʻabduhu wa-rasūluhu sayyid al-awwalīn wa-al-ākharīn. Allāhumma ṣalli wa-sallam ʻalayhi wa-ʻalá sāyir al-anbiyāʼ wa-al-mursalīn wa-ʻalá ālihim wa-ṣaḥbihim ajmaʻīn. Wa-baʻd, fa-hādhihi qawāʻid ʻaẓīmah yaḥtāju ilayhā kull faqīh intakhabtuhā min kitāb al-Qawāʻid lil-Shaykh al-Imām al-ʻālim al-Shaykh Badr al-Dīn al-Zarkashī raḥimahu Allāh taʻālá, fa-man raʼá fī hādhihi al-qawāʻid khaṭaʼan aw taḥrīfan fa-li-yurājiʻ aṣlahu, fa-rubbamā yakūnu dhālika min sūʼ fahmī, wa-Allāh fī ʻawn al-ʻabd mā kāna al-ʻabd fī ʻawn akhīh, wa-rattabtuhā tibʻan li-aṣlihā ʻalá ḥurūf al-muʻjam tasʹhīlan lil-ṭālib ...""",w,13,7,1,4,2,0,0,zoe
13195484,880-03 al-Maqāmāt al-Ḥarīrīyah : manuscript / al-Qāsim ibn ʻAlī al-Ḥarīrī.,3,"Incipit: ""Bismillāh al-Raḥmān al-Raḥīm. Qāla al-Shaykh al-ajall al-awḥad Abū Muḥammad al-Qāsim ibn ʻAlī ibn Muḥammad ibn ʻUthmān al-Ḥarīrī al-Baṣrī, barrada Allāh maḍjaʻahu: Allāhumma innā naḥmaduka ʻalá mā ʻallamta min al-bayān wa-alhamta min al-tibyān kamā naḥmaduka ʻalá mā asbaghta min al-ʻaṭāʼ wa-asbalta min al-ghiṭāʼ wa-naʻūdhu bi-ka min shirrat al-lasn wa-fuḍūl al-hadhī ...""",w,11,7,1,4,2,0,0,zoe
13195485,880-02 Ḥāshiyat al-Amīr al-Kabīr ʻalá Sharḥ al-Samarqandīyah lil-Mullawī : manuscript / Muḥammad ibn Muḥammad al-Amīr al-Kabīr.,3,"Incipit: ""Bismillāh al-Raḥmān al-Raḥīm. al-Ḥamd al-ḥaqīqī laka minka yā ḥamīd yā majīd, fa-innamā majāz ḥamdinā takhyīl istiʻārah fī iṭlāq al-tajrīd, wa-rashshiḥ Allāhumma asrāranā bi-an taḍmura fī nufūsinā shuhūd waḥdatik al-aṣlīyah maʻa istiʻmālinā fī mursal tabʻīyat mursalika fī bayān al-ʻalāqāt al-marḍīyah, ṣallá Allāh ʻalayhi wa-ʻalá ālihi wa-sallama wa-sharrafa wa-majjada wa-karram. Āmīn. Ammā baʻd, fa-yaqūlu Muḥammad al-Amīr al-Miṣrī al-Azʹharī: Hādhā mā narjū Allāh taʻālá fīhi ʻalá sharḥ Shaykhinā wa-shaykh mashāyikhinā wa-mashāyikhihim al-ʻAllāmah al-Mullawī ʻalá al-istiʻārāt ...""",w,12,7,1,4,2,0,0,zoe
13195489,880-03 al-Risālah al-Qushayrīyah : manuscript / ʻAbd al-Karīm ibn Hawāzin al-Qushayrī.,3,"Incipit: ""Bismillāh al-Raḥmān al-Raḥīm. al-Ḥamdu lillāh alladhī tafarrada bi-jalāl malakūtih wa-tawaḥḥada bi-jamāl jabarūtih wa-taʻazzaza bi-ʻulū aḥadīyatih wa-taqaddasa bi-sumū ṣamadīyatih wa-takabbara fī dhātih ʻan muḍāraʻat kull naẓīr wa-tanazzaha fī ṣifātih ʻan kull tanāhin wa-quṣūr ...""",w,12,7,1,4,2,0,0,zoe
13202368,880-02 Fatʹḥ al-mutaʻāl ʻalá al-qaṣīdah al-musammāh bi-Lāmīyat al-afʻāl : manuscript / Ḥamad ibn Muḥammad al-Ṣaʻīdī al-Mālikī.,3,"Incipit: ""Bismillāh al-Raḥmān al-Raḥīm wa-bi-hi thiqatī wa-tawakkulī. al-Ḥamdu lillāh ʻalá afḍālih wa-al-ṣalāh wa-al-salā[m] ʻalá Sayyidinā Muḥammad wa-ālihi. Wa-baʻd fa-yaqūlu aḥwaj al-ʻibād wa-akhfaḍ al-ʻabīd Ḥamad ibn Muḥammad al-Ṣaʻīd[ī] al-Mālikī ghafara Allāh la-hu wa-li-wālidayh wa-li-ikhwānihi al-Muslimīn. Āmīn. Hādhā taʻlīq laṭīf ʻalá manẓūmat al-Imām Abī ʻAbd Allāh Jamāl al-Dīn Muḥammad ibn ʻAbd Allāh ibn Mālik al-Andalusī al-Jayyānī al-Naḥwī al-Lughawī al-Ṣarf[ī] iqtaṣartu fīhi ʻalá ḥall alfāẓihā wa-bayān murādihā ...""",w,9,7,1,4,2,0,0,zoe
13202376,880-02 al-Minaḥ al-Ilāhīyah bi-sharḥ baʻḍ al-awrād al-Bakrīyah : manuscript / ʻAlī ibn ʻAbd al-Barr al-Wanāʼī.,3,"Incipit: ""Bismillāh al-Raḥmān al-Raḥīm. al-Ḥamdu lillāh al-ʻalī al-ʻaẓīm dhī al-kamāl alladhī lā tudriku al-ʻuqūl minhu shayʼan wa-lā talmaḥu minhu lamḥatan wa-lā taḥtamilu al-afkār al-salīmah ẓuhūr athar min āthārih illā bi-imdād minhu wa-manḥih ... Wa-baʻd fa-yaqūlu al-faqīr ilá mawlāh ʻAlī ibn ʻAbd al-Barr al-Ḥasanī al-Wanāʼī al-Shāfiʻī ... Hādhā sharḥ laṭīf ʻalá Awrād al-ṣabāḥ wa-al-masāʼ wa-al-ṣalawāt al-khams lil-Imām al-humām Sayyidī Muṣṭafá al-Bakrī, qaddasa Allāh sirrahu, fa-innahā zād al-musāfir wa-bi-hā yakūnu al-murīd bi-āmālihi ẓāfir ...""",w,12,6,1,3,2,0,0,zoe
13202380,880-02 Risālah fī sharḥ qawlihi taʻālá Innamā yaʻmuru masājida Allāh : manuscript / ʻUmar ibn ʻAlī al-Ṭaḥlāwī.,3,"Incipit: ""Bismillāh al-Raḥmān al-Raḥīm wa-ṣallá Allāh ʻalá Sayyidinā Muḥammad wa-ālih. Ḥamdan li-man naḍḍara wujūh ahl al-Ḥadīth wa-ṣalātan wa-salāman ʻalá khayr rasūl nazala ʻalayhi aḥsan al-Ḥadīth wa-ʻalá ālihi al-aʻlām wa-ṣaḥābatihi wa-dhurrīyatihi al-kirām mā ʻummirat fī al-arḍ masājid wa-taqarraba ilá Allāh rākiʻ wa-sājid. Rabbi waffiqnī fa-lā aʻdilu ʻan sunan al-sāʻīn fī khayr sanan. Wa-baʻd fa-yaqūlu afqar al-ʻibād li-raḥmat rabbihi yawm al-tanād ʻUmar ibn ʻAlī al-Ṭaḥlāwī al-Mālikī al-Azʹharī: Lammā anʻama Allāh ʻalayya bi-al-tawajjuh ilá al-diyār al-Rūmīyah wa-al-aʻtāb al-sharīfah al-Khāqānīyah sāḥat malik salāṭīn al-Islām Mawlānā al-Sulṭān rafīʻ al-majd wa-al-shān al-mughāzī fī sabīl Allāh Maḥmūd Khān ...""",w,10,7,1,4,2,0,0,zoe
13202389,880-02 al-Maqālah al-sanīyah li-dalāʼil al-ashkāl al-ramlīyah : manuscript / Abū ʻAbd Allāh al-Zinātī.,3,"Incipit: ""Bismillāh al-Raḥmān al-Raḥīm wa-bi-hi nastaʻīn. Qul lā yaʻlamu man fī al-samāwāt wa-al-arḍ al-ghayb illā Allāh. al-Ḥamdu lillāh Rabb al-ʻĀlamīn wa-al-ṣalāh wa-al-salām ʻalá Sayyidinā Muḥammad khātim al-anbiyāʼ wa-al-mursalīn wa-raḍiya Allāh ʻan ālihi wa-aṣḥābihi wa-al-tābiʻīn la-hu bi-iḥsān ilá yawm al-dīn. Qāla al-Imām al-ʻālim al-ʻallāmah Abū ʻAbd Allāh al-Zinātī ʻafá Allāh ʻanhu bi-mannihi wa-karamih: Iʻlam ayyuhā al-ṭālib li-ʻilm al-athar wa-mūḍiḥ al-khabar sa-ūḍiḥu laka ʻan kull marmūz wa-mustatir thumma wa-iʻlam anna ʻilm al-raml al-maʻrūf bi-ʻilm al-athar mā huwa illā ʻilm maʼthūr wa-bi-al-adillah al-muʻtamadah mashhūr ḥaythu mā khaṭṭahu al-amīn Jubrāyīl ʻalayhi al-salām li-Nabī Allāh Idrīs ...""",w,10,7,1,4,2,0,0,zoe
13202396,880-02 al-Aḥkām al-muhimmah fī shurūṭ Ahl al-Dhimmah : manuscript / Ḍiyāʼ al-Dīn Abū al-Hudá ʻAlamī.,3,"Incipit: ""Bismillāh al-Raḥmān al-Raḥīm. al-Ḥamdu lillāh munshiʼ saḥāb al-maʻrifah fī samāʼ al-adhhān wa-muṭliʻ shams al-ʻināyah min mashriq al-fahm wa-maṭlaʻ al-bayān wa-munawwir al-jawāriḥ bi-ṣifāt al-ʻibādah wa-anwār al-īmān, wa-ashhadu an lā ilāha illā Allāh shahādata man waḥḥadahu ʻalá al-mushāhadah wa-al-ʻayān wa-ashhadu anna Muḥammadan ʻabduhu wa-rasūluhu al-mabʻūth lil-kāffah min ḍiʼḍiʼ Maʻadd ibn ʻAdnān, ṣallá Allāh ʻalayhi wa-ʻalá ālihi wa-aṣḥābihi al-makhṣūṣīn bi-al-riḍwān ... fa-qaṣada al-Amīr al-kabīr Sayf al-Dīn al-Mahrānī al-muʻadd la-hum wa-al-muḥakkam fīhim al-muʻayyan bayna al-aʻyān an adhkura la-hu mā warada fī dhālika min al-shurūṭ li-yakūna ḥujjah ʻinda al-imtiḥān fa-istakhartu Allāh wa-jamaʻtuhu bi-ḥaythu lā yaṭʻanu fīhi insān wa-sammaytuhu al-Aḥkām al-muhimmah fī shurūṭ Ahl al-Dhimmah ...""",w,11,7,1,4,2,0,0,zoe
13211813,880-01 Ashkāl al-taʼsīs min Kitāb Iqlīdis : manuscript.,3,"Incipit: ""Bismillāh al-Raḥmān al-Raḥīm. al-Ḥamdu lillāh Rabb al-ʻĀlamīn wa-al-ṣalāh ʻalá Nabīyihi Muḥammad wa-ālihi wa-aṣḥābihi al-ṭāhirīn. Wa-baʻd, fa-inna jamāʻah min al-fuḍalāʼ wa-ṭāʼifah min al-aṣdiqāʼ iltamasū minnī risālah takūnu muqaddimah wa-ālah fī iqtināʼ barāhīn al-ʻulūm al-ḥisābīyah ka-al-aʻmāl al-jabrīyah wa-al-misāḥīyah wa-dhālika muʼassas ʻalá ashkāl al-taʼsīs min Kitāb Iqlīdis wa-hiya ashkāl sharīfah yabtanī ʻlayhā barāhīn al-handasīyāt wa-yantahī ilayhā masāʼil al-riyāḍīyāt ...""",w,11,6,1,3,2,0,0,zoe
13211824,880-02 Faṣl al-khiṭāb fī uṣūl lughat al-Aʻrāb : manuscript / Nāṣīf ibn ʻAbd Allāh al-Yāzijī al-Lubnānī.,3,"Incipit: ""Bismillāh al-Fattāḥ. al-Ḥamdu lillāh alladhī ʻilmuhu yastaghriqu al-asmāʼ wa-al-afʻāl wa-bi-yadihi al-taṣrīf wa-al-salāmah wa-al-ṣiḥḥah wa-al-iʻlāl ḥamdan yuzlifunā ilayh yawma tablá al-sarāʼir wa-taẓhar al-ḍamāʼir. Ammā baʻd, fa-hādhā mukhtaṣar jaʻaltuhu ka-al-bāb fī qawāʻid al-taṣrīf wa-al-iʻrāb tastaʻīnu bi-hi al-ṭalabah al-aṣāghir ʻalá al-dukhūl ilá majlis al-akābir wa-qad sammaytuhu Faṣl al-khiṭāb fī uṣūl lughat al-Aʻrāb ...""",w,11,7,1,4,2,0,0,zoe
13211828,880-02 Ikmāl al-dīn wa-itmām al-niʻmah : manuscript / Abū Jaʻfar Muḥammad ibn ʻAlī ibn al-Ḥusayn ibn Mūsá ibn Bābawayh al-Qummī.,3,"Incipit: ""Bismillāh al-Raḥmān al-Raḥīm. Rabbi aʻin wa-waffiq ʻalá itmāmih. al-Ḥamdu lillāh al-wāḥid al-aḥad, al-fard al-ṣamad, al-qādir al-ʻalīm al-ḥakīm, taqaddasa wa-taʻālá ʻan ṣifāt al-makhlūqīn, dhī al-jalāl wa-al-ikrām wa-[...] wa-al-inʻām alladhī la-hu al-asmāʼ al-ḥusná wa-al-amthāl al-ʻulyā wa-al-ḥikmah al-bālighah ...""",w,13,7,1,4,2,0,0,zoe
13211829,880-02 Irshād al-sārī fī sharḥ al-Bukhārī. Volume 2 : manuscript / Aḥmad ibn Muḥammad al-Qasṭallānī.,3,"Incipit: Starts with ""Bāb al-fitan. Bi-ʻawn Allāh wa-qūwatih bi-al-tanwīn yadhkuru fīhi qawlahu ṣallá Allāh ʻalayhi wa-sallam: 'Man aḥabba liqāʼ Allāh aḥabba Allāh liqāʼah' ...""",w,13,7,1,4,2,0,0,zoe
13211834,880-02 Ḥāshiyah ʻalá Marāqī al-falāḥ : manuscript / Aḥmad ibn Muḥammad al-Ṭahṭāwī.,3,"Incipit: ""Bismillāh al-Raḥmān al-Raḥīm. al-Ḥamdu lillāh alladhī ayyada al-sharīʻat bi-wurrāthihā wa-rafaʻa bi-him manārahā wa-basaṭa athāthahā wa-al-ṣalāh wa-al-salām ʻalá Sayyidinā Muḥammad afḍal makhlūq wa-ʻalá ālihi wa-ṣaḥbihi al-ʻālimīn bi-al-ḥuqūq. Ammā baʻd, fa-hādhihi taqyīdāt laṭīfah li-Sharḥ Nūr al-īḍāḥ al-musammá bi-Marāq [bi-Marāqī] al-falāḥ, asʼalu Allāh tamāmahā wa-ḥusn ikhtitāmihā, jamaʻtuhā li-man huwa qāṣir mithlī rājiyan qabūlahā min Allāh al-walī al-ʻalī maʼkhūdhah mimmā katabahu al-marḥūm ʻAbd al-Raḥmān Afandī Ḥalawāt wa-min Sharḥ al-muʼallif al-kabīr wa-sharḥ al-Sayyid Muḥammad Abī al-Suʻūd, raḥima Allāh taʻālá al-jamīʻ ...""",w,12,7,1,4,2,0,0,zoe
13211838,880-02 Marāqī al-falāḥ bi-imdād al-Fattāḥ sharḥ Nūr al-īḍāḥ wa-najāt al-arwāḥ : manuscript / Ḥasan ibn ʻAmmār al-Shurunbulālī.,3,"Incipit: ""Bismillāh al-Raḥmān al-Raḥīm wa-bi-hi nastaʻīn. al-Ḥamdu lillāh alladhī sharrafa khulāṣat ʻibādihi bi-wirāthat ṣafwatih khayra ʻibādih wa-amaddahum bi-al-ʻināyah fa-aḥsanū li-dhātihi al-ʻibādah wa-ḥafiẓū sharīʻatahu wa-ballaghūhā ʻibādah ... Wa-baʻd fa-yaqūlu al-ʻabd al-dhalīl al-rājī ʻafwa rabbihi al-jalīl Ḥasan ibn ʻAmmār ibn ʻAlī al-Shurunbulānī al-Ḥanafī ... Inna hādhā kitāb ṣaghīr ḥajmuhu ghazīr ʻilmuhu ... wa-sammaytuhu Marāqī al-falāḥ bi-imdād al-Fattāḥ sharḥ Nūr al-īḍāḥ wa-najāt al-arwāḥ.""",w,13,7,1,4,2,0,0,zoe
13225978,880-03 Tafsīr Abī al-Saʻūd : al-musammá Irshād al-ʻaql al-salīm ilá mazāyā al-Kitāb al-Karīm : manuscript / Muḥammad ibn Muḥammad Abū al-Saʻūd.,3,"Incipit: ""Bismillāh al-Raḥmān al-Raḥīm. 'Yā ayyuhā alladhīn āmanū awfū bi-al-ʻuqūd'. al-Wafāʼ al-qiyām bi-mūjib al-ʻaqd wa-kadhā al-īfāʼ. Wa-al-ʻaqd huwa al-ʻahd al-muwaththaq al-mushabbah bi-ʻaqd al-ḥabl wa-naḥwih. Wa-al-murād bi-al-ʻuqūd mā yaʻumm jamīʻ mā alzamahu Allāh taʻālá ʻibādahu wa-ʻaqadahu ʻalayhim min al-takālīf wa-al-aḥkām al-dīnīyah wa-mā yaʻqudūnahu fīmā baynahum min ʻuqūd al-amānāt wa-al-muʻāmalāt wa-naḥwihā mimmā yajibu al-wafāʼ bi-hi aw yaḥsunu dīnan bi-an yuḥmala al-amr ʻalá maʻnan yaʻummu al-wujūb wa-al-nadb ...""",w,10,7,1,4,2,0,0,zoe
13225986,880-02 Multaqá al-abḥur : manuscript / Ibrāhīm ibn Muḥammad al-Ḥalabī.,3,"Incipit: ""Multaqá al-abḥur. Bismillāh al-Raḥmān al-Raḥīm. al-Ḥamdu lillāh alladhī waffaqanā lil-tafaqquh fī al-dīn alladhī huwa ḥabluhu al-matīn wa-faḍluhu al-mubīn wa-mīrāth al-anbiyāʼ wa-al-mursalīn wa-ḥujjatuhu al-dāmighah ʻalá al-khalq ajmaʻīn wa-maḥajjatuhu al-sālikah ilá aʻlá ʻillīyīn ...""",w,13,7,1,4,2,0,0,zoe
