bib_id,title,note_num,note_text,note_type,record_total_notes,record_typed_notes,w_count,o_count,a_count,aw_count,ow_count,source
13490718,880-02 al-Ifṣāḥ fī ʻaqd al-nikāḥ : manuscript / Ḥusayn ibn Muḥammad al-Maḥallī.,3,"Incipit: ""Bismillāh al-Raḥmān al-Raḥīm. al-Ḥamdu lillāh Rabb al-ʻĀlamīn, wa-al-ṣalāh wa-al-salām ʻalá Sayyidinā Muḥammad Sayyid al-mursalīn, wa-ʻalá ālihi wa-ṣaḥbihi ajmaʻīn, alladhī uhdīnā bi-hi wa-bi-aṣḥābihi lil-farq bayna al-ḥalāl wa-al-ḥarām, wa-jaʻala al-nikāḥ min sunanihi li-yubāhiya bi-kathrat atbāʻih yawm al-zuḥām, wa-ḥarrama zawāj al-Jāhilīyah ʻalá al-dawām ... Ammā baʻd, fa-yaqūlu al-faqīr al-muʻtarif bi-al-ʻajz wa-al-taqṣīr Mawlānā al-Shaykh Muḥammad al-Maḥallī al-Shāfiʻī ... hādhā taʻlīq laṭīf fī al-nikāḥ ʻalá al-madhāhib al-arbaʻ, li-yakūna mutaʻāṭīhi ʻalá baṣīrah ... wa-sammaytuhu al-Ifṣāḥ fī ʻaqd al-nikāḥ ...""",w,11,7,1,4,2,0,0,zoe
13490725,880-03 Sharḥ al-Bahjah al-Wardīyah : manuscript / Zakarīyā ibn Muḥammad al-Anṣārī.,3,"Incipit: ""Bismillāh al-Raḥmān al-Raḥīm. Bāb al-Farāʼiḍ. Jamʻ farīḍah [... ...] ay muqaddarah, li-mā fīhā min al-sihām al-muqaddarah. Wa-al-farḍ lughatan al-taqdīr wa-sharʻan hunā naṣīb muqaddar lil-wārith ...""",w,13,7,1,4,2,0,0,zoe
13490731,880-02 Ḥāshiyah ʻalá matn al-Sullam : manuscript / Ibrāhīm ibn Muḥammad al-Bājūrī.,3,"Incipit: ""Bismillāh al-Raḥmān al-Raḥīm. Wa-ṣallá Allāh ʻalá Sayyidinā Muḥammad wa-ʻalá ālihi wa-ṣaḥbihi wa-sallam. al-Ḥamdu lillāh alladhī khaṣṣ al-insān bi-al-manṭiq al-mufṣiḥ ʻammā fī al-ḍamīr min al-maknūnāt wa-afāḍ ʻalá riyāḍ ʻaqlihi ghayth saḥāb al-taṣawwurāt wa-al-taṣdīqāt ... Ammā baʻd, fa-yaqūlu rājī al-ʻafwa min al-Khabīr al-Laṭīf Ibrāhīm al-Bājūrī al-dhalīl al-ḍaʻīf ibn Muḥammad al-Jīzāwī, ghafara Allāh la-hu jamīʻ al-masāwī: Qad saʼalanī baʻḍ al-ikhwān, aṣlaḥ Allāh lī wa-la-hu al-ḥāl wa-al-shān kitābatan badīʻah al-niẓām takshufu ʻan al-muqddimah al-shahīrah bi-al-Sullam al-lithām ...""",w,10,7,1,4,2,0,0,zoe
13490743,880-02 Sharḥ al-Sullam al-murawnaq fī ʻilm al-manṭiq : manuscript / ʻAbd al-Raḥmān ibn Muḥammad al-Akhḍarī.,3,"Incipit: ""Bismillāh al-Raḥmān al-Raḥīm, wa-bi-hi nastaʻīn. al-Ḥamdu lillāh alladhī jaʻala qulūb al-ʻulamāʼ samāwāt tatajallá fīhā shumūs al-maʻārif, wa-wassaʻa dawāyir afhāmihim fa-awlajahum qibāb al-mukhaddarāt min ʻarāyis al-maʻānī wa-al-laṭāyif, wa-ḥabāhum bi-ḥadāyiq al-ʻuqūl fa-tanāwalū thamarātihā, fa-aṣbaḥt āfāq ʻuqūlihim mushriqah bi-aqmār al-ʻulūm ... Ammā baʻd, fa-lammā waḍaʻtu al-urjūzah al-musammāh bi-al-Sullam al-murawnaq fī ʻilm al-manṭiq, wa-jāʼat bi-ḥamd Allāh jumaluhu kāfiyah wa-li-maqāṣid min fannihā ḥāwiyah, rāwadanī baʻḍ al-ikhwān min al-ṭalabah, akramahum Allāh, al-marrah baʻda al-marrah, ʻalá an aḍaʻa ʻalyahā sharḥan mufīdan ... fa-ajabtuhu li-dhālika ...""",w,10,7,1,4,2,0,0,zoe
13490754,880-02 al-Lumʻah al-Māridīnīyah fī sharḥ al-Yāsamīnīyah : manuscript / Badr al-Dīn Muḥammad ibn Muḥammad Sibṭ al-Mārdīnī.,3,"Incipit: ""Bismillāh al-Raḥmān al-Raḥīm. al-Ḥamdu lillāh alladhī aḥṣá kull al-ashyāʼ ʻadadan, wa-jaʻala al-mawāl li-man aʻṭá wa-ittaqá wa-ṣaddaqa bi-al-ḥusná saʻādatan sarmadā, wa-ʻalá man bakhula wa-istaghná wa-kadhdhaba bi-al-ḥusná kuʻūb shuʼm tūqiʻu fī al-radā ... Wa-baʻd, fa-yaqūlu faqīr raḥmat rabbihi Muḥammad ibn Muḥammad Sibṭ al-Mārdīnī: Hādhā taʻlīq ʻalá al-urjūzah al-Yāsamīnīyah fī ʻilm al-jabr mukhtaṣar jiddan, lam yasʼalnī fīhi aḥad, wa-innamā walaghtu fīhi min al-baṭālah wa-al-kasal hurūban min al-ishtighāl wa-al-malal ... wa-naʻattuhu bi-al-Lumaʻah al-Māridīnīyah fī sharḥ al-Yāsamīnīyah ...""",w,13,7,1,4,2,0,0,zoe
13490805,880-02 Ḥāshiyah ʻalá Sharḥ Īsāghūjī : manuscript / Muḥammad ibn Ibrāhīm al-Dalajī.,3,"Incipit: ""Bismillāh al-Raḥmān al-Raḥīm. Ḥamdan li-man naṭaqat mawjūdātuhu bi-rubūbīyatih, wa-afāḍa ʻalá anwāʻ maṣnūʻātih ajnās al-niʻam biḥikmatih wa-raḥmatih, wa-ṣalá wa-sallama ʻalá Sayyidinā Muḥammad ashraf al-anbiyāʼ wa-al-mursalīn wa-ʻalá ālihi wa-aṣḥābihi al-azkiyāʼ wa-al-tābiʻīn la-hum bi-iḥsān ilá yawm al-dīn. Wa-baʻd, fa-yaqūlu al-faqīr ilá Allāh taʻālá Muḥammad ibn Ibrāhīm al-Dalajī: Hādhā taʻlīqun laṭīf ʻalá sharḥ Shaykh al-Islām li-matn Īsāghūjī, nāfiʻ in shāʼa Allāh li-man aḥsana nītatah wa-ṭahhara ṭawīyatah ...""",w,10,7,1,4,2,0,0,zoe
13490978,880-02 Akhbār Ibrāhīm ibn al-Mahdī wa-ukhtihi ʻUlayyah bint al-Mahdī wa-ashʻāruhumā : manuscript / jamʻ Abū Bakr Muḥammad ibn Yaḥyá al-Ṣūlī.,3,"Incipit: ""Bismillāh al-Raḥmān al-Raḥīm. Qāla Abū Bakr Muḥammad ibn Yaḥyá al-Ṣūlī: Hādhihi awrāq jamaʻtu fīhā akhbār Ibrāhīm ibn al-Mahdī wa-ukhtihi ʻUlayyah bint al-Mahdī wa-ashʻārahumā, fa-aqūlu: Ḥadathanī Yaḥyá ibn ʻAlī ʻan Aḥmad ibn Yaḥyá ibn Jābir, qāl ḥaddathanī Hibat Allāh ibn Ibrāhīm ibn al-Mahdī anna Muḥayyāh al-Ṭāʼifīyah umm walad al-Manṣūr kānat baʻathat bi-Shaklah umm Ibrāhīm ilá al-Ṭāʼif fa-nashaʼat hunāk, fa-faṣuḥat wa-qālat al-shiʻr, wa-anshadanī la-hā shiʻran fī akhin la-hā yuqālu la-hu Aḥmad ...""",w,12,7,1,4,2,0,0,zoe
13491005,880-03 Dīwān Ibn al-Fāriḍ : manuscript / edited by ʻAlī Sibṭ al-Shaykh Sharaf al-Dīn ʻUmar ibn al-Fāriḍ.,3,"Incipit: ""Bismillāh al-Raḥmān al-Raḥīm wa-bi-hi nastaʻīn. al-Ḥamdu lillāh alldhī khaṣṣa ḥabībah al-athná [al-asná] bi-maqām qāb qawsayn aw adná, wa-qarana ismahu al-sharīf bi-aʻẓam asmāʼihi al-ḥusná ... qāla al-faqīr al-muʻtarif bi-dhanbihi al-mughtarif min nahr ʻaṭā rabbihi ʻAlī Sibṭ al-Shaykh Sharaf al-Dīn ʻUmar ibn al-Fāriḍ, al-rājī karama rabbihi al-fāyiḍ ... naẓartu fī nusakh min dīwān Shaykhinā, qaddasa Allāh sirrahu wa-sharaḥ ṣadrahu bi-al-naẓar ilayhi wa-barrahu, fa-raʼaytu al-nussākh jahilū baʻḍ kalāmihi wa-mā ʻarafūhu, wa-ishtabaha ʻalayhim shayʼ min jināsihi fa-ṣaḥḥafūhu wa-akhrajūhu bi-dhālika ʻan aṣlih ...""",w,11,7,1,4,2,0,0,zoe
13491017,880-02 Kanz al-dhakhāʼir wa-hadīyat al-musāfir ilá al-nūr al-sāfir : manuscript / Jalāl al-Dīn Muḥammad ibn Aḥmad ibn ʻAlī al-Maḥallī al-Samannūdī al-Shāfiʻī al-Rifāʻī.,3,"Incipit: ""Bismillāh al-Raḥmān al-Raḥīm. al-Ḥamdu lillāh dhī al-birr al-ghāmir wa-al-faḍl al-wāfir, al-awwal wa-al-ākhir. Aḥmaduhu ʻalá iḥsānihi al-mutawātir ḥamdan yakūnu ʻiṣmatan lil-ḥāḍir wa-zādan lil-musāfir, wa-astaghfiruhu min jamīʻ al-kabāʼir wa-al-ṣaghāʼir ... Ammā baʻd, fa-qad saʼalanī jamāʻah min al-ikhwān wa-min akābir al-fuḍalāʼ al-aʻyān fī sharḥ al-qaṣīdah al-Tāʼīyah al-mashūrah bi-al-Subkīyah ... fa-ajabtuhum li-masʼalatihim wa-fāʼan li-ṣāliḥ adʻiyatihim ...""",w,11,7,1,4,2,0,0,zoe
13491061,880-02 al-Minaḥ al-Makkīyah fī sharḥ al-Hamzīyah : manuscript / Aḥmad ibn Muḥammad ibn Ḥajar al-Haythamī.,3,"Incipit: ""Bismillāh al-Raḥmān al-Raḥīm. Rabbi yassir. al-Ḥamdu lillāh alldhī ikhtaṣṣa Nabīyanā Muḥammad, ṣallá Allāh ʻalayhi wa-sallam bi-kitāb akhrasa al-fuṣaḥāʼ wa-aʻjaza al-bulaghāʼ ʻan al-tafawwuh bi-mithl aqṣar sūrah min suwarihi, bal āyah min āyātih, wa-bi-jawāmiʻ al-kalim wa-badāyiʻ al-ḥikam wa-ʻaẓīm al-khuluq fī sāyir aqwālihi wa-afʻālihi wa-ḥālātih, wa-kharaq la-hu khawāriq al-wujūd bi-muʻjizāt abharat al-ʻuqūl, wa-qaṣura ʻan iḥṣāʼihā istiqṣāʼ al-mādiḥīn ...""",w,16,7,1,4,2,0,0,zoe
13525055,880-02 al-Ṣalawāt al-birrīyah fī al-ṣalāh ʻalá khayr al-barīyah : manuscript / Muṣṭafá ibn Kamāl al-Dīn al-Bakrī al-Ṣiddīqī.,3,"Incipit: ""Bismillāh al-Raḥmān al-Raḥīm wa-bihi nastaʻīn. al-Ḥamdu lillāh alladhī ikhtaṣṣanā bi-Sayyid al-Anām nabīyan wa-rasūlan, wa-khaṣṣanā bi-sanad lā yuḍām malīyan maʼmūlan, wa-khallaṣanā bi-madad lā yusām marḍīyan maqbūlan ...""",w,11,7,1,4,2,0,0,zoe
13525092,880-02 Sharḥ al-Sullam al-murawnaq fī ʻilm al-manṭiq : manuscript / Aḥmad ibn ʻAbd al-Fattāḥ al-Mullawī.,3,"Incipit: ""Bismillāh al-Raḥmān al-Raḥīm. al-Ḥamdu lillāh al-ʻālim bi-al-kullīyāt wa-al-juzʼīyāt, al-hādī lil-ʻuqūl ilá ḥall ṣiʻāb al-maʻqūl bi-ṭuruq iktisāb al-taṣawwurāt wa-al-taṣdīqāt, wa-al-ṣalāh wa-al-salām ʻalá Sayyidinā Muḥammad al-jāmiʻ li-ajnās al-kamālāt wa-al-faḍāyil, al-mukhtār min afḍal al-anwāʻ wa-ashraf aṣnāf al-urūmāt wa-al-qabāʼil ...""",w,10,7,1,4,2,0,0,zoe
13525110,880-03 al-Maṭlaʻ : Sharḥ Īsāghūjī fī al-manṭiq : manuscript / Zakarīyā ibn Muḥammad al-Anṣārī.,3,"Incipit: ""Bismillāh al-Raḥmān al-Raḥīm. Qāla Shaykhunā al-Imām al-ʻālim al-ʻallāmah, shaykh al-ṭarīqah wa-maʻdin al-ḥaqīqah, waḥīd dahrihi wa-farīd ʻaṣrih ... Zakarīyā ibn Muḥammad ibn Aḥmad ibn Zakarīyā al-Anṣārī al-Shāfiʻī ... Wa-baʻd, fa-hādhā sharḥ laṭīf li-kitāb al-ʻAllāmah Athīr al-Dīn al-Abharī, raḥimahu Allāh, al-musammá bi-Īsāghūjī fī ʻilm al-manṭiq, yaḥullu alfāẓah wa-yubayyinu murādah, wa-yaftaḥu mughlaqah, wa-yuqayyidu muṭlaqah, ʻalá wajh laṭīf wa-manhaj munīf. Wa-sammaytuhu ""al-Maṭlaʻ"". Wa-Allāh asʼal an yanfaʻa bi-hi, wa-Huwa ḥasbī wa-niʻma al-wakīl ...""",w,9,7,1,4,2,0,0,zoe
13525136,880-02 Mukhtaṣar fī ʻilm al-ḥisāb : manuscript / ʻAbd al-Qādir ibn ʻAlī al-Sakhāwī.,3,"Incipit: ""Bismillāh al-Raḥmān al-Raḥīm. Yā Fattāḥ. Yā ʻAlīm. al-Ḥamdu lillāh Rabb al-ʻĀlamīn. Wa-ṣallá Allāh ʻalá Sayyidinā Muḥammad wa-ʻalá ālihi wa-ṣaḥbihi wa-sallam. Wa-baʻd, fa-yaqūlu [al-faqīr] ilá raḥmat Rabbih, ʻAbd al-Qādir ibn ʻAlī al-Sakhāwī al-Shāfiʻī, ʻāmalahumā Allāh bi-luṭfihi al-khafī fī al-dunyā wa-al-ākhirah: Hādhā Mukhtaṣar fī ʻilm al-ḥisāb, sahl lil-mubtadī, nāfiʻ, in shāʼa Allāh taʻālá, rattabtuhu ʻalá muqaddimah wa-aḥada ʻashara bāban wa-khātimah, fī ṣifat al-aḥruf al-Hindīyah, wa-hiya tisʻat ashkāl, hākadhā ...""",w,12,7,1,4,2,0,0,zoe
13525144,880-02 al-Aḍwāʼ al-bahijah fī ibrāz daqāʼiq al-Munfarijah : manuscript / Zakarīyā ibn Muḥammad al-Anṣārī.,3,"Incipit: ""Bismillāh al-Raḥmān al-Raḥīm wa-bi-hi nastaʻīn. Qāla al-Shaykh al-Imām al-ʻālim al-ʻallāmah al-muḥaqqiq al-ruḥalah mufīd al-ṭālibīn ḥujjat al-munāẓirīn wa-lisān al-mutakallimīn muḥyī al-Sunnah fī al-ʻālamīn, Abū Yaḥyá Zayn al-Dīn Zakarīyā ibn Muḥammad ibn Aḥmad al-Anṣārī al-Shāfiʻī ... al-Ḥamdu lillāh al-mufrij lil-karab ʻuqayb al-shiddah, al-munjī li-khalāṣ ʻibādih min ghayāhib al-ẓulam al-muʻaddah ... wa-baʻd, fa-hādhā mā ishtaddat ilayhi ḥājat al-mutafahhimīn lil-Munfarijah, qaṣīdat al-Imām ... al-Rabbānī Abī al-Faḍl Yūsuf ibn Muḥammad ibn Yūsuf, al-Tawzarī al-aṣl, al-maʻrūf bi-Ibn al-Naḥwī ... min sharḥ yaḥullu alfāẓahā wa-yubayyinu murādahā ...""",w,11,7,1,4,2,0,0,zoe
13525187,880-03 Mawrid al-ẓamʼān fī marsūm khaṭṭ al-Qurʼān : manuscript / Muḥammad ibn Muḥammad al-Kharrāz.,3,"Incipit: ""Bismillāh al-Raḥmān al-Raḥīm wa-bi-hi nastaʻīn. Wa-ṣallá Allāh ʻalá Sayyidinā Muḥammad wa-ʻalá ālihi wa-ṣaḥbihi wa-sallam. Qāla al-Shaykh al-Imām al-ʻālim Abū ʻAbd Allāh Muḥammad ibn al-Umawī al-shahīr bi-al-Kharrāz, raḥimahu Allāh taʻālá wa-raḍiya ʻanh: al-Ḥamdu lillāh al-ʻaẓīmi al-minani // wa-mursili al-rusli bi-ahdá al-sunani. Li-yublighū al-daʻwata lil-ʻibādi // wa-yūḍiḥū mahāyiʻa al-irshādi ...""",w,11,7,1,4,2,0,0,zoe
13525200,880-03 Nihāyat al-muḥtāj ilá sharḥ al-Minhāj : manuscript / Muḥammad ibn Aḥmad al-Ramlī.,3,"Incipit: ""Bismillāh al-Raḥmān al-Raḥīm. Kitāb al-Nikāḥ. Huwa lughatan al-ḍamm wa-al-waṭy, wa-sharʻan ʻaqd yataḍamman ibāḥat waṭy bi-al-lafẓ al-ātī. Wa-huwa ḥaqīqah fī al-ʻaqd majāz fī al-waṭy li-ṣiḥḥat baqīyat ʻaynih ...""",w,9,7,1,4,2,0,0,zoe
13525216,880-03 al-Juzʼ al-thānī min Sharḥ al-Nuqāyah : manuscript / al-Qāsim ibn ʻAbd Allāh ibn Quṭlūbughā.,3,"Incipit: ""Bismillāh al-Raḥmān al-Raḥīm. Allāhumma yassir wa-tammim bi-khayr, yā karīm. Kitāb al-buyūʻ. Huwa mubādalat māl bi-māl bi-tarāḍin. Qultu: Ahmala fī aṣl al-kitāb lafẓ ""bi-tarāḍin"", fa-qāl al-muṣannif fī sharḥihi innamā tarakahu li-yashmula bayʻ al-mukrah, fa-innahu bayʻ munʻaqid, fa-taʼammal kayfa zāda mā nabbaha ʻalá awlawīyat tarkih. ""Yanʻaqid"", ay tathbut al-mubādalah ""bi-ījāb"", wa-huwa mā dhakara awwalan min qawlihi biʻtu aw ishtaraytu, wa-naḥwuhu ...""",w,14,7,1,4,2,0,0,zoe
13525235,880-03 al-Juzʼ al-thānī min Ḥāshiyat al-Ṣaʻīdī ʻalá Sharḥ al-Kharshī ʻalá Mukhtaṣar Khalīl : manuscript / ʻAlī ibn Aḥmad al-Ṣaʻīdī al-ʻAdwī.,3,"Incipit: ""Bismillāh al-Raḥmān al-Raḥīm, wa-bi-hi nastaʻīn. Bāb al-Ḥajj. Qawluhu 'Wa-huwa al-qiyās' li-annahu maṣdar ḥajja, qiyāsuhu al-fatʹḥ, illā annaka khabīr bi-anna al-murād bi-al-ḥajj huwa al-hayʼah al-makhṣūṣah al-mawṣūfah bi-annahā duʻāmah, wa-laʻallahu li-ajl dhālika kān al-kasr akthar samāʻan ...""",w,11,7,1,4,2,0,0,zoe
13525239,880-02 Sharḥ Umm al-barāhīn : manuscript / Muḥammad ibn Manṣūr al-Hudhudī.,3,"Incipit: ""Bismillāh al-Raḥmān al-Raḥīm. al-Ḥamdu lillāh alladhī shahidat bi-wujūdihi jamīʻ al-kāʼināt, wa-al-ṣalāh wa-al-salām ʻalá Sayyidinā Muḥammad al-mabʻūth bi-al-āyāt al-wāḍiḥāt, wa-ʻalá ālihi wa-ṣaḥbihi al-tābiʻīn la-hum fī al-karāmāt ilá Yawm al-Qiyāmah. al-Ḥamdu lillāh wa-al-ṣalāh wa-al-salām ʻalá Rasūl Allāh. al-Ḥamd huwa al-thanāʼ bi-al-lisān bi-al-jamīl min al-awṣāf, aw al-afʻāl, ka-al-ʻilm wa-al-jūd bi-al-minan wa-huwa ḍidd al-dhamm alladhī huwa al-thanāʼ bi-al-qabīḥ min al-awṣāf wa-al-afʻāl, ka-al-jahl wa-al-bukhl ...""",w,12,7,1,4,2,0,0,zoe
13525249,880-02 Ḥāshiyah ʻalá sharḥ al-Sanūsī lil-ʻAqīdah al-ṣughrá : manuscript / ʻĪsá ibn ʻAbd al-Raḥmān al-Saktānī.,3,"Incipit: ""Bismillāh al-Raḥmān al-Raḥīm. Wa-ṣallá Allāh ʻalá Sayyidnā Muḥammad wa-ālihi wa-sallam. [Qāla] al-Shaykh al-Imām al-ʻālim, khātimat al-muḥaqqiqīn, qāḍī al-jamāʻah bi-Murrākush, Sayyidī Abū Mahdī ʻĪsá ibn ʻAbd al-Raḥmān al-Saktānī, raḥimahu Allāh taʻālá bi-mannih. Āmīn. al-Ḥamdu lillāh Rabb al-ʻĀlamīn wa-al-ṣalāh wa-al-salām ʻalá Sayyidinā Muḥammad khātim al-nabīyīn wa-imām al-mursalīn, wa-al-riḍá ʻan ālihi wa-aṣḥābihi wa-ʻan al-tābiʻīn la-hum fī silk minhāj al-muttaqīn: Fa-hādhā taqyīdun qaṣadtu fīhi, bi-ʻawn Allāh wa-tawfīqih, ilá tabyīn baʻḍ mā yakhfá tabyīnuhu min ḥall mā ʻasá an yastaṣʻiba al-ṭālib min alfāẓ minhu sh. (sharḥ) al-ʻAqīdah al-ṣughrá lil-Imām Abī ʻAbd Allāh Sayyidī Muḥammad ibn Yūsuf al-Sanūsī ...""",w,10,7,1,4,2,0,0,zoe
13525254,880-02 Ḥāshiyah ʻalá sharḥ Tuḥfat al-ikhwān fī fann al-bayān : manuscript / Muḥammad ibn ʻAlī al-Jirjāwī.,3,"Incipit: ""Bismillāh al-Raḥmān al-Raḥīm. Naḥmaduka anta al-wāḥid al-ghaffār, fa-laka al-ḥamd ḥaqīqatan wa-li-ghayrika mustaʻār. Wa-nuṣallī wa-nusallimu ʻalá man washaḥtahu bi-laṭāʼif imdādik, Sayyidinā Muḥammad alladhī jaʻaltahu aṣlan li-makhlūqātik, wa-ʻalá ālihi wa-aṣḥābihi al-mutajarridīn ʻan shawāʼib abʻādik. wa-baʻd, fa-yaqūlu rājī ghafr al-masāwī, Muḥammad ibn ʻAlī al-Jirjāwī: Hādhihi kalimāt qalīlah mushtamilah ʻalá fawāʼid jalīlah ʻalá sharḥ Sayyidī al-ʻārif billāh taʻālá al-Shaykh Aḥmad al-Dardīr ʻalá risālatihi al-musammāh bi-Tuḥfat al-ikhwān fī fann al-bayān. Qāla, raḍiya Allāh taʻālá ʻanh wa-amaddanā bi-imdādih: Bismillāh al-Raḥmān al-Raḥīm. Lā baʼsa bi-al-taʻarruḍ li-shayʼ mimmā iḥtawat ʻalayhi hādhihi al-jumlah al-sharīfah yakūnu munāsiban li-hādhā al-fann, fa-aqūlu: Qāl Sībawayh: al-Bāʼ ḥaqīqatuhā an takūna lil-ilṣāq wa-al-ikhtilāṭ ...""",w,9,7,1,4,2,0,0,zoe
13525261,880-02 Sharḥ Umm al-barāhīn : manuscript / Muḥammad ibn Manṣūr al-Hudhudī.,3,"Incipit: ""Bismillāh al-Raḥmān al-Raḥīm. Rabbi yassir bi-al-khayr. al-Ḥamdu lillāh alladhī shahida bi-wujūdihi jamīʻ al-kāʼināt, wa-al-ṣalāh wa-al-salām ʻalá Sayyidinā Muḥammad al-mabʻūth bi-al-āyāt al-wāḍiḥāt, wa-ʻalá ālihi wa-al-tābiʻīn la-hum fī al-karāmāt ilá Yawm al-Dīn. al-Ḥamdu lillāh wa-al-ṣalāh wa-al-salām ʻalá Rasūl Allāh. Sh. [Sharḥ] al-Ḥamd huwa al-thanāʼ bi-al-lisān bi-al-jamīl min al-awṣāf, wa-al-afʻāl, ka-al-ʻilm wa-al-jūd wa-al-minan wa-huwa ḍidd al-dhamm alladhī huwa al-thanāʼ bi-al-qabīḥ min al-awṣāf wa-al-afʻāl, ka-al-jahl wa-al-bukhl ...""",w,11,7,1,4,2,0,0,zoe
13525272,880-02 Shajarat al-kawn : manuscript / Muḥyī al-Dīn ibn al-ʻArabī.,3,"Incipit: ""Bismillāh al-Raḥmān al-Raḥīm. al-Ḥamdu lillāh al-aḥadī al-dhāt, al-fardī al-ṣifāt, alladhī taqaddasa wajhuhu ʻan al-jihāt, wa-qaddasahu ʻan al-muḥdathāt, wa-qadamuhu ʻan al-jihāt, wa-yaduhu ʻan al-ḥarakāt, wa-ʻaynuhu ʻan al-laḥaẓāt, wa-istiwāʼuhu ʻan al-ittiṣālāt, wa-qudratuhu ʻan al-hafawāt, wa-irādatuhu ʻan al-shahawāt, alladhī lā taʻaddud li-ṣifātih bi-ʻadad al-mawṣūfāt, wa-lā takhtalif irādatuhu bi-ikhtilāf al-murādāt, wa-kawwan bi-kalimat ""Kun"" jamīʻ al-kāʼināt, wa-awjada bi-hā al-mawjūdāt ...""",w,9,7,1,4,2,0,0,zoe
13525300,880-02 Ḥāshiyah ʻalá Sharḥ al-Hudhudī : manuscript / ʻAlī ibn Khiḍr ibn Aḥmad al-ʻAmrūsī.,3,"Incipit: ""Bismillāh al-Raḥmān al-Raḥīm wa-bi-hi nastaʻīn. Yaqūlu al-ʻabd al-faqīr ilá Rabbihi al-qadīr, ʻAlī ibn Khiḍr ibn Aḥmad al-ʻAmrūsī, askanahu Allāh bi-mannihi Jannat al-Firdaws: al-Ḥamdu lillāh alladhī anʻama ʻalá al-insān bi-maʻrifatih, wa-al-ṣalāh wa-al-salām ʻalá Muḥammad wa-ālihi. Wa-baʻd, fa-hādhihi ḥawāshin kāshifah li-mā lam yattaḍiḥ maʻnāh min alfāẓ Sharḥ al-ʻAllāmah Sayyidī Muḥammad ibn Manṣūr al-Hudhudī, jamaʻtuhā qāṣidan bi-dhālika al-thawāb min al-Karīm al-Wahhāb ...""",w,11,7,1,4,2,0,0,zoe
13525303,880-02 Ḥuṣūl al-rifq bi-uṣūl al-rizq : manuscript / Jalāl al-Dīn ʻAbd al-Raḥmān ibn Abī Bakr al-Suyūṭī.,3,"Incipit: ""Bismillāh al-Raḥmān al-Raḥīm. Wa-ṣallá Allāh ʻalá man lā nabī baʻdah. al-Ḥamdu lillāh wa-kafá, wa-salāmun ʻalá ʻibādihi alladhīn iṣṭafá. Wa-baʻd, fa-qad saʼalanī sāʼil ʻammā warada fī al-Ḥadīth min al-adhkār wa-al-afʻāl al-jālibah lil-rizq [...] fīhā man ḍāqa ʻalayhi rizquhu wa-taʻassarat ʻalayhi maʻīshatuh li-qawlihi [taʻālá] fa-ibtaghū ʻinda [Allāh] al-rizq. Thumma saʼalanī ākhar wa-ākhar, fa-jamaʻtu lahum hādhā al-juzʼ wa-sammaytuhu Ḥuṣūl al-rifq bi-uṣūl al-rizq ...""",w,11,7,1,4,2,0,0,zoe
13525311,880-03 Sharḥ al-Ushmūnī ʻalá Alfīyat Ibn Mālik : manuscript / ʻAlī ibn Muḥammad al-Ushmūnī.,3,"Incipit: ""Bismillāh al-Raḥmān al-Raḥīm. Qāla al-Shykh al-Imām, al-ʻālim al-humām, al-muḥaqqiq al-mudaqqiq, Nūr al-Dīn Abū al-Ḥasan, ʻAlī ibn Muḥammad al-Ushmūnī al-Shāfiʻī, raḥimahu Allāh taʻālá: Ammā baʻd ḥamd Allāh ʻalá mā manaḥa min asbāb al-bayān, wa-fataḥ min abwāb al-tibyān, wa-al-ṣalāh wa-al-salām ʻalá man rafaʻa bi-māḍī al-ʻazm qawāʻid al-īmān, wa-khafaḍa bi-ʻāmil al-jazm kalimat al-buhtān, Muḥammad al-muntakhab min khulāṣat Maʻadd wa-lubāb ʻAdnān, wa-ʻalá ālihi wa-aṣḥābihi alladhīna aḥrazū qaṣabāt al-sabq fī miḍmār al-iḥsān ...""",w,10,7,1,4,2,0,0,zoe
13525315,880-02 Taḥbīr al-muwashshīn fī al-taʻbīr bi-al-Sīn wa-al-Shīn : manuscript / Muḥammad ibn Yaʻqūb al-Fīrūzābādī.,3,"Incipit: ""Bismillāh al-Raḥmān al-Raḥīm. al-Ḥamdu lillāh Rabb al-ʻĀlamīn, ḥamdan yastawjibu qāʼiluhu al-iḥsān wa-al-taḥsīn, wa-yastajlibu la-hu fī maʼāzim al-maḍāʼiq al-khalāṣ min al-taʻishīn wa-al-taʻisīn, wa-al-ṣalāh wa-al-salām ʻalá Nabīyinā Muḥammad khayr al-khalāʼiq wa-Sayyid al-unāsīn, alladhī alqá Allāh zubdat al-faṣāḥah ʻalá lisānihi fa-khāṭabahu bi-Ṭāhā wa-Yāsīn ...""",w,12,7,1,4,2,0,0,zoe
13525317,880-02 al-Alfīyah : manuscript / Muḥammad ibn ʻAbd Allāh ibn Mālik.,3,"Incipit: ""Bismillāh al-Raḥmān al-Raḥīm. Lā ilāha illā Allāh. Muḥammad Rasūl Allāh. Qāla al-Shaykh al-Imām, al-ʻālim al-fāḍil, ḥujjat al-ʻArab wa-kanz al-adab, waḥīd dahrihi wa-farīd ʻaṣrihi, Abū ʻAbd Allāh Muḥammad ibn Mālik, raḥmat Allāh ʻalayh: Qāla Muḥammadun huwa Ibnu Māliki // Aḥmadu Rabbī Allāha khayra māliki ...""",w,12,7,1,4,2,0,0,zoe
13525322,880-02 al-Nukāt al-ḥisān ʻalá mā waqaʻa lil-Najm al-Ghayṭī ʻalá awāʼil Sūrat al-Dukhān wa-faḍāʼil Laylat al-Niṣf min Shaʻbān : manuscript / Nūr al-Dīn ʻAlī ibn Ibrāhīm al-Ḥalabī.,3,"Incipit: ""Bismillāh al-Raḥmān al-Raḥīm. Wa-bi-hi thiqatī. al-Ḥamdu lillāh alladhī fī kull yawm huwa fī shān, wa-al-ṣalāh wa-al-salām ʻalá ashraf nawʻ al-insān, wa-ʻalá ālihi wa-aṣḥābihi al-mamdūḥīn fī al-isrār wa-al-iʻlān. Wa-baʻd, fa-yaqūlu afqar al-muḥtājīn ʻAlī ibn Burhān al-Dīn al-Ḥalabī al-Shāfiʻī al-Aḥmadī: Hādhihi Nukāt ḥisān mushtamilah ʻalá ḥusn al-bayān li-mā waqaʻa fīmā katabahu al-Najm al-Ghayṭī ʻalá awāʼil Sūrat al-Dukhān wa-faḍāʼil Laylat al-Niṣf min Shaʻbān, ʻallaqtuhā ʻinda mudhākarat baʻḍ al-ikhwān, min ghayr mazīd taʼammul wa-itqān wa-taftīsh wa-imʻān. Qawluhu ...""",w,12,7,1,4,2,0,0,zoe
13537900,880-02 al-Anwār al-bahijah fī ẓuhūr kunūz al-Munfarijah : manuscript / ʻAbd al-Raḥmān ibn al-Ḥasan al-Maqābirī.,3,"Incipit: ""Bismillāh al-Raḥmān al-Raḥīm. Wa-ṣallá Allāh ʻalá Sayyidinā Muḥammad. al-Ḥamdu lillāh alladhī azāḥa ʻan qulūb awliyāʼihi shiddat muʻālajat al-nufūs wa-afraja la-hum ʻan sarrāʼ daqqāt qulūbihim ghayāhib al-ghaflah, fa-hum fī baḥr mushāhadatihi ghumūs. Wa-al-ṣalāh wa-al-salām ʻalá Sayyidinā Muḥammad alladhī huwa li-sāʼir al-anbiyāʼ ʻarūs, wa-ʻalá ālihi wa-aṣḥābihi wa-atbāʻihi alladhīn hum li-aʻdāʼ Allāh ʻubūs ...""",w,14,7,1,4,2,0,0,zoe
13537991,880-02 Sharḥ al-Unmūdhaj fī al-naḥw : manuscript / Muḥammad ibn ʻAbd al-Ghanī al-Ardabīlī.,3,"Incipit: ""Bismillāh al-Raḥmān al-Raḥīm wa-bi-hi nastaʻīn. al-Ḥamdu lillāh alladhī jaʻala al-ʻArabīyah miftāḥ al-bayān wa-ṣayyarahā ālatan <bi-hā> yuḥtarazu bi-hā ʻan al-khaṭaʼ fī al-lisān wa-qawwama bi-sababihā al-manṭiqa alladhī huwa al-mumayyizu lil-insān wa-hayyaʼahā sullaman yurtaqá bi-hā ilá dhurwat ḥaq̄āʼiq al-Qurʼān, wa-al-ṣalāh wa-al-salām ʻalá khayr al-anām, Muḥammad ṣāḥib al-Furqān, wa-ʻalá ālihi wa-aṣḥābih ruʼasāʼ ahl al-īmān ...""",w,9,7,1,4,2,0,0,zoe
13538058,880-03 Awḍaḥ al-masālik ilá Alfīyat Ibn Mālik : manuscript / ʻAbd Allāh ibn Yūsuf ibn Hishām.,3,"Incipit: The incipit is missing. Starts with: ""... fa-lā yujmaʻu naḥwa jarīḥ wa-ṣabūr wa-sakrān wa-aḥmar. Faṣl. Wa-ḥamalū ʻalá hādhā al-jamʻ arbaʻat anwāʻ: Aḥaduhā asmāʼ jumūʻ, wa-hiya: Ulū, wa-ʻālamūn, wa-ʻishrūn wa-bābuhu ilá al-tisʻīn ...""",w,11,7,1,4,2,0,0,zoe
