bib_id,title,note_num,note_text,note_type,record_total_notes,w_count,o_count,a_count,aw_count,ow_count,ao_count,unknown_count,source
14526450,880-02 Ḥāshiyah ʻalá Sharḥ al-Sullam : manuscript / Muḥammad ibn ʻAlī al-Ṣabbān.,3,"Incipit: ""Bismillāh al-Raḥmān al-Raḥīm, wa-bi-hi thiqatī. Naḥmaduka yā man afāḍa ʻalá riyāḍ ʻuqūlinā ghuyūth saḥāʼib al-taṣawwurāt wa-al-taṣdīqāt, wa-aṭlaʻa fī samāwāt baṣāʼirinā shumūs maʻrifat al-kullīyāt wa-al-juzʼīyāt. Wa-nashhadu an lā ilāha illā anta waḥdaka, lā sharīka lak, al-munʻim ʻalá ajnās al-makhlūqāt bi-anwāʻ al-hibāt. Wa-nashhadu anna Sayyidanā Muḥammadan ʻabduka wa-rasūluk al-mabʻūth bi-al-burhān al-wāḍiḥ wa-al-qawl al-shāriḥ wa-al-āyāt al-bayyināt, ṣallá Allāh ʻalayhi wa-ʻalá ālihi wa-aṣḥābihi mā tarannamat ashkāl al-ghuṣūn bi-anfās al-nasamāt, wa-afṣaḥa dhū manṭiq ʻammā fī khazāʼin ḍamīrihi min al-mukawwināt. Ammā baʻd, fa-yaqūlu rājī al-ghufrān Muḥammad ibn ʻAlī al-Ṣabbān, aḥsana Allāh ʻamalah wa-ballaghahu fī al-dārayn amalah: Lammā manna al-Mawlá al-laṭīf ʻalá hādhā al-ʻabd al-ḍaʻīf bi-qirāʼat al-Sharḥ al-ṣaghīr ʻalá al-Sullam li-Shaykhinā al-ruḥalah al-Ustādh al-Mullawī, ʻalá muʼallafihi wa-ʻalayhi ruḍwān al-Rabb al-akram, wa-bi-qrāʼī dhālika al-kitāb li-jamm ghafīr min maharat al-ṭullāb, wa-taḥaṣṣala minhā mā yassarahu Allāh taʻālá min taqrīrāt sharīfah wa-taḥqīqāt badīʻah munīfah wa-nikāt almaʻīyah wa-daqāʼiq lawdhaʻīyah naẓamtuhā fī silk al-taṣnīf wa-jaʻaltuhā ḥāshiyah ʻalá hādhā al-Sharḥ al-munīf ...""",w,12,7,2,2,0,1,0,0,martin
14526450,880-02 Ḥāshiyah ʻalá Sharḥ al-Sullam : manuscript / Muḥammad ibn ʻAlī al-Ṣabbān.,4,Secundo folio: wa-tasāhala fī mawāḍiʻ kathīrah.,w,12,7,2,2,0,1,0,0,martin
14526450,880-02 Ḥāshiyah ʻalá Sharḥ al-Sullam : manuscript / Muḥammad ibn ʻAlī al-Ṣabbān.,8,"On folio 1a: ""Ḥāshiyat al-Imām al-ʻālim al-ʻallāmah wa-al-ḥabr al-baḥr al-fahhāmah al-Shaykh al-Ṣabbān ʻalá Mullawī al-Sullam. Manṭiq.""",w,12,7,2,2,0,1,0,0,martin
14526450,880-02 Ḥāshiyah ʻalá Sharḥ al-Sullam : manuscript / Muḥammad ibn ʻAlī al-Ṣabbān.,9,"Author's colophon: ""Qāla muʼallifuhu: Tamma tabyīḍ hādhihi al-Ḥāshiyah ʻalá yad muʼallifihā al-faqīr ilá raḥmat Mawlāh, Muḥammad al-Ṣabbān, ʻāmalahu Allāh bi-al-ghufrān wa-al-iḥsān, wa-kāna tamām tabyīḍihā yawm al-Arbiʻāʼ li-arbaʻ layālin baqiyat min shahr Muḥarram al-ḥarām, ifttitāḥ sanat 1197, sabʻ wa-tisʻīn wa-miʼah wa-alf min al-Hijrah al-Nabawīyah, ʻalá ṣāḥibihā afḍal al-ṣalāh wa-atamm al-salām.""",w,12,7,2,2,0,1,0,0,martin
14526450,880-02 Ḥāshiyah ʻalá Sharḥ al-Sullam : manuscript / Muḥammad ibn ʻAlī al-Ṣabbān.,10,"Translation of the author's colophon: ""Its author said: The fair copy of this Gloss was completed by the hand of its author, the poor to the mercy of his Lord, Muḥammad al-Ṣabbān, may God bestow upon him forgiveness and favor, having been completed on Wednesday, four nights remaining from the month of Muḥarram, the beginning of the year 1197 of the Hijrah of the Prophet [1 January, 1783], may the best prayer and the most perfect peace be upon Him.""",w,12,7,2,2,0,1,0,0,martin
14526450,880-02 Ḥāshiyah ʻalá Sharḥ al-Sullam : manuscript / Muḥammad ibn ʻAlī al-Ṣabbān.,11,"Copyist's colophon: ""Wa-kāna al-farāgh min kitābatihā yawm al-Arbiʻāʼ ayḍan, baʻda al-ẓuhr, tāsiʻ ʻashar yawm maḍá min shahr Rabīʻ al-Thānī, ʻaqiba mawlid Sayyidinā al-Imām al-Ḥusayn, sanat 1225, khamsah wa-ʻishrīn wa-miʼatayn wa-alf, ʻalá yad kātibihā, bi-yadihi al-fāniyah, al-ʻabd al-faqīr al-muʻtarif bi-al-ʻajz wa-al-taqṣīr, al-rājī ʻafwa Rabbihi al-ʻAlī al-Bārī, ʻAlī ibn Muḥammad ibn Aḥmad al-Farghalī al-Anṣārī nasaban al-Khazrajī qabīlatan al-Shāfiʻī madhhaban al-Ṭahṭāʼī baladan al-Azʹharī iqāmatan, ghafara Allāh la-hu wa-li-wālidayhi wa-li-mashāyikhihi wa-li-muḥbbīhi wa-li-man naẓara fīhi wa-daʻā la-hu bi-al-maghfirah wa-al-raḥmah, wa-li-man wajada ʻayban wa-aṣlaḥahu. Wa-ṣallá Allāh ʻalá Sayyidinā Muḥammad wa-sallam.""",w,12,7,2,2,0,1,0,0,martin
14526450,880-02 Ḥāshiyah ʻalá Sharḥ al-Sullam : manuscript / Muḥammad ibn ʻAlī al-Ṣabbān.,12,"Translation of the copyist's colophon: ""It was copied also on Wednesday, in the afternoon, 19 days having passed from the month of Rabīʻ al-Thānī, after the birthday of our Master al-Imām al-Ḥusayn, in the year 1225 [of the Hijrah = 24 May, 1810], by the perishing hand of its copyist, the poor servant, who admits his inability and his insufficiency, he who hopes for the forgiveness of his Mighty Lord the Creator, ʻAlī ibn Muḥammad ibn Aḥmad al-Farghalī al-Anṣārī nasaban al-Khazrajī qabīlatan al-Shāfiʻī madhhaban al-Ṭahṭāʼī baladan al-Azʹharī iqāmatan, may God forgive him, his parents, his teachers, his loved ones, him who looks into it and invokes God to forgive him and have mercy upon him, and him who finds a blemish in it and corrects it. May God prey on our Master Muḥammad and grant him peace.""",w,12,7,2,2,0,1,0,0,martin
14526463,880-02 Sharḥ al-Sullam : manuscript / ʻAbd al-Raḥmān ibn Muḥammad al-Akhḍarī.,3,"Incipit: ""Bismillāh al-Raḥmān al-Raḥīm, wa-bi-hi nastaʻīn. Allāhumma lā sahl illā mā jaʻaltahu sahlan. al-Ḥamdu lillāh alladhī jaʻala qulūb al-ʻulamāʼ samāwāt tatajallá fīhā shumūs al-maʻārif, wa-wassaʻa dawāyir afhāmihim fa-awlajahum qibāb al-mukhaddarāt min ʻarāyis al-maʻānī wa-al-laṭāyif, wa-ḥabāhum bi-ḥadāyiq al-ʻuqūl fa-tanāwalū min thamarātihā, fa-aṣbaḥt āfāq ʻuqūlihim mushriqah bi-aqmār al-ʻulūm, fa-fāqū man ʻadāhum min al-wará, wa-istaqwaw ʻalá dhurá al-majd wa-ʻalaw ʻalá manābir al-ʻizz bimā sabaqa lahum fī al-Kitāb al-marqūm, fa-tāhū fī riḥāb al-ʻilm wa-ʻaraṣāt al-fahm ʻalá bisāṭ ḥujaj al-maʻqūl ...""",w,12,7,2,0,2,1,0,0,martin
14526463,880-02 Sharḥ al-Sullam : manuscript / ʻAbd al-Raḥmān ibn Muḥammad al-Akhḍarī.,4,Secundo folio: ṭalaban li-taḥqīq al-manqūl.,w,12,7,2,0,2,1,0,0,martin
14526463,880-02 Sharḥ al-Sullam : manuscript / ʻAbd al-Raḥmān ibn Muḥammad al-Akhḍarī.,8,"On folio 1a: ""Sharḥ al-Sullam lil-Akhḍarī. Sharḥ al-Sullam lil-Akhḍarī, raḥimahu Allāh taʻālá raḥmatan wāsiʻah. Āmīn.""",w,12,7,2,0,2,1,0,0,martin
14526463,880-02 Sharḥ al-Sullam : manuscript / ʻAbd al-Raḥmān ibn Muḥammad al-Akhḍarī.,9,"On folio 2a: ""Wa-baʻd, fa-lammā waḍaʻtu al-urjūzah al-musammāh bi-'al-Sullam al-murawnaq fī ʻilm al-manṭiq', wa-jāt [wa-jāʼat], bi-ḥamd Allāh, jumlatan [jumaluhu] kāfiyah, wa-li-maqāṣid <fī fann ʻilm> fannihā ḥāwiyah, rāwadanī baʻḍ al-ikhwān min al-ṭalabah, akramahum Allāh, al-marrah baʻda al-marrah, ʻalá an aḍaʻa ʻalyahā sharḥan mufīdan yabuththu mā inṭawat ʻalayhi min al-maʻānī, wa-yashīdu mā taqāṣara fīhā min al-mabānī, fa-ajabtuhu li-dhālika ṭalaban [ṭāliban] min Allāh ḥusn al-tawfīq ilá manābiʻ al-taḥqīq, wa-in kuntu lastu ahlan li-dhālik, wa-lākin ḥamalanī ʻalayhi tafāwulī. Wa-lam aḍaʻhu li-man huwa aʻlá minnī, bal li-amthālī min al-mubtadʼīn. Fa-Allāh Allāh, yā akhī al-iʻtidhār wa-tark al-iʻtirāḍ ʻalá al-muʼminīn, wa-iltamis al-ʻudhr li-akhīka al-muʼmin, wa-sāl [wa-sal] Allāh ilayhi fī al-duʻāʼ wa-li-wālidayya bi-al-maghfirah wa-al-raḥmah, raḥimaka Allāh taʻālá. Wa-Allāh walī al-tawfīq ...""",w,12,7,2,0,2,1,0,0,martin
14526463,880-02 Sharḥ al-Sullam : manuscript / ʻAbd al-Raḥmān ibn Muḥammad al-Akhḍarī.,10,"On folio 2b: The text of 'al-Sullam al-murawnaq fī ʻilm al-manṭiq' starts with: ""al-Ḥamdu lillāh alladhī qad akhraja // natāʼij al-fikr li-arbāb al-ḥijā ...""",w,12,7,2,0,2,1,0,0,martin
14526463,880-02 Sharḥ al-Sullam : manuscript / ʻAbd al-Raḥmān ibn Muḥammad al-Akhḍarī.,11,"Colophon: ""Tammat bi-ḥamd Allāh wa-ʻawnihi wa-ḥusn tawfīqih. Wa-kāna al-farāgh minhā [min] kitābat hādhā al-sharḥ al-ʻaẓīm yawm al-Ithnayn, khams ʻashar Shaʻbān al-mubārak, alladhī huwa min shuhūr sanat tisʻah wa-ʻishrīn wa-miʼatayn baʻda al-alf, ʻalá yad afqar al-ʻibād wa-aḥwajihā [wa-aḥwajihim] ilá Rabbihi al-Jawwād, Ibrāhīm Ḥasan Amīn al-Dīn, ʻafá Allāh ʻanhu, wa-ghafara la-hu wa-li-man daʻā la-hu bi-al-maghfirah. Āmīn.""",w,12,7,2,0,2,1,0,0,martin
14526463,880-02 Sharḥ al-Sullam : manuscript / ʻAbd al-Raḥmān ibn Muḥammad al-Akhḍarī.,12,"Translation of the colophon: ""It is completed by the praise of God, His help and His abundant benevolence. This great commentary was concluded on Monday, the fifteenth of blessed Shaʻbān, of the year 1229 [of the Hijrah = 2 August, 1814], by the hand of the poorest of mankind and the neediest to his Benevolent Lord, Ibrāhīm Ḥasan Amīn al-Dīn, may God pardon him and forgive him who offers and invocation for his forgiveness. Amen.""",w,12,7,2,0,2,1,0,0,martin
14526482,880-03 al-Rāmizah fī ʻilmay al-ʻarūḍ wa-al-qāfiyah : manuscript / ʻAbd Allāh ibn ʻUthmān al-Khazrajī.,4,"Incipit of al-Rāmizah fī ʻilmay al-ʻarūḍ wa-al-qāfīyah: ""Bismillāh al-Raḥmān al-Raḥīm. Wa-lil-shiʻr mīzānun yusammá ʻarūḍahu // bi-hā al-naqṣ wa-al-rujḥān yadrīhimā al-fatá. Wa-anwāʻuhu qul khamsataʻshara kulluhā // tuʼallafu min juzʼayni farʻayni lā siwá ...""",w,27,20,1,3,0,2,0,1,martin
14526482,880-03 al-Rāmizah fī ʻilmay al-ʻarūḍ wa-al-qāfiyah : manuscript / ʻAbd Allāh ibn ʻUthmān al-Khazrajī.,5,Secundo folio of the al-Rāmizah fī ʻilmay al-ʻarūḍ wa-al-qafīyah: Wa-qul watidun in zidta ḥarfan bilā imtirā.,w,27,20,1,3,0,2,0,1,martin
14526482,880-03 al-Rāmizah fī ʻilmay al-ʻarūḍ wa-al-qāfiyah : manuscript / ʻAbd Allāh ibn ʻUthmān al-Khazrajī.,6,"Incipit of Fatḥ Rabb al-Barīyah bi-sharḥ al-Qaṣīdah al-Khazrajīyah: ""Bismillāh al-Raḥmān al-Raḥīm. al-Ḥamdu lillāh alladhī waḍaʻa ʻilm al-ʻarūḍ li-yuʻrafa bi-hi awzān al-manẓūm, wa-jaʻala afkāranā qāfiyah li-āthār al-ʻulamāʼ bi-al-manṭūq wa-al-mafhūm, wa-al-ṣalāh wa-al-salām ʻalá Sayyid al-Mursalīn wa-ʻalá ālihi wa-aṣḥābihi ajmaʻīn. Wa-baʻd, fa-hādhā sharḥ ʻalá al-Khazrajīyah al-manẓūmah ʻalá baḥr al-ṭawīl fī ʻilm al-ʻarūḍ wa-al-qawāfī, naẓm al-ʻallāmah Ḍiyāʼ al-Dīn Abī Muḥammad ʻAbd Allāh ibn Muḥammad al-Khazrajī al-Mālikī al-Andalusī, yaḥullu alfāẓahā wa-yubayyinu murādahā wa-yaftaḥu rumūzahā, wa-sammaytuhu bi-Fatḥ Rabb al-Barīyah bi-sharḥ al-Qaṣīdah al-Khazrajīyah. Wa-Allāh asʼalu an yanfaʻa bi-hi wa-yajʻalahu khāliṣan li-wajhihi ...""",w,27,20,1,3,0,2,0,1,martin
14526482,880-03 al-Rāmizah fī ʻilmay al-ʻarūḍ wa-al-qāfiyah : manuscript / ʻAbd Allāh ibn ʻUthmān al-Khazrajī.,7,"Secundo folio of ""Fatḥ Rabb al-Barīyah bi-sharḥ al-Qaṣīdah al-Khazrajīyah: ālah yuʻrafu bi-hā miqdār.",w,27,20,1,3,0,2,0,1,martin
14526482,880-03 al-Rāmizah fī ʻilmay al-ʻarūḍ wa-al-qāfiyah : manuscript / ʻAbd Allāh ibn ʻUthmān al-Khazrajī.,8,"Incipit of Treatise on the new meters in Arabic poetry (folio 79a): ""Fāʼidah. Baḥr al-mutadārak istakhrajahu al-Akhfash min baḥr al-mutaqārib, wa-ikhtalafa fīhi ʻan al-Khalīl; fa-qāla al-akthar: 'Naṣṣa ʻalá ṭarḥihi wa-laysa ʻindahu shiʻran [shiʻrun].' Wa-qāla qawm: 'Lam yamnaʻhu wa-lam yuthbithu, immā li-annahu lam yablughhu, wa-tadārakahu al-Akhfash, wa-li-hādhā summiya al-mutadārak' ...""",w,27,20,1,3,0,2,0,1,martin
14526482,880-03 al-Rāmizah fī ʻilmay al-ʻarūḍ wa-al-qāfiyah : manuscript / ʻAbd Allāh ibn ʻUthmān al-Khazrajī.,9,Secundo folio of Treatise on the new meters in Arabic poetry: wa-qīla dakhalahu al-qaṭʻ wa-jarat al-ʻillah fīhi majrá al-zuḥāf.,w,27,20,1,3,0,2,0,1,martin
14526482,880-03 al-Rāmizah fī ʻilmay al-ʻarūḍ wa-al-qāfiyah : manuscript / ʻAbd Allāh ibn ʻUthmān al-Khazrajī.,10,"Incipit of Treatise on the sixteen classical meters of Arabic poetry including phrases quoted from the Qurʼān (folio 81a): ""Wa-hādhihi abyāt tajmaʻu ʻarūḍ al-abḥur al-sittata ʻashar, bi-istishhād bi-āyāt min al-Qurʼān al-Karīm lil-Bīr, raḥimahu Allāh wa-raḍiya ʻanhu: Ṭawīl. Ṭawīlun madá al-hijrān man kuntu ahwāhu // adhāba fuʼādī wa-al-taṣabburu afnāhu. Faʻūlun mafāʻīlun faʻūlun mafāʻilun // wa-lā taqtulu al-nafsa allatī ḥarrama Allāhu ...""",w,27,20,1,3,0,2,0,1,martin
14526482,880-03 al-Rāmizah fī ʻilmay al-ʻarūḍ wa-al-qāfiyah : manuscript / ʻAbd Allāh ibn ʻUthmān al-Khazrajī.,11,Secundo folio of Treatise on the sixteen classical meters of Arabic poetry including phrases quoted from the Qurʼān: Mustafʻilun fāʻilun mustafʻilun faʻilun.,w,27,20,1,3,0,2,0,1,martin
14526482,880-03 al-Rāmizah fī ʻilmay al-ʻarūḍ wa-al-qāfiyah : manuscript / ʻAbd Allāh ibn ʻUthmān al-Khazrajī.,15,"On folio 1a: ""al-Qaṣīdah al-Khazrajīyah fī al-qawānīn al-ʻarūḍīyah, taʼlīf al-Shaykh Ḍiyāʼ al-Dīn Muḥammad ibn Muḥammad al-Andalusī al-Khazrajī, raḥimahu Allāh. Āmīn. Āmīn.""",w,27,20,1,3,0,2,0,1,martin
14526482,880-03 al-Rāmizah fī ʻilmay al-ʻarūḍ wa-al-qāfiyah : manuscript / ʻAbd Allāh ibn ʻUthmān al-Khazrajī.,16,"On folio 1a: Four verses on poetry naming the fifteen classical meters of Arabic poetry, and a note stating that the sixteenth meter ""al-Mutadārak"" was mentioned by al-Akhfash (al-Akhfash al-Awsaṭ, Saʻīd ibn Masʻadah, died approximately 830).",w,27,20,1,3,0,2,0,1,martin
14526482,880-03 al-Rāmizah fī ʻilmay al-ʻarūḍ wa-al-qāfiyah : manuscript / ʻAbd Allāh ibn ʻUthmān al-Khazrajī.,18,"On folio 28a: A collation and correction note: ""Balagha muqābalatan wa-qirāʼatan wa-taṣḥīḥan min Mawlānā wa-Sayyidinā al-Shaykh al-fāḍil wa-al-baḥr al-zākhir, ḥāwī al-kamālāt wa-al-faḍāʼil, al-Shaykh Yaḥyá al-Faraḍī al-Shāfiʻī, ḥafiẓahu Allāh [Probably: Yaḥyá ibn Taqī al-Dīn al-Faraḍī, active 1619]. Katabahu al-faqīr Muḥammad Shaʻʻāl.""",w,27,20,1,3,0,2,0,1,martin
14526482,880-03 al-Rāmizah fī ʻilmay al-ʻarūḍ wa-al-qāfiyah : manuscript / ʻAbd Allāh ibn ʻUthmān al-Khazrajī.,19,"al-Rāmizah fī ʻilmay al-ʻarūḍ wa-al-qāfiyah ends with: ""... Wa-qad kamult sittan wa-tisʻīna fa-alladhī // tawassaʻa fī dhā al-ʻilmi tūsiʻuhu ḥubbā. Wa-yasʼalu ʻAbdu Allāhi dhā al-Khazrajīyu min // muṭāliʻihā itḥāfahu minhu bi-al-duʻā.""",w,27,20,1,3,0,2,0,1,martin
14526482,880-03 al-Rāmizah fī ʻilmay al-ʻarūḍ wa-al-qāfiyah : manuscript / ʻAbd Allāh ibn ʻUthmān al-Khazrajī.,20,Half of folio 84 is torn up. On folio 84b are written some verses of poetry in Maghribi script.,w,27,20,1,3,0,2,0,1,martin
14526482,880-03 al-Rāmizah fī ʻilmay al-ʻarūḍ wa-al-qāfiyah : manuscript / ʻAbd Allāh ibn ʻUthmān al-Khazrajī.,21,"Colophon of al-Rāmizah fī ʻilmay al-ʻarūḍ wa-al-qāfiyah: ""Tammat. Katabahā Muḥammad al-Ḥurr, ʻufiya ʻanhu.""",w,27,20,1,3,0,2,0,1,martin
14526482,880-03 al-Rāmizah fī ʻilmay al-ʻarūḍ wa-al-qāfiyah : manuscript / ʻAbd Allāh ibn ʻUthmān al-Khazrajī.,22,"Translation of the colophon of al-Rāmizah fī ʻilmay al-ʻarūḍ wa-al-qāfiyah: ""It is completed. Copied by Muḥammad al-Ḥurr, may he be pardoned.""",w,27,20,1,3,0,2,0,1,martin
14526482,880-03 al-Rāmizah fī ʻilmay al-ʻarūḍ wa-al-qāfiyah : manuscript / ʻAbd Allāh ibn ʻUthmān al-Khazrajī.,23,"Colophon of Fatḥ Rabb al-Barīyah bi-sharḥ al-Qaṣīdah al-Khazrajīyah (folio 79a): ""Tamma Fatḥ Rabb al-Barīyah bi-sharḥ al-Qaṣīdah al-Khazrajīyah fī salkh shahr Ramaḍān, yawm al-Thalāth, min sanat ithnayn wa-sabʻīn wa-tisʻimiʼah bi-al-Mashhad al-Aqdas, ʻalá musharrifihi al-ṣalāh wa-al-salām, ʻalá yad al-ʻabd al-faqīr Muḥammad ibn Muḥammad al-Ḥurr, ʻafá Allāh taʻālá ʻanhu. Āmīn.""",w,27,20,1,3,0,2,0,1,martin
14526482,880-03 al-Rāmizah fī ʻilmay al-ʻarūḍ wa-al-qāfiyah : manuscript / ʻAbd Allāh ibn ʻUthmān al-Khazrajī.,24,"Translation of the colophon of Fatḥ Rabb al-Barīyah bi-sharḥ al-Qaṣīdah al-Khazrajīyah: ""Fatḥ Rabb al-Barīyah bi-sharḥ al-Qaṣīdah al-Khazrajīyah was completed at the end of the month of Ramaḍān, on Tuesday, of the year 972 [of the Hijrah = 11 May, 1565], at al-Mashhad al-Aqdas, may prayer and peace be upon him who dignified it by his presence [Probably the eight Shiʻī Imām, ʻAlī al-Riḍā ibn Mūsá, died 818 or 819], by the hand of the poor servant Muḥammad ibn Muḥammad al-Ḥurr, may God pardon him. Amen.""",w,27,20,1,3,0,2,0,1,martin
14526482,880-03 al-Rāmizah fī ʻilmay al-ʻarūḍ wa-al-qāfiyah : manuscript / ʻAbd Allāh ibn ʻUthmān al-Khazrajī.,25,"Colophon of Treatise on the new meters in Arabic poetry. No colophon. Text ends with: ""... wa-hādhihi al-abḥr al-thalāthah takhruju min dāʼirat al-mutashābih. Wa-Allāh aʻlam bi-al-ṣawāb.""",w,27,20,1,3,0,2,0,1,martin
14526482,880-03 al-Rāmizah fī ʻilmay al-ʻarūḍ wa-al-qāfiyah : manuscript / ʻAbd Allāh ibn ʻUthmān al-Khazrajī.,26,"Colophon of Treatise on the sixteen classical meters of Arabic poetry including phrases quoted from the Qurʼān: ""Tammat.""",w,27,20,1,3,0,2,0,1,martin
14526482,880-03 al-Rāmizah fī ʻilmay al-ʻarūḍ wa-al-qāfiyah : manuscript / ʻAbd Allāh ibn ʻUthmān al-Khazrajī.,27,"Translation of the colophon of Treatise on the sixteen classical meters of Arabic poetry including phrases quoted from the Qurʼān: ""It is completed.""",w,27,20,1,3,0,2,0,1,martin
14526483,880-03 Dīwān : manuscript / Abū Tammām Ḥabīb ibn Aws al-Ṭāʼī.,3,"Incipit: ""Bismillāh al-Raḥmān al-Raḥīm. Hādhā 'Dīwān' nādirat al-falak wa-wāsiṭat ʻiqd al-dahr fī ṣināʻat al-shiʻr, naẓm al-Imām al-humām al-ḥādhiq al-fahhām, al-ʻālim al-ʻallām, al-Shaykh Abī Tammām Ḥabīb ibn Aws al-Ṭāʼī. Ḥarf al-Hamzah. Qāla yamdaḥu Khālid ibn Yazīd al-Shaybānī, wa-hādhā ʻalá al-tartīb alladhī rattabahu Abū Bakr al-Ṣūlī, wa-jaʻalahu thamāniyat aṣnāf: Yā mawḍiʻa al-Shadanīyati al-wajnāʼi // wa-muṣāriʻa al-īlāj wa-al-isrāʼi. Addi al-salāma muʻarrifan wa-muḥaṣṣiban // min Khālidi al-maʻrūfi wa-al-hayjāʼi ...""",w,9,4,2,2,0,1,0,0,martin
14526483,880-03 Dīwān : manuscript / Abū Tammām Ḥabīb ibn Aws al-Ṭāʼī.,4,Secundo folio: Wa-taʻarrafat ʻirfān zākhiratin wa-lam.,w,9,4,2,2,0,1,0,0,martin
14526483,880-03 Dīwān : manuscript / Abū Tammām Ḥabīb ibn Aws al-Ṭāʼī.,8,"Colophon: ""Bi-yad kātibihi ʻAbd al-Aḥad Karjī. Fī 12 T 1 [Tishrīn al-Awwal], sanat 1856.""",w,9,4,2,2,0,1,0,0,martin
14526483,880-03 Dīwān : manuscript / Abū Tammām Ḥabīb ibn Aws al-Ṭāʼī.,9,"Translation of the colophon: ""By the hand of its copyist ʻAbd al-Aḥad Karjī. On 12 Tishrīn al-Awwal [October], 1856.""",w,9,4,2,2,0,1,0,0,martin
3668927,[Lectures on surgery].,4,"The lectures (39 in number, with Introduction and Index) were delivered to students in London during 1829. They concern surgery and kindred subject matter.",w,4,1,3,0,0,0,0,0,tim
3668983,"Partielle Differentialgleichungen; Anwendungen der Abel'schen Functionen; Infinitesimalgeometrie; Bestimmte Integration / [vorgetragen von Prof. Christoffel], 1885-1886.",1,Lecture notes taken by Lehmann during four mathematics classes taught by Professor Christoffel at Strassburg during the 1885-1886 school session.,w,1,1,0,0,0,0,0,0,tim
3669062,"Robert Duer's receipt book, 10th of July, 1812 : book 10.",1,"Likely Duer's pharmacy/materia medica class notes, as he graduated from the University of Pennsylvania in 1814.",w,3,1,2,0,0,0,0,0,tim
3669791,Ḥāshiyat Tahdhīb Jānqarī. -- [17--?].,1,Mach gives title as: Ḥāshiyah ʻalá Ḥāshiyat Mīr Abī al-Fatḥ.,w,3,1,2,0,0,0,0,0,tim
3669929,Kifāyat al-ghulām fī iʻrāb al-kalām. -- [15--?].,1,Also known as: al-Alfīyah.,w,3,1,2,0,0,0,0,0,tim
3670378,Excerpta ex diariis : mélanges de médecine et de chirurgie.,1,Entries are dated 1838-1843 and include an index on the final 23 pages.,w,3,1,1,0,0,1,0,0,tim
3670397,[Manuscrits d'un chirurgien russe ou tchèque].,2,"Manuscript of a Russian or Czech surgeon on various subjects, with some entries dated from 1833 to 1842.",w,2,1,1,0,0,0,0,0,tim
3670439,"Physiology : lectures on the physical conditions of the tissues of the human body as applied to the explanation of vital phenomena : delivered at the College of France, 1834 / by F. Magendie, Professor of Physiology and Medicine, 1834.",1,"Notes taken down by Robert Sewell, with the 7 p. at end titled ""Index.""",w,2,1,1,0,0,0,0,0,tim
3670491,Sharḥ al-ʻArūḍ al-Andalusī. -- 1728.,1,Variant title in manuscript: Sharḥ mushkilāt al-mukhtaṣar fī ʻilm al-ʻarūḍ.,w,4,2,2,0,0,0,0,0,tim
3670491,Sharḥ al-ʻArūḍ al-Andalusī. -- 1728.,3,"Followed by 3 pages (25 verso-26), untitled and ending abruptly, unrelated to primary text.",w,4,2,2,0,0,0,0,0,tim
3670518,"Receipes for takeing of cemicals, 1850.",3,Recipes for mixing chemicals.,w,5,1,3,1,0,0,0,0,tim
3670544,"Note-book of experiments and observations on anatomy and physiology / George Gulliver, January 1839.",4,Includes much of his original research on the blood.,w,4,1,1,0,0,1,1,0,tim
3670618,al-Durr al-manẓūm. -- 1731 or 2.,1,Variant title in manuscript: Naẓm farāʾiḍ Multaqá al-abḥur.,w,3,1,2,0,0,0,0,0,tim
3670642,[Kitāb fī al-farāʾiḍ]. -- 1828 or 9.,2,Followed by an untitled 2-page treatise on same subject; ends abruptly.,w,4,2,2,0,0,0,0,0,tim
3670642,[Kitāb fī al-farāʾiḍ]. -- 1828 or 9.,3,Last 3 leaves comprised of notes.,w,4,2,2,0,0,0,0,0,tim
3670725,al-ʻArūḍ al-Andalusī. -- [17--].,2,A few pages of notes precede and follow main text.,w,3,1,2,0,0,0,0,0,tim
3670835,"Excelsior diary : Columbian edition, 1893 / [signed in ink on title page: Geo. W. Vansint].",1,"Diary includes a blank page for each date, printed almanac and calendar, and pages for accounts.",w,3,1,0,0,1,1,0,0,tim
3670836,"Account book, 1862-1870.",1,"Includes patient information concerning the doctor's practice in New Haven, Conn.",w,1,1,0,0,0,0,0,0,tim
2334838,"Economic impact of ski recreation and second homes : a reconnaissance study of Stowe, Vermont / by Lloyd C. Irland and Richard C. Gannon ; with Margaret Coon...[et al.]. 1974.",2,"Final report of a cooperative aid study by the Yale School of Forestry and Environmental Studies and the Northeastern Forest Experiment Station, USDA Forest Service, under Contract no. 23-00, 440, Supplement 15.",w,2,1,1,0,0,0,0,0,will
2898314,"David Bushnell Exhibiton, May-June 1975, Sterling Memorial Library [by Andrew Patterson, Jr.]",2,"Contains copies of legends used in the display cases, record cards of items exhibited, and a list of these items, and a bibliography.",w,2,1,1,0,0,0,0,0,will
2919886,The dialects of ancient Gaul. [Microform],1,"Abstracted in Microfilm abstracts, v. 10 (1950) no. 1, p. 141-142, no. 2, p. 175-176, no. 3, p. 265-266; v. 11 (1951) no. 1, p. 207-208, no. 3, p. 297-298.",w,1,1,0,0,0,0,0,0,will
3100789,"Mary Burrell's book / by Mary Burrell, 1854.",1,"Mary Burrell's train traveled near the Isaac Foster party also from Plainfield and parts of her diary are quoted in Lucy Foster Sexton's The Foster Family, California Pioneers, Santa Barbara, 1925.",w,2,1,1,0,0,0,0,0,will
3105379,"Overland journey : from Leesburg, Pennsylvania, to the California mines / by Alexander Love, 1849-1852.",1,The diary is composed of four notebooks and various sizes of letter paper sewed together in a homemade calf binding.,w,2,1,1,0,0,0,0,0,will
3106835,"William Renfro Rothwell papers, 1850.",1,"Rothwell's trip home from California is documented in his journal. See Memoranda of Home Voyage from the California Gold Mines to the State of Missouri, Beinecke Rare Book and Manuscript Library, WA MSS S-1432",w,1,1,0,0,0,0,0,0,will
3117860,"Overland journey from Ohio to California / by Edwin Hillyer, [1849].",2,"The State Historical Society of Wisconsin owns another version of the diary which was published in Wisconsin Magazine of History. 49, no. 3 (Spring 1966).",w,2,1,1,0,0,0,0,0,will
3118703,"Fur trading voyage : from China to the Northwest Coast of America, 1799 / by Richard Jeffry Cleveland.",1,"Another account of Cleveland's voyage which closely follows this version was published by Cleveland's son from his father's original journal: Cleveland, H. W. S. Voyages of a Merchant Navigator. New York, 1886.",w,1,1,0,0,0,0,0,0,will
3153403,"Journal of a trip to the Yellowstone Park, 1875.",1,"The official report of the Ludlow expedition was published as: United States War Dept. Report of a Reconnaissance from Carroll...Made in the Summer of 1875, by William Ludlow. Washington, D.C.: Government Printing Office, 1876.",w,1,1,0,0,0,0,0,0,will
3154475,"Army episodes and anecdotes; or Life at Vancouver Barracks. The romance and the reality of the frontier /by Thomas McArthur Anderson, 1853-1893.",1,"Chapter 11 which is included in the list of chapters but is not in the manuscript, was probably used by Anderson for his article ""The Vancouver Reservation Case. A Legal Romance,"" Oregon Historical Quarterly. VIII (1907): 219-230.",w,1,1,0,0,0,0,0,0,will
