bib_id,title,note_num,note,type
3382834,"Records of the Woman's Home Missionary Union, 1895-1926, n.d. (inclusive)",1,"Reports from the states of Vermont, Colorado, Maine, Connecticut, Minnesota, New York, California, New Jersey, Nebraska, Missouri, Louisiana, Oregon, and New Hampshire.",w
3384041,"Records of the American Christian Missionary Society, 1918-1919, (inclusive)",1,This corporate body later became known as the United Christian Missionary Society.,a
3384049,"Records of the Congregational Home Missionary Society, 1894-1928, n.d., (inclusive)",1,This corporate body was previously known as the American Home Missionary Society.,a
3384059,"Records of the Congregational Church Extension Boards, 1925-1928, n.d. (inclusive)",1,"This corporate body is a joint venture of the Congregational Home Missionary, Church Building and Sunday School Extension Societies.",w
3385261,"Records of the Church of England in Canada. Diocese of Algoma, 1926-1929, (inclusive)",1,This corporate body later became identified with the Anglican Church of Canada.,a
3385465,"Records of the American Friends Service Committee Work Camp Committee, 1938-1944,(inclusive)",1,This collection consists primarily of reports from the work camps.,w
3386030,"Records of the Farmers Federation Educational and Development Fund Inc., n.d.",1,Project supported by this organization known as The Lord's Acre Plan.,w
3387284,"Records of the Methodist Episcopal Church, South, Woman's Missionary Society, 1924-1925, (inclusive)",1,"As a result of a denominational merger, the Methodist Episcopal Church, South later is known as the Methodist Church (U.S.)",a
3387284,"Records of the Methodist Episcopal Church, South, Woman's Missionary Society, 1924-1925, (inclusive)",2,"Based in Nashville, Tennessee.",a
3389145,"Records of the Congregational Church Building Society, n.d.",1,"This corporate body, based in New York City, later become incorporated into United Church Board of Home Missions.",a
3389228,"Records of the Chicago City Missionary Society of the Congregational Churches, 1882-1913, n.d. (inclusive)",1,"This corporate body is later known as the Community Renewal Society (Chicago, Ill.)",a
3390456,"Records of the Office of the Indian Rights Association, 1905.",1,"See also material in Record Group 34, Indian Rights Association.",w
3390592,"Records of the Ladies' Greek Committee of the City of New-York, 1829.",1,This corporate body oversees missionary efforts in Greece.,w
3390865,"Records of St. John's Guild, Inc., 1930.",1,"See also material in Record Group 34, St. John's Guild.",w
3390881,"Records of the Indian University, 1886-1887 (inclusive)",1,This college later became known as Bacone Indian University.,a
3391387,"Records of the New York City Mission Society, 1866-1950, n.d. (inclusive)",1,This corporate body was earlier known as the New York Mission and Tract Society.,a
3391536,"Records of the American Sunday-School Union, 1831-1897, (inclusive)",1,"See also Manuscript Group No. 34. For later material, see Records of the American Missionary Fellowship, HR 971.",w
3392442,"Records of the American Missionary Fellowship, 1980.",1,"For earlier material, see Records of the American Sunday School Union, HR 964. See also Manuscript Group No. 34.",w
3395232,"Records of the Wyclif Society, 1882-1888, n.d.",1,"See also material in Record Group 34, The Wyclif Society.",w
3428698,Della architettura militare : manuscript.,1,Catalog record based on a description of the manuscript by Morgan Ng. See citation herewith.,a
3429277,Trattato di architectura civile e militare.,1,"""Aside from his additions to the ducal palaces at Urbino and Gubbio, it is [Francesco's] work as military architect for which he is renowned. The defenses that he designed for the duchy of Montefeltro are among the first attempts to build fortifications capable of withstanding cannon shot while being defended by flanking fire, in the manner that would ultimately lead to the fully realized angle bastions of the sixteenth century. Francesco deals substantially with fortification in the penultimate book of his Trattato. Like Vitruvius, he saw the art as an integral component of classical building tradition. Francesco's drawings show many forms of fortification, but few of these are fully effective or efficient. ... Francesco's writings were never published in his lifetime. The Trattato remained in manuscript form, surviving in several different versions, which date to essentially two different periods of his career. This copy was based on a later composition, completed sometime after 1482. While the drawings are at least partly in Francesco's hand, the text was written by copyists sometime around 1520.""--Compass and rule : architecture as mathematical practice in early modern England, 1550-1750.",o
3429277,Trattato di architectura civile e militare.,2,"The present manuscript is a copy of the second version of the treatise. It is not listed in Gustina Scaglia, Francesco di Giorgio: Checklist and History of Manuscripts and Drawings in Autographs and Copies from ca. 1470 to 1687 and Renewed Copies (1764-1839) (London and Toronto: Associated University Presses, 1992). Of the manuscripts published in Francesco di Giorgio Martini, Trattati di architettura, ingegneria e arte militare, ed. Corrado Maltese (Milan: Il Polifilo, 1967), it is most closely related to the version in Florence, Biblioteca Nazionale Centrale di Firenze, ex-Magliabecchianus II.I.141. There are still many variations within the text. The version of the text in Magliabecchinus II.I.141 was probably completed about 1492; see Richard J. Betts, “On the Chronology of Francesco di Giorgio's Treatises: New Evidence from an Unpublished Manuscript”, Journal of the Society of Architectural Historians 36:1 (1977), p.13.",o
3429277,Trattato di architectura civile e militare.,3,"Written in Italy in the 16th century. On f. 89v is a note with the year 1521, giving a terminus ad quem for the manuscript.",o
3429277,Trattato di architectura civile e militare.,4,"Thick paper. There are two watermarks in the volume. The first is an anchor similar to Briquet 470 (Casalmaggiore, 1526), occurring in quires I-III and V. The second is an anchor and star similar to Briquet 478 (Bergamo, 1502), occurring in quires III-IV and VI-X.",o
3429277,Trattato di architectura civile e militare.,5,Written in a single column with approximately 39-40 lines per full page. 408 x 285 mm (304 x 167 mm).,o
3429277,Trattato di architectura civile e militare.,6,"Collation: iii (paper, contemporary with binding) + I-V¹⁰, VI⁸, VII¹⁰, VIII⁸, IX¹⁰, X⁹ (construction unclear) + iii (paper, contemporary with binding).",o
3429277,Trattato di architectura civile e militare.,7,"Written and corrected in an italic script by several hands using inks ranging from dark to reddish brown. The scribes leave blank spaces for decorated initials, which have not been added. There are marginal notes in contemporary hands.",o
3429277,Trattato di architectura civile e militare.,8,"Bound in 18th century mottled calf with gilt borders. Marbled endpapers with a ""French Curl"" pattern. The front pastedown is slightly damaged, presumably from the removal of an earlier bookplate.",o
3441027,"Diary of a journey from Illinois to Colorado / by James A. Eddy, 1886.",1,"The lower half of the first page of the journal has been torn off. Within the text, there is evidence that three pages were removed, but the narrative does not seem to be affected.",o
3441891,The Foster family : California pioneers of 1849 / compiled by Roxana C. Foster.,1,"According to a note on the flyleaf, this copy was made from the original in the library of the Society of California Pioneers.",o
3442628,"Letters, 1849-1850.",1,"Accompaning the letters is an 1955 letter from the William Henry Smith Memorial Library of the Indiana Historical Society, thanking Frank Laucomer, of Detroit, Michigan, for allowing the library to record his ownership of the Woodward letters.",o
3443611,"Journal of a voyage from Boston to California, 1849-1850 /by Samuel Brackett.",1,"In the back of the volume are notes on the Boston and California Pioneer, including some poems which Brackett wrote for the newspaper. There are also journal entries for November 29 through December 5th which are similar to entries for those date in the beginning of the volume.",ow
3443611,"Journal of a voyage from Boston to California, 1849-1850 /by Samuel Brackett.",2,"Accompanied by a photocopy of the Boston Herald (first edition) in 1849 announcing the Brig Colorado ""clearing"" Boston Habor.",o
3443611,"Journal of a voyage from Boston to California, 1849-1850 /by Samuel Brackett.",3,For another account of this voyage see Solomon True's Journal of a Voyage from Boston to California (WA MSS S-1436).,w
3444973,Diary of William H. Chamberlin : written while crossing the plains in '49 / by William H. Chamberlin.,1,Tipped into the back of the diary is a late 19th cenutry map of the United States.,o
3447761,History and journal of Jesse W. Crosby.,1,"Most of the text seems to be written after the fact, but the travel accounts are often in the form of a diary.",w
3454880,"Journal of a voyage from Boston to San Francisco in the ship Golden Rocket commanded by Capt. Charles Pendleton, begins December 9th 1859 and terminated May 18th 1860, / kept by Maria R. Hodgdon.",1,"The printed title page is filled out by Charles A. Hodgdon for a 1854 voyage from Boston, but he made no entries. Maria Hodgdon wrote her own title page based on the printed one.",o
3454880,"Journal of a voyage from Boston to San Francisco in the ship Golden Rocket commanded by Capt. Charles Pendleton, begins December 9th 1859 and terminated May 18th 1860, / kept by Maria R. Hodgdon.",2,Most of the pages have stains from seaweed pressed between the pages. The stains obscure the text.,o
3454880,"Journal of a voyage from Boston to San Francisco in the ship Golden Rocket commanded by Capt. Charles Pendleton, begins December 9th 1859 and terminated May 18th 1860, / kept by Maria R. Hodgdon.",3,The Seamen's Journal was sold in Boston by Benj. Loring & Company.,w
3455325,"Notes by the way, 1949 / by David Jordan.",1,"Bound with the diary are photostats of a photograph of David Jordan and a letter from Joseph V. Lanston, one of Jordan's companions.",o
3455642,"Autobiography of James Abram Kleiser / compiled by George William Kleiser, 1932.",1,Compiled by George William Kleiser in 1932 from the original manuscript in his possession. Original text written in 1886.,o
3457296,"Diary of a voyage from New York to California, 1852 /by F. C. Powell.",1,Printed diary: Clayton's Octavo Diary for 1852. New York: E. B. Clayton & Sons.,o
3457975,"Memoranda of home voyage from the California gold mines to the state of Missouri, 1851 /by William R. Rothwell.",1,"Rothwell's trip to California is documented in his diary, letters, and guidebook. See William Renfrom Rothwell Papers, Beinecke Rare Book and Manuscript Library, WA MSS 409.",w
3469850,[Sharḥ al-Muqaddimah al-Jazarīyah]. -- [16-- or 17--].,1,"Islamic binding, paper-covered, with flap.",o
3469850,[Sharḥ al-Muqaddimah al-Jazarīyah]. -- [16-- or 17--].,2,Some marginalia. Laid-in: several leaves which do not seem to belong to the text.,o
3469862,Khazāʾin al-jawāhir wa-makhāzin al-zawāhir / Abū al-Saʻīd Muḥammad ibn. -- 1841 or 2.,1,"Islamic binding, paper-covered, with flap.",o
3469862,Khazāʾin al-jawāhir wa-makhāzin al-zawāhir / Abū al-Saʻīd Muḥammad ibn. -- 1841 or 2.,2,Marginalia.,o
3469862,Khazāʾin al-jawāhir wa-makhāzin al-zawāhir / Abū al-Saʻīd Muḥammad ibn. -- 1841 or 2.,3,With: 6 other titles.,o
3469868,[Sharḥ al-Risālah fī ajzāʾ al-qaḍīyah]. -- 1839 or 40.,1,"Islamic binding, paper-covered, with flap.",o
3469868,[Sharḥ al-Risālah fī ajzāʾ al-qaḍīyah]. -- 1839 or 40.,2,With: 6 other titles.,o
3469888,[Sharḥ Sūrat Hūd]. -- [ca. 1839].,1,"Islamic binding, paper-covered, with flap.",o
3469888,[Sharḥ Sūrat Hūd]. -- [ca. 1839].,2,Some marginalia.,o
3469888,[Sharḥ Sūrat Hūd]. -- [ca. 1839].,3,With: 6 other titles.,o
3471058,Shaykh Ḥaqqī fī Kitāb al-mirʾāt. -- [ca. 1839].,1,"Islamic binding, paper-covered, with flap.",o
3471058,Shaykh Ḥaqqī fī Kitāb al-mirʾāt. -- [ca. 1839].,2,With: 6 other titles.,o
3471075,Risālah jāmiʻah bi-ikhtilāf bayna Abī Manṣūr al-Māturīdī wa-Abī al-Ḥasan al-Ashʻarī. -- [ca. 1839].,1,Leaf 47 recto copied upside down.,o
3471075,Risālah jāmiʻah bi-ikhtilāf bayna Abī Manṣūr al-Māturīdī wa-Abī al-Ḥasan al-Ashʻarī. -- [ca. 1839].,2,"Islamic binding, paper-covered, with flap.",o
3471075,Risālah jāmiʻah bi-ikhtilāf bayna Abī Manṣūr al-Māturīdī wa-Abī al-Ḥasan al-Ashʻarī. -- [ca. 1839].,3,With: 6 other titles.,o
3471102,[Sharḥ al-Muqaddimah al-Jazarīyah] / ʻAlī ibn Sulṭān Muḥammad al-Qārī. -- 1841.,1,"Islamic binding, paper-covered, with flap.",o
3471102,[Sharḥ al-Muqaddimah al-Jazarīyah] / ʻAlī ibn Sulṭān Muḥammad al-Qārī. -- 1841.,2,With: 6 other titles.,o
3471116,Muqaddimat al-Ghaznawī. -- [16-- or 17--].,1,Vocalized text.,o
3471116,Muqaddimat al-Ghaznawī. -- [16-- or 17--].,2,"Islamic binding, paper-covered, with flap.",o
3471116,Muqaddimat al-Ghaznawī. -- [16-- or 17--].,3,Some marginalia.,o
3471128,[Sharḥ al-Muqaddimah al-Jazarīyah]. -- [18--].,1,Some marginalia.,o
3471227,Rūḥ al-shurūḥ. -- 1605.,1,Illustrations and diagrams.,o
3471227,Rūḥ al-shurūḥ. -- 1605.,2,"Islamic binding, paper-covered, with flap.",o
3471227,Rūḥ al-shurūḥ. -- 1605.,3,Marginalia.,o
3471245,[Sharḥ al-ʻAqāʾid al-Nasafīyah]. -- [15--?].,1,"The text appears to be written in two different hands (leaves 1-39, 41-91).",o
3471245,[Sharḥ al-ʻAqāʾid al-Nasafīyah]. -- [15--?].,2,"Islamic binding, in brown, flap missing.",o
3471245,[Sharḥ al-ʻAqāʾid al-Nasafīyah]. -- [15--?].,3,Preceded by repetition of leaf 1 verso; marginalia in various hands.,o
3471245,[Sharḥ al-ʻAqāʾid al-Nasafīyah]. -- [15--?].,4,With: 2 other titles.,o
3471261,al-Masʻūdī. -- [14-- or 15--].,1,Also known as: Sharḥ al-Samarqandīyah fī ādāb al-baḥth.,w
3471261,al-Masʻūdī. -- [14-- or 15--].,2,First half has extensive interlinear and marginal notations.,o
3471267,Kitāb baḥr al-kalām. -- [15--?].,1,"Islamic binding, in brown, with flap.",o
3471279,Muqaddimat al-Ghaznawī. -- [15--?].,1,The first few leaves have interlinear notations and some marginalia.,o
3471308,Nūr al-īḍāḥ wa-najāt al-arwāḥ. -- [17--].,1,Some marginalia.,o
3471320,Mirʾāt al-ṭālibīn. -- [17--?].,1,"Islamic binding, in brown, with flap.",o
3471331,Muʻaddil al-ṣalāh. -- 1717.,1,With: 4 other titles.,o
3471346,al-Iʻrāb ʻan qawāʻid al-iʻrāb. -- [between 1500 and 1799].,1,With one other work.,o
3471359,Talkhīṣ al-Miftāḥ. -- 1550.,1,"Islamic binding, in brown, with flap.",o
3471372,Ḥall muʻāqid al-Qawāʻid. -- 1558 or 9.,1,With: 1 other title.,o
3471392,Zubdat al-ʻirfān fī wujūh al-Qurʾān. -- 1811.,1,Written on cover in an older hand: Qirāʾat mutawātharah (?) li-al-aʾimmah al-ʻasharah.,o
3471402,Sharḥ al-Risālah fī ādāb al-baḥth. -- [17-- or 18--].,1,Marginalia.,o
3471402,Sharḥ al-Risālah fī ādāb al-baḥth. -- [17-- or 18--].,2,With: 3 other titles.,o
3471414,Risālah fī ādāb al-baḥth. -- [17-- or 18--].,1,With: 3 other titles.,o
3471419,Taqrīr al-qawānīn al-mutadāwalah min ʻilm al-munāẓarah. -- 1705.,1,Extensive marginalia in the begininng of the work.,o
3471419,Taqrīr al-qawānīn al-mutadāwalah min ʻilm al-munāẓarah. -- 1705.,2,With: 3 other titles.,o
3471431,[al-Tanṣīṣ al-muntaẓar fī sharḥ abyāt al-Talkhīṣ wa-al-Mukhtaṣar] / Abū al-ʻIṣmāh Muṣṭafá ʻIṣām al-Dīn. -- 1805.,1,"Islamic binding, paper-covered, with flap.",o
3471437,Masāʾil munyat al-muṣallī. -- [17--?].,1,"Islamic binding, paper-covered, with flap.",o
3471437,Masāʾil munyat al-muṣallī. -- [17--?].,2,With: 1 other title.,o
3473490,Duʻāʾ mubārak. -- [1758 or 9?].,1,"Islamic binding, paper-covered, with flap.",o
3473490,Duʻāʾ mubārak. -- [1758 or 9?].,2,With: 1 other title.,o
3473498,Fatāwá al-Anqirawī. -- 1765.,1,"Islamic binding, in black, with flap.",o
3473514,ʻAynī ʻalá Kanz al-daqāʾiq. -- [16--].,1,Title from fly-leaf.,o
3473514,ʻAynī ʻalá Kanz al-daqāʾiq. -- [16--].,2,Brockelmann gives title as: Ramz al-ḥaqāʾiq.,a
3473514,ʻAynī ʻalá Kanz al-daqāʾiq. -- [16--].,3,Marginalia.,o
3473525,Ḥāshiyat al-Mutawassiṭ. -- [15--].,1,"Islamic binding, in brown, flap missing.",o
3473525,Ḥāshiyat al-Mutawassiṭ. -- [15--].,2,With: 1 other title.,o
3473626,al-Sharḥ al-mutawassiṭ. -- 1534.,1,Title on lower fore-edge: Wāfiyah ʻalá al-Kāfiyah.,o
3473626,al-Sharḥ al-mutawassiṭ. -- 1534.,2,"Islamic binding, in brown, flap missing.",o
3473626,al-Sharḥ al-mutawassiṭ. -- 1534.,3,Extensive marginalia.,o
3473626,al-Sharḥ al-mutawassiṭ. -- 1534.,4,With: 1 other title.,o
3473633,Anwār al-tanzīl wa-asrār al-taʼwīl. -- 1706.,1,"Islamic binding, in brown, with flap.",o
3473641,al-Sharḥ al-kabīr ʻalá al-Jāmiʻ al-ṣaghīr : al-juzʾ al-thānī / ʻAbd al-Raʾūf al-Munāwī. -- [16--].,1,Brockelmann gives title as: Fayḍ al-qadīr.,a
3473641,al-Sharḥ al-kabīr ʻalá al-Jāmiʻ al-ṣaghīr : al-juzʾ al-thānī / ʻAbd al-Raʾūf al-Munāwī. -- [16--].,2,"Islamic binding, in brown, flap missing and back cover burned.",o
3473647,Kitāb maṭāliʻ al-masarrāt bi-jalāʾ Dalāʾil al-khayrāt. -- [16-- or 17--].,1,Crude ʻunwān.,o
3473647,Kitāb maṭāliʻ al-masarrāt bi-jalāʾ Dalāʾil al-khayrāt. -- [16-- or 17--].,2,"Islamic binding, in red, with flap.",o
3473652,[al-Sharḥ] al-muṭawwal. -- 1804 or 5.,1,"Islamic binding, covered in green fabric, with flap.",o
3473652,[al-Sharḥ] al-muṭawwal. -- 1804 or 5.,2,Profuse marginal and interlinear notes throughout.,o
3473668,[Risālah fī ʻilm al-bāṭin]. -- 1777.,1,"Islamic binding, covered in blue fabric, with flap.",o
3473668,[Risālah fī ʻilm al-bāṭin]. -- 1777.,2,Considerable marginalia.,o
3473668,[Risālah fī ʻilm al-bāṭin]. -- 1777.,3,With: 2 other titles.,o
3473676,Ḥāshiyah ʻalá Sharḥ al-Maybudī. -- [16--?].,1,Diagrams.,o
3473676,Ḥāshiyah ʻalá Sharḥ al-Maybudī. -- [16--?].,2,Marginalia on first few leaves.,o
3473676,Ḥāshiyah ʻalá Sharḥ al-Maybudī. -- [16--?].,3,With: 1 other title.,o
3473688,Anwār al-tanzīl wa-asrār al-taʼwīl : al-jild al-awwal. -- [16-- or 17--].,1,"Islamic binding, in brown, with flap.",o
3473694,Munjid al-muqriʾīn wa-murshid al-ṭālibīn. -- [16-- or 17--].,1,"Islamic binding, covered in red fabric, with flap.",o
3473694,Munjid al-muqriʾīn wa-murshid al-ṭālibīn. -- [16-- or 17--].,2,With: 4 other titles.,o
3473718,al-Manḥ al-azhar. -- [17--?].,1,Also known as: Sharḥ [al-]fiqh al-akbar.,w
3473718,al-Manḥ al-azhar. -- [17--?].,2,"Islamic binding, in brown, with flap.",o
3473718,al-Manḥ al-azhar. -- [17--?].,3,Considerable marginalia.,o
3473718,al-Manḥ al-azhar. -- [17--?].,4,Text preceded and followed by several leaves with notations of various kinds.,o
3473718,al-Manḥ al-azhar. -- [17--?].,5,Laid in: several leaves with notations.,o
3473724,al-ʻArūḍ al-Andalusī. -- [17--].,1,Diagrams.,o
3473724,al-ʻArūḍ al-Andalusī. -- [17--].,2,With: 1 other title.,o
3473734,Masʾalah fī bayān ḥiyal al-tafrīq bayna al-ṣafīr wa-al-ṣafīrah. -- 1718 or 19.,1,2 leaves of notes (ff. 32-33) follow text.,o
3473734,Masʾalah fī bayān ḥiyal al-tafrīq bayna al-ṣafīr wa-al-ṣafīrah. -- 1718 or 19.,2,With: 4 other titles.,o
3473785,"Journal of Henry Souther begun October 30 1849 /transcribed by someone else, ca. 1900.",1,There is a full list of the passengers and crew for the 1849-50 voyage of the ship Richmond from Boston to San Francisco on p. 12-15.,w
3474541,"Journal of a voyage from Boston to California, 1849-1850 / by Solomon True, Jr.",1,The journal is annotated in pencil in what seems to be a much later hand. There are several pages of text following the diary which date from the 1860s.,o
3474541,"Journal of a voyage from Boston to California, 1849-1850 / by Solomon True, Jr.",2,For another account of this voyage see Samuel Brackett's Journal of a Voyage from Boston to California (WA MSS S-1417).,w
3474810,Sharḥ al-Risālah al-Ḥusaynīyah. -- [ca. 1705].,1,Identified in manuscript as: al-Ḥāshiyah al-Fardīyah lil-Risālah al-Ḥusaynīyah by ʻAlī al-Fardī ibn Muṣṭafá al-Qayṣarī.,a
3474810,Sharḥ al-Risālah al-Ḥusaynīyah. -- [ca. 1705].,2,With: 3 other titles.,o
3474815,[Rawḍāt al-jannāt fī uṣūl al-iʻtiqādāt]. -- 1717.,1,Attributed in the manuscript to Birgivı̂ Mehmet Efendi.,a
3474815,[Rawḍāt al-jannāt fī uṣūl al-iʻtiqādāt]. -- 1717.,2,Extensive marginalia.,o
3474815,[Rawḍāt al-jannāt fī uṣūl al-iʻtiqādāt]. -- 1717.,3,With: 4 other titles.,o
3474824,Sharḥ al-Qaṣīdah al-munfarijah. -- 1718 or 19.,1,Considerable marginalia.,o
3474824,Sharḥ al-Qaṣīdah al-munfarijah. -- 1718 or 19.,2,With: 4 other titles.,o
3474832,Sharḥ al-ʻArūḍ al-Andalusī. -- 1847.,1,With: 1 other title.,o
3474917,al-Jawāhir al-mukallalah li-man rāma al-ṭuruq al-mukammalah.,1,Title also in manuscript in later hand: al-Jawāhir al-mukallalah fī al-qirāʾāt al-ʻasharah.,o
3474923,Tuḥfat al-mulūk. -- [16--?].,1,Sometimes attributed to Muḥammad ibn Tāj al-Dīn Ibrāhīm al-Tūqātī.,a
3474923,Tuḥfat al-mulūk. -- [16--?].,2,"Islamic binding, paper-covered, with flap.",o
3474923,Tuḥfat al-mulūk. -- [16--?].,3,Interlinear and marginal notations.,o
3474923,Tuḥfat al-mulūk. -- [16--?].,4,With: 1 other title.,o
3474923,Tuḥfat al-mulūk. -- [16--?].,5,No. 1 of 2 items bound together.,o
3474929,[Azhār anẓarī]. -- [16--?].,1,"Islamic binding, paper-covered, with flap.",o
3474929,[Azhār anẓarī]. -- [16--?].,2,With: 1 other title.,o
3474929,[Azhār anẓarī]. -- [16--?].,3,No. 2 of 2 items bound together.,o
3474946,Ḥāshiyat Qarah Khalīl ʻalá Ṭāshkubrīʹzādah min al-Ādāb / Khalīl ibn Ḥasan al-Sīrawī. -- 1886.,1,Also known as: Hadīyat al-Nabī al-mustaṭāb fī ʻilm al-naẓar wa-al-ādāb.,w
3474946,Ḥāshiyat Qarah Khalīl ʻalá Ṭāshkubrīʹzādah min al-Ādāb / Khalīl ibn Ḥasan al-Sīrawī. -- 1886.,2,"Islamic binding, in burgundy, with flap.",o
3474946,Ḥāshiyat Qarah Khalīl ʻalá Ṭāshkubrīʹzādah min al-Ādāb / Khalīl ibn Ḥasan al-Sīrawī. -- 1886.,3,With: 3 other titles.,o
3474946,Ḥāshiyat Qarah Khalīl ʻalá Ṭāshkubrīʹzādah min al-Ādāb / Khalīl ibn Ḥasan al-Sīrawī. -- 1886.,4,No. 1 of 2 items bound together.,o
3474956,Risālah fī ʻilm ādāb al-baḥth. -- [18--].,1,With: 3 other titles.,o
3474956,Risālah fī ʻilm ādāb al-baḥth. -- [18--].,2,No. 1 of 2 items bound together.,o
3477133,Sharḥ duʻaʾ asmāʾ al-ḥusnā. -- [ca. 1687].,1,"Islamic binding, in black, with flap.",o
3477133,Sharḥ duʻaʾ asmāʾ al-ḥusnā. -- [ca. 1687].,2,With: 2 other titles.,o
3477133,Sharḥ duʻaʾ asmāʾ al-ḥusnā. -- [ca. 1687].,3,No. 2 of 3 items bound together.,o
3477135,Faʾl name-yi Qurʾān ʻaẓīm. -- [17--?].,1,With: 4 other titles.,o
3477144,Tajwīd al-ṣaḥīḥ fī al-lisān al-faṣīh. -- 1708-10.,1,"Islamic binding, covered in red fabric, with flap.",o
3477144,Tajwīd al-ṣaḥīḥ fī al-lisān al-faṣīh. -- 1708-10.,2,With: 4 other titles.,o
3477161,Kitāb qawaʻid-i Qurʾān. -- 1693.,1,Also known as: Şerḥ el-Muḳaddime el-Cazariye fi el-tecvid.,w
3477161,Kitāb qawaʻid-i Qurʾān. -- 1693.,2,"Islamic binding, covered in red fabric, with flap.",o
3477161,Kitāb qawaʻid-i Qurʾān. -- 1693.,3,Marginalia.,o
3477161,Kitāb qawaʻid-i Qurʾān. -- 1693.,4,With: 4 other titles.,o
3477178,Sharḥ Taʻlīm al-mutaʻallim. -- 1662.,1,Small Turkish nastaʻlīq.,o
3477178,Sharḥ Taʻlīm al-mutaʻallim. -- 1662.,2,"Islamic binding, in brown, with flap.",o
3477183,al-Budūr al-zāhirah fī al-qirāʾāt al-ʻashrah al-mutawātirah / taʾlīf ... Sirāj al-Dīn ʻUmar ibn Qāsim ibn Muḥammad ibn ʻAlī al-Anṣārī al-Muqarrī al-shahīr bi-al-Nashshār. -- 1721 or 2.,1,Multicolored ʻunwān.,o
3477192,[ʻArāʾis al-majālis fī qiṣaṣ al-anbiyāʾ] / Abū Isḥāq Aḥmad ibn Muḥammad ibn Ibrāhīm al-Thaʻlabī. -- [16--?].,1,"Title from: Brockelmann, I, 350.",a
3477192,[ʻArāʾis al-majālis fī qiṣaṣ al-anbiyāʾ] / Abū Isḥāq Aḥmad ibn Muḥammad ibn Ibrāhīm al-Thaʻlabī. -- [16--?].,2,Also known as: Nafāʾis al-ʻarāʾis.,w
3477192,[ʻArāʾis al-majālis fī qiṣaṣ al-anbiyāʾ] / Abū Isḥāq Aḥmad ibn Muḥammad ibn Ibrāhīm al-Thaʻlabī. -- [16--?].,3,"Large elegant naskhī, except for leaf 1 and 14 leaves at the end which are in a more recent and smaller hand.",o
3477206,Kitāb al-taysīr fī al-tafsīr : mujallad. -- 1336 or 7.,1,Medium naskhī.,o
3477216,Kitāb al-mūjiz fī uṣūl al-qirāʾāt al-sabʻ ʻalá ṭarīq al-Shāṭibīyah wa-al-taysīr. -- [1400-1599].,1,With: 1 other title.,o
3484527,al-Jāmiʻ al-ṣaḥīḥ : al-juzʾ al-awwal / lil-imām Abī ʻAbd Allāh Muḥammad ibn Ismāʻīl ibn Ibrāhīm al-Bukharī. -- 1445.,1,Medium vocalized naskhī.,o
