bib_id,title,note_num,note,type
1975084,Inventaire sommaire des manuscrits et imprimés chinois de la Bibliothèque vaticane (13 juin-6 juillet 1922) [microform] / par Paul Pelliot.,1,Typescript.,o
1975084,Inventaire sommaire des manuscrits et imprimés chinois de la Bibliothèque vaticane (13 juin-6 juillet 1922) [microform] / par Paul Pelliot.,2,"Microfilm of original in Biblioteca apostolica vaticana, Sala cons. mss. 210.",o
2334838,"Economic impact of ski recreation and second homes : a reconnaissance study of Stowe, Vermont / by Lloyd C. Irland and Richard C. Gannon ; with Margaret Coon...[et al.]. 1974.",1,Typescript (xerox copy).,o
2334838,"Economic impact of ski recreation and second homes : a reconnaissance study of Stowe, Vermont / by Lloyd C. Irland and Richard C. Gannon ; with Margaret Coon...[et al.]. 1974.",2,"Final report of a cooperative aid study by the Yale School of Forestry and Environmental Studies and the Northeastern Forest Experiment Station, USDA Forest Service, under Contract no. 23-00, 440, Supplement 15.",w
2781465,Table manuscrite du Journal de Trévoux : laquelle s'etend depuis l'année 1701 jusqu'à l'année 1762 / par Mr. Godescard.,1,"Spine title: Memoires de Trévoux: [Table], 1701-1762.",a
2824586,"Calendar of the Montreal Gazette, 1778-1841 [microform] / compiled by A.R.M. Lower.",1,Typescript.,o
2824586,"Calendar of the Montreal Gazette, 1778-1841 [microform] / compiled by A.R.M. Lower.",2,Original in Public Archives of Canada.,o
2872298,Wästgotha lagben.,1,Cover title: Vastgótálaghbok.,a
2872298,Wästgotha lagben.,2,"Photographic copy of MS. B 59 in Kungliga biblioteket, Stockholm.",o
2898314,"David Bushnell Exhibiton, May-June 1975, Sterling Memorial Library [by Andrew Patterson, Jr.]",1,Typescript.,o
2898314,"David Bushnell Exhibiton, May-June 1975, Sterling Memorial Library [by Andrew Patterson, Jr.]",2,"Contains copies of legends used in the display cases, record cards of items exhibited, and a list of these items, and a bibliography.",w
2913820,Beiträge zur lateinischen Paläographie. Von W. Wattenbach.,1,Manuscript.,o
2913820,Beiträge zur lateinischen Paläographie. Von W. Wattenbach.,2,"Tables, notes, part manuscript, inserted.",o
2919886,The dialects of ancient Gaul. [Microform],1,"Abstracted in Microfilm abstracts, v. 10 (1950) no. 1, p. 141-142, no. 2, p. 175-176, no. 3, p. 265-266; v. 11 (1951) no. 1, p. 207-208, no. 3, p. 297-298.",w
3099168,"Overland journey from St. Joseph to California : and life in the mines / by Alonzo Delano, 1849-1851.",1,"Accompanied by 16 clippings from newspapers, New Orleans True Delta, Ottawa Free Trader, Constitutionalist, and San Francisco Pacific News, containing correspondence from Delano about California.",o
3100106,"A trip across the plains in 1858 / by Richard Thomas Ackley, 1848-[1865]",1,"Journal probably written in 1865, with annotations in a later hand.",o
3100231,"Overland journey : from Ohio to California and return by the Isthmus of Panama / by Hiram Alton, 1864-1865.",1,Original binding.,o
3100292,"Overland journey : from Indiana to California / by D. B. Andrews, 1852.",1,Original binding.,o
3100688,"Overland journey : from Burlington, Vermont to Sacramento, California / by Gurdon Backus, 1849-1851.",1,Original binding.,o
3100734,"Overland journey from Warren, Pennsylvania to California /by  Philip Badman, 1849-1857.",1,Original binding.,o
3100752,"A daily journal kept by N. J. and H. Bradley on an overland trip to California /by Nancy Jane and  Henry Bradley, 1852.",1,Original binding.,o
3100789,"Mary Burrell's book / by Mary Burrell, 1854.",1,"Mary Burrell's train traveled near the Isaac Foster party also from Plainfield and parts of her diary are quoted in Lucy Foster Sexton's The Foster Family, California Pioneers, Santa Barbara, 1925.",w
3100789,"Mary Burrell's book / by Mary Burrell, 1854.",2,Original binding.,o
3100799,"Journal on board ship Audely [sic] Clark /by Zechariah Chafee, 1849.",1,Original binding covered with heavy cotton cloth.,o
3100822,"Overland journey : from Missouri to California / by Bennett C. Clark, 1849.",1,Original binding.,o
3100881,"The California guide. With distances & notes of travel by Clark  & Co. in fifty two from Ohio to the Sacramento Valley /by John Clark, 1852-1856.",1,Original binding.,o
3101026,"Overland journey : from Ash Hollow, Nebraska to Sierra County, California / by Noah D. Comstock, [1853-1854].",1,Original binding.,o
3101137,"Overland journey : from Kansas to California / by Thomas J. B. Cramer, 1859.",1,Original boards.,o
3101241,"Cummings diary /by Charles J. Cummings, 1859.",1,Original binding.,o
3101241,"Cummings diary /by Charles J. Cummings, 1859.",2,"On the flyleaf, in a different hand dated April 26, 1859, is written: ""This chronicle records the first trip in 6 years (since 1853) over the Applegate cut-off, or 'Death route.'""",ow
3101322,"Cattle drive : from Texas to California, and in California and Oregon / by Richard Dallam, 1852-1864.",1,Bound by Dallam in undressed sheepskin.,o
3101650,"Journal of life in Vermont : travels in the midwest and   Illinois, and a trip across the Plains and life in Oregon / by Samuel Dexter Francis, 1841-1862.",1,"Notarized attestation of the author's daughter, Dora Francis Frazer, April 1936, is bound with the manuscript.",o
3101831,Voyage from New York to Oregon Territory : of Governor John P. Gaines and his family and notes on their life there / by Archibald Kinkead Gaines.,1,Original binding.,o
3101885,"Journal of the route of the Charlestown Va. Ming. Co. : from St. Josephs, Mo. to California / by Vincent Eply Geiger and Wakeman Bryarly, 1849.",1,Original binding.,o
3102154,"Overland journey on horseback from Walla Walla, Washington       Territory, to San Francisco /by William H. Gorrill, 1869.",1,Original binding.,o
3102498,"Overland journey of the Knickerbocker Exploring Company of the City of New York : from Fort Smith to California / by William R. Goulding, 1849-1865.",1,"Accompanied by a printed broadside of the Knickerbocker Exploring Company's Constitution and list of members, and two clippings from the Fort Smith Hearald.",o
3102522,"Granville Company Diary, /by the Granville Company, 1849.",1,Original binding.,o
3102646,"Journal. Jos. P. Hamelin jr. of Lexington, Missouri / by Joseph   P. Hamelin, Jr., 1849-1857.",1,Original boards.,o
3102704,The narrative of Samuel Hancock: being a description of his overland journey to Oregon in 1845: typed manuscript.,1,"Note by C. B. Bagley states ""This is one [of] two copies--all that have been made, as I believe.""",a
3102863,"Journal of Francis A. Hardy / by Francis A. Hardy, 1850.",1,Original bindings.,o
3102919,"Overland journey : from Wisconsin to Oregon Territory / by Charles W. Hayden, 1852-1853.",1,Original binding.,o
3104912,"Overland journey : of the Rev. Neill Johnson and his family from Mt. Pleasant, Iowa to Oregon / by John Lawrence Johnson, [1851].",1,Original binding.,o
3104967,"William Kahler's diary / by William Kahler, 1852.",1,Original binding.,o
3104993,"Overland letters, 1852.",1,Letters and typed transcript stored in 2 folders.,o
3105077,"Overland journey : from Independence, Missouri to Weaverville, California / by Abram Krill, 1850-1851.",1,Accompanied by a daguerreotype of Krill & Bamber's grocery and provision store near Hangtown.,o
3105077,"Overland journey : from Independence, Missouri to Weaverville, California / by Abram Krill, 1850-1851.",2,Original binding.,o
3105077,"Overland journey : from Independence, Missouri to Weaverville, California / by Abram Krill, 1850-1851.",3,Two diaries and daguerreotype stored in a case.,o
3105112,"Moses F. Laird's book. A journal of a few items of my life: different situations; travels, etc. /by Moses F. Laird, 1852-1855.",1,Journal and typed transcript stored in a case.,o
3105253,"Overland journey : from St. Joseph to California / by John F. Lewis, 1849-1854.",1,"Journal, typed transcript, and carbon typed transcript stored in 2 boxes.",o
3105379,"Overland journey : from Leesburg, Pennsylvania, to the California mines / by Alexander Love, 1849-1852.",1,The diary is composed of four notebooks and various sizes of letter paper sewed together in a homemade calf binding.,w
3105379,"Overland journey : from Leesburg, Pennsylvania, to the California mines / by Alexander Love, 1849-1852.",2,Diary and typed transcript stored in a case.,o
3105392,"Von St. Paul, Minn. nach Portland, Oregon / by Henry Lueg, 1867-1868.",1,Original binding.,o
3105392,"Von St. Paul, Minn. nach Portland, Oregon / by Henry Lueg, 1867-1868.",2,Journal and typed translation stored in a case.,o
3106031,"Journal and correspondence, 1849-1876.",1,Original binding.,o
3106272,"Overland journey from Darien, Walworth County, Wisconsin, to Hangtown, California / by Silas Newcomb, 1850-1895.",1,"Accompanied by a printed broadside of the resolutions of the Beloit Company with Newcomb's name and those of other members of Capt. Clark's mess added. This was reproduced by D. C. McMurtrie in ""Two Early Issues of the Council Bluffs Press,"" Annuals of Iowa. 3d ser. 18(1931):82-86.",o
3106272,"Overland journey from Darien, Walworth County, Wisconsin, to Hangtown, California / by Silas Newcomb, 1850-1895.",2,Original binding.,o
3106374,"Memoranda of O. N. Newman / by Orson N. Newman, 1869.",1,Original binding.,o
3106408,"Overland journey : from Lake Maria, Marquette County, Wisconsin, to California, and life in the mines / by Andrew M. Orvis, 1849-1858.",1,Accompanied by a 1850 letter by Orvis to his wife Caroline from Sacramento.,o
3106408,"Overland journey : from Lake Maria, Marquette County, Wisconsin, to California, and life in the mines / by Andrew M. Orvis, 1849-1858.",2,Original binding.,o
3106583,"Incidents of traveling from Coldwater to Pike's Peak /by George L. Pope, 1859.",1,"Accompanied by a photostat of a page from the Nebraska News, Nebraska City, March 12, 1859, which contains an account of the arrival at that town of Pope's Michigan company.",o
3106583,"Incidents of traveling from Coldwater to Pike's Peak /by George L. Pope, 1859.",2,Original binding.,o
3106588,"The overland route : leaves from the journal of a California emigrant / by Mary L. Rockwood Powers, 1859.",1,"Manuscript copy signed at end: ""Written by A. Field Richmond, 1859.""",o
3106595,"Overland journey from Fort Leavenworth to Los Angeles /by Orville C. Pratt, 1848-1849.",1,Original binding.,o
3106807,"Overland journey : from Morristown, Henry County, Illinois, to California / by M. C. Purviance, 1863.",1,Original binding.,o
3106835,"William Renfro Rothwell papers, 1850.",1,"Rothwell's trip home from California is documented in his journal. See Memoranda of Home Voyage from the California Gold Mines to the State of Missouri, Beinecke Rare Book and Manuscript Library, WA MSS S-1432",w
3107009,"Private journal of L. M. Schaeffer-- who does not write out in   extenso as he would wish for he fears he might fill his book before his journey is accomplished, and because he cannot write as correctly and intelligibly as   he would on land / by Luther Melanchthon Schaeffer, 1849-1852.",1,"Accompanied by L. M. Schaeffer, Sketches of Travels in South America, Mexico and California. New York: James Egbert, printer, 1860.",o
3107097,"Journal of a voyage &c. on board Barque Susan from New York to San Francisco : around (about as bad as going around the world) Cape Horn via Rio de Janeiro and (one of the greater ports on the Pacific) Talcahuano, or Conception / by William Valentine Seaman, 1849.",1,Original binding.,o
3107277,"R. H. P. Snodgrass's journal of the trip : from Piqua, Ohio, to Sacramento across the Plains in 1852 with an appendix containing prices current and news of various subjects / by R. H. P. Snodgrass, 1852-1854.",1,Original binding.,o
3107301,"Voyage to California and return by Panama / by Levi B. Stuart, 1849-1851.",1,Original binding.,o
3107609,"Letters : to his wife / by Joseph Summers, 1850 Oct. 30.",1,"The letters are written in a notebook with glazed paper covers: Miners' and Travellers' Pocket Letter Book. Designed Expressly for the Convenience of Miners and Travellers to the Mines. By Jos. W. Gregory. New York, San Francisco, 1850.",o
3107609,"Letters : to his wife / by Joseph Summers, 1850 Oct. 30.",2,Letters and transcript stored in a case.,o
3107942,"W. P. Thompson : diary, 1850-1852.",1,Original binding.,o
3107942,"W. P. Thompson : diary, 1850-1852.",2,Diary and transcript are stored in one case.,o
3108906,"Overland journey : from Mount Pleasant, Iowa to California, experiences at the mines, and the voyage home by the Isthmus / by P. C. Tiffany, 1849-1851.",1,Original binding.,o
3108906,"Overland journey : from Mount Pleasant, Iowa to California, experiences at the mines, and the voyage home by the Isthmus / by P. C. Tiffany, 1849-1851.",2,3 volumes and transcript are stored in 1 case.,o
3108918,"Overland journey to California in 1849 : experiences at the mines 1849-1850, and return voyage to New York in 1850 / by L. N. Weed, 1859.",1,The narrative written in 1857 from journal entries but transferred into the present volume in 1859.,o
3108918,"Overland journey to California in 1849 : experiences at the mines 1849-1850, and return voyage to New York in 1850 / by L. N. Weed, 1859.",2,Original binding.,o
3108918,"Overland journey to California in 1849 : experiences at the mines 1849-1850, and return voyage to New York in 1850 / by L. N. Weed, 1859.",3,"Accompanied by Kim Kastens, ""Route of J. N. Weed--1849,"" May 1973, which includes a large map showing the route.",o
3108918,"Overland journey to California in 1849 : experiences at the mines 1849-1850, and return voyage to New York in 1850 / by L. N. Weed, 1859.",4,"Journal, transcript, and Kastens paper in 2 boxes; map in rolled storage.",o
3109149,"Overland journey : from Rochester, Wisconsin, to Georgetown, California, and a brief stay in the mines / by Abial Whitman, 1850.",1,Original bindings.,o
3109166,"Diary of Edward J. Willis. Giving account of travel from Independence Missouri to California in 1849, Across the Plains, /by Edward   J. Willis, 1849.",1,Original binding.,o
3109166,"Diary of Edward J. Willis. Giving account of travel from Independence Missouri to California in 1849, Across the Plains, /by Edward   J. Willis, 1849.",2,Diary and transcript in case.,o
3109343,"California letters, 1853-1882.",1,Accompanied by typed calendar.,o
3116023,"Overland journey : to Oregon and a return trip, 1845-1847.",1,The diary is in pencil and is partly illegible.,o
3117274,"Overland journey : from Illinois to California / by William T. Stackpole, 1849-1850.",1,Accompanied by a typed calendar.,o
3117860,"Overland journey from Ohio to California / by Edwin Hillyer, [1849].",1,"Accompanied by copy of the journal, made by Hillyer's father, Daniel Hillyer, dated 1850 Jan 8.",o
3117860,"Overland journey from Ohio to California / by Edwin Hillyer, [1849].",2,"The State Historical Society of Wisconsin owns another version of the diary which was published in Wisconsin Magazine of History. 49, no. 3 (Spring 1966).",w
3117990,"Overland journey : from Massachusetts to California / by Philip W. Adams, [1883-1884].",1,"Accompanied by a 40 page, more extensive account.",o
3118703,"Fur trading voyage : from China to the Northwest Coast of America, 1799 / by Richard Jeffry Cleveland.",1,"Another account of Cleveland's voyage which closely follows this version was published by Cleveland's son from his father's original journal: Cleveland, H. W. S. Voyages of a Merchant Navigator. New York, 1886.",w
3120692,"Journal of a voyage from Boston to the North-West Coast of America /by Samuel Furgerson, 1809-1811.",1,Original binding.,o
3120856,"The narrative of a voyage : to the North West Coast of America and China on trade and discoveries, 1922.",1,The original manuscript is in the Massachusetts Historical Society library. This copy was made in 1922 from a transcript in the University of Washington Library.,o
3121328,Voyage of the brigantine Hope from Boston to the northwest coast of America /by Joseph Ingraham.,1,The original manuscript journal is in the Library of Congress.,o
3121328,Voyage of the brigantine Hope from Boston to the northwest coast of America /by Joseph Ingraham.,2,Photostat and typescript stored in 2 boxes.,o
3121801,"Whaling expedition : from New Bedford to China / by James F. Munger, 1850-1852.",1,Original binding.,o
3121801,"Whaling expedition : from New Bedford to China / by James F. Munger, 1850-1852.",2,"Accompanied by a published version: Two Years in the Pacific and Arctic Oceans and China. Vernon: J. R. Howlett, 1852.",o
3121801,"Whaling expedition : from New Bedford to China / by James F. Munger, 1850-1852.",3,Manuscript and published version stored in a case.,o
3121932,A vocabulary of the language of the natives of the North west coast of America and other titles.,1,Manuscript and typescript stored in a case.,o
3121956,"Voyage from Boston : to the north west coast of America, 1800-1820 / by Ralph Haskins.",1,Accompanied by printed biography of Ralph Haskins.,o
3123655,"History of Tualatin Plains /by J. S. Griffin, 1842-1851.",1,Original boards.,o
3124199,"Yakima War diary, 1855-1856.",1,Original binding.,o
3132365,"Accounts, 1845-1874.",1,Original bindings.,o
3132365,"Accounts, 1845-1874.",2,"Accompanied by a four page introduction by Winlock W. Miller, Jr., August 4, 1926.",o
3133835,"Journal of a voyage : from Gravesend to Hudson's-Bay North America and Inland journey to the Red-River Colony / by George Harbridge, 1820-1826.",1,There are two woodcuts mounted in the journal.,o
3133933,"Memoirs of life and adventure in the Hudson's Bay Company territories, [ca. 1860]",1,Original binding.,o
3134401,"Voyage of H.M.S. Discovery and Chatham : to the northwest coast of America, 1791-1827.",1,"Accompanied by two letters by Thomas Manby, 1821, 1827.",o
3134633,"Expedition to build a Hudson's Bay Company post on the Yukon, 1848 / by Alexander Hunter Murray.",1,"Accompanied by the printed version: Burpee, L. J. ed. Journal of the Yukon, 1847-48. Ottawa: Government Printing Bureau, 1910.",o
3134633,"Expedition to build a Hudson's Bay Company post on the Yukon, 1848 / by Alexander Hunter Murray.",2,Journal-letter and printed version stored in a case.,o
3134833,"Journal of a Voyage of Discovery in the Pacific and Beering's Straits : on board H.M.S. Blossom / by James Wolfe, 1825-1828.",1,Original binding.,o
3135477,"Article written by Samuel J. Parker, M.D. : , son of Rev. Samuel Parker, the original projector of the missions of the American Board of Commissioners for Foreign Missions to Oregon / /by Samuel J. Parker, 1878-1879.",1,"The manuscript was sent to Elwood Evans, September 17, 1882.",o
3135738,"Selections from the Scriptures translated into the Nez Percé language /by Henry Harmon Spalding, 1839-1846.",1,Original bindings.,o
3135738,"Selections from the Scriptures translated into the Nez Percé language /by Henry Harmon Spalding, 1839-1846.",2,An 1874 hospital tax receipt has been placed in the second volume.,o
3136134,"Alvan F. Waller's property /by Alvan F. Waller, 1833-1854.",1,Volume stored in box; typed transcript stored in portfolio.,o
3136272,"Narcisca Prentiss Whitman's Diary / by Narcissa Prentiss Whitman, 1836.",1,The original diary is in the Whitman College Library.,o
3136393,"Letter press copy book, 1860-1869.",1,Original binding.,o
3137266,"Day Book, Nauvoo, Ill. / by William Law, 1841-1842.",1,Original binding.,o
3137324,"Record of Orders, Returns, & Courts Martial &.c. of 2nd Brigade, 1st Division, Nauvoo Legion, Headquarters, 14th Ward G.S.L. City, 1857-1858.",1,Original binding.,o
3137755,"J. M. Sharpe. Private journal /by James M. Sharpe, 1843-1848.",1,Original binding.,o
3140358,"Letterbook, 1846-1847.",1,Original binding.,o
3140900,"Letter : to John Fitch Kinney / by Brigham Young, 1863 Nov 2.",1,Original (in folder 1) restricted; use preservation photocopy (in folder 2).,ao
3141365,"Ordinances, 1841-1843.",1,City seal embossed in lower left corner.,o
3141370,"Letter : to presidents Charles C. Rich and David Fulmer / by Brigham Young, 1847 Jan 25.",1,Original (in folder 1) restricted; use preservation photocopy (in folder 2).,ao
3142013,"Letter : to Colonel Kane / by Brigham Young, 1858 Oct 22.",1,Original (in folder 1) restricted; use preservation photocopy (in folder 2).,ao
3143048,"Letter : to Brigadier General F. D. Richards / by Brigham Young, 1857 Nov 6.",1,Original (in folder 1) restricted; use preservation photocopy (in folder 2).,ao
3143130,"Copy of the proclamation to the inhabitants of California, / by John Drake Sloat, 1846 Jul 7.",1,Accompanied by positive photostat copy from the Huntington Library.,o
3143162,"Record of death & discharges Company ""C"" Ten[n.] Regt...Vol. / by William P. Chambliss, 1847-1848.",1,An envelope at the back of the book contains two letters which give personal information about William P. Chambliss.,o
3144042,"Diary, 1850-1861.",1,Accompanied by a typewritten summary of the diary.,o
3144125,"Mexican War diary, 1846-1847.",1,"The diary was found on the Churubusco Battlefield by Thomas J. Davis on September 21, 1847.",o
3144569,Civil War memoirs.,1,Original binding.,o
3144646,"Journal, 1846-1847.",1,There are 32 loose pages laid in front of the journal.,o
3147504,Narrative,1,"Accompanied by two typescript copies transcribed and edited by Joan Hofmann, 1974.",o
3147629,"Letter : to Major G. W. Baird / by Nelson Appleton Miles, 1891 Nov. 20.",1,An extract (copy) from the War Department files on the evidence and investigation of the Wounded Knee Creek affair accompanies this letter.,o
3150751,"Letter: to his wife, Margaret, /by William H. McFarlin, 1852 Jan 1.",1,Written in Gregory's Express Letterbook with a printed description of the services of Gregory's Express Company.,o
3152609,"Journal of a cruise in U.S. Ship Vincennes. Charles Wilkes Esqre. Commander / by James L. Blair, 1841-1842.",1,Original binding.,o
3152986,"Diary of R. R. [Red River] Survey / by A. R. Booth, 1871-1873.",1,Related map shelved in map collection under no. Double Covers/795/+R249/1871.,o
3153007,"Journal kept by Assistant Surgeon Silas Holmes during a cruise in the U.S. Ship Peacock and Brigs Porpoise and Oregon / by Silas Holmes, 1838-1842.",1,Original bindings.,o
3153403,"Journal of a trip to the Yellowstone Park, 1875.",1,"The official report of the Ludlow expedition was published as: United States War Dept. Report of a Reconnaissance from Carroll...Made in the Summer of 1875, by William Ludlow. Washington, D.C.: Government Printing Office, 1876.",w
3153464,"Letter : to George F. Andrews / by Joseph Crawford King, 1849 Aug 31.",1,Docketed.,o
3153512,"Letter: to the San Francisco Town Council /by James Allen Hardie, 1847 Nov 10.",1,Docketed.,o
3153523,"Letter : to William Allen / by F. M. King, 1849 Feb 1.",1,Docketed.,o
3153544,"Agreement, 1850 Mar 2.",1,Docketed.,o
3153599,"Letter: to the Reverend H. Winslow /by J. H. Post, 1853 Jan 5.",1,Docketed.,o
3153893,O-kee-pa /by George Catlin.,1,"Accompanied by proof sheets of ""Folium Reservatum"" with Catlin's manuscript corrections, copies of revised page proofs with manuscript corrections, and the published London edition.",o
3153893,O-kee-pa /by George Catlin.,2,Original boards.,o
3154152,"Letter: to His Excellency, George N. Briggs, Governor of Massachusetts /by a Committe in behalf of the Church, 1845 Apr 25.",1,Bound volume comprises a typewritten transcript.,o
3154475,"Army episodes and anecdotes; or Life at Vancouver Barracks. The romance and the reality of the frontier /by Thomas McArthur Anderson, 1853-1893.",1,"Chapter 11 which is included in the list of chapters but is not in the manuscript, was probably used by Anderson for his article ""The Vancouver Reservation Case. A Legal Romance,"" Oregon Historical Quarterly. VIII (1907): 219-230.",w
3154774,"Yellowstone expedition journal and related papers, 1818-1949.",1,Original binding.,o
3154774,"Yellowstone expedition journal and related papers, 1818-1949.",2,"Previously attributed to Lieutenant Thomas W. Kavanaugh, and Colonel Henry Atkinson.",a
3154774,"Yellowstone expedition journal and related papers, 1818-1949.",3,"Later holograph note on inside cover reads, ""Kept in the main by Lieut Thomas Kavanaugh of the Forsyth.""",o
3154968,"Memorandum of an agreement, 1849 Jan 27.",1,Probably printed in New York.,a
3155087,"Letter: to Mr. Abram Johns /by Aleksandr Andreevich Baranov, 1816 Oct 16.",1,Translation in a contemporary hand.,o
3155474,"Agreement, 1849 Jan. 27.",1,A broadside describing Gordon's California Association's equipment and terms was printed in 1849 and a copy was owned by Thomas W. Streeter.,w
3155611,"Letter: to  Mr. John Wilson /by Alexander J. Pullman for Daniel Blue, 1859 May 12.",1,Accompanied by 6 pages of a corrected page proof from the second printing of Blue's Narrative.,o
3155656,"Fisk Expedition journal /by Samuel R. Bond, 1862.",1,"The official account published by the government: Expedition from Fort Abercrombie to Fort Benton. 37th Cong., 3d sess. House Ex. Doc. 80.",w
3157064,"History of Indian operations on the Plains, 1866 /by Henry Beebee Carrington.",1,"Accompanied by sections of Margaret I. Carrington's Ab-sa-ra-ka or Wyoming Opened, 6th ed., Philadelphia, 1890, and a map of the scene of the Fetterman massacre.",o
3157172,"Fort Bridger account book, 1865-1869.",1,Original binding.,o
3157291,"Missouri Light Artillery letter book, 1834-1847.",1,Original binding.,o
3157856,"Black Hills narratives, 1874.",1,Original manuscript stored in two folders; typed transcript bound in 1 volume.,o
3158000,"Sketches and surveys made during the exploratory tour of 1857 to Nebraska and Dakota under Lt. G. K. Warren /by Paul Max Engle, 1857.",1,Original binding.,o
